240132,Ms. Marietza Yvette Bauer,H,Marietza Yvette Bauer commented: https://www.facebook.com/6147204570/posts/10155719121924571
240176,Mr. Josue Isaac Bubla,H,View on Linkedin: https://www.linkedin.com/in/josu%C3%A9-bubla-1b787652,Josue Bubla reacted: https://www.facebook.com/211969075486992/posts/1497817750235445
240222,Miss Belinda M Fuentes,H,Belinda Fassold Fuentes reacted: https://www.facebook.com/211969075486992/posts/2311338288883383
240788,Miss Priscilla Ruby Garanzuay,H,Priscilla Ruby Garanzuay commented: https://www.facebook.com/211969075486992/posts/2023766500973898
241189,Mr. Jose G Urbina,H,Jose Urbina reacted: https://www.facebook.com/6147204570/posts/10155791863009571
241505,Ms. Alma Lilia Aguilar,H,Alma Aguilar commented: https://www.facebook.com/211969075486992/posts/1891372827546600
242335,Mrs. Miranda Marie (Donias) Buechner,H,Miranda Donias commented: https://www.facebook.com/6147204570/posts/10155758254594571
242357,Mr. Alan Alexis Galvez,H,View on Linkedin: https://www.linkedin.com/in/alan-alexis-galvez-32ba89107,View on Twitter: https://twitter.com/Alan4Gaga,Alan Alexis Galvez reacted: https://www.facebook.com/211969075486992/posts/3029226560427882
242372,Ms. Kristine Deaver,H,Kristine Deaver reacted: https://www.facebook.com/97044772273/posts/10155084060192274
242380,Ms. Dafne Aileen Oropeza,H,Dafne Oropeza commented: https://www.facebook.com/211969075486992/posts/3614314215252444
242726,Ms. Kim Freeman,H,Kim Freeman commented: https://www.facebook.com/261043174069349/posts/954337924739867
243001,Mrs. Jan A Castellano,E,View on Facebook: https://www.facebook.com/jan.castellano.5,
243124,Mr. Michael "Mickey" Gray,H,View on Linkedin: https://www.linkedin.com/in/mickey-gray-65391a14,Mickey Gray commented: https://www.facebook.com/6147204570/posts/2066049696860707
243603,Mrs. Irma M. (Medrano) Bravo,H,Irma Medrano reacted: https://www.facebook.com/6147204570/posts/10158882317949571
243618,Mrs. Jessica A. Sepulveda,H,View on Linkedin: https://www.linkedin.com/in/jessica-sepulveda-36938962,Jessica Sepulveda commented: https://www.facebook.com/6147204570/posts/10154823679919571
243795,Mrs. Stephanie Lee,H,View on Linkedin: https://www.linkedin.com/in/stephanielee44,Stephanie Lee reacted: https://www.facebook.com/261043174069349/posts/935089549998038
244623,Mr. Leonardo "Leo" Torres,H,Leonardo Torres commented: https://www.facebook.com/6147204570/posts/10157083529574571
244629,Ms. Christina Soliz,H,View on Linkedin: https://www.linkedin.com/in/christina-soliz-85481379,Christina Soliz reacted: https://www.facebook.com/411603895552292/posts/3897372450308735
244869,Ms. Gina Fontenot,E,View on Facebook: https://www.facebook.com/gina.fontenot,View on Linkedin: https://www.linkedin.com/in/ginafontenotrealtor,View on Twitter: https://twitter.com/GinaFontenot,
245889,Mr. Raul Rositas,H,Raul Rositas commented: https://www.facebook.com/126515304094581/posts/986621908411406
245638,Ms. Jennifer L Van,H,Jennifer Van reacted: https://www.facebook.com/211969075486992/posts/3658942210789644
245630,Ms. Siobhan Amanda "Bonnie" Cadena,H,View on Twitter: https://twitter.com/bonnieakabobz,Bonnie Cadena reacted: https://www.facebook.com/126515304094581/posts/3133816900031058
246328,Ms. Valerie A. Reyes,H,Valerie Reyes reacted: https://www.facebook.com/6147204570/posts/10158882310109571
245527,Mr. Keith King,E,View on Facebook: https://www.facebook.com/quovaux,View on Linkedin: https://www.linkedin.com/in/keith-king-8136475a,View on Twitter: https://twitter.com/Keith_NMG,
245529,Mr. Ki Kroll,H,Ki Kroll reacted: https://www.facebook.com/6147204570/posts/276716746851043
245577,Mrs. Candy Sikes,H,View on Linkedin: https://www.linkedin.com/in/candy-sikes-48ba32125,View on Twitter: https://twitter.com/csikes1105,Candy Sikes commented: https://www.facebook.com/97044772273/posts/10156962749897274
245916,Ms. Melinda Lopez,H,Melinda Lopez commented: https://www.facebook.com/211969075486992/posts/2976154942401711
247513,Mr. Cristian Nicholas Morales,H,Cristian Morales reacted: https://www.facebook.com/30277423311/posts/10159590811083312
246119,Ms. Alyssa N Trujillo,H,View on Linkedin: https://www.linkedin.com/in/alyssa-trujillo-980631b1,Alyssa Trujillo reacted: https://www.facebook.com/211969075486992/posts/2807677595916114
246268,Mr. Danny Joshua Espinoza,H,Danny Espinoza reacted: https://www.facebook.com/86774348679/posts/10157751264333680
248226,Ms. June A Villarreal,H,June Villarreal commented: https://www.facebook.com/211969075486992/posts/3647140018636530
248488,Mr. Gabriel Akessler,H,Gabriel Akessler reacted: https://www.facebook.com/86774348679/posts/10157751264333680
248552,Ms. Priscilla Celeste "Celeste" Arellano,H,View on Linkedin: https://www.linkedin.com/in/priscilla-arellano-030658195/,Celeste Arellano reacted: https://www.facebook.com/97044772273/posts/10157452456897274
248750,Ms. Ashley Marie Valdez,H,Ashley Nicole Valdez reacted: https://www.facebook.com/86774348679/posts/10158206553138680
248779,Ms. Liz Moy,H,Liz Moy commented: https://www.facebook.com/86774348679/posts/10157966084088680
248781,Ms. Alyssa M Silvas,H,Alyssa Silvas reacted: https://www.facebook.com/86774348679/posts/10158511341408680
248968,Mr. Alexis E "Alex" Lara,H,Alexis Lara commented: https://www.facebook.com/211969075486992/posts/3773982792618918
249345,Mrs. Amy Martinez,H,Amy Martinez reacted: https://www.facebook.com/211969075486992/posts/3614314215252444
249433,Mr. Marcus Caballero,E,View on Facebook: https://www.facebook.com/marcus.caballero.50,
250105,Ms. Cindy Daniela Luevano,H,Cindy Luevano reacted: https://www.facebook.com/211969075486992/posts/3190800934270443
250146,Ms. Kiana J. Ramirez,H,Kiana Ramirez reacted: https://www.facebook.com/86774348679/posts/10157501576733680
254643,Ms. Catherine M. Lopez,H,View on Twitter: https://twitter.com/mecatherin_2017,Catherine Lopez commented: https://www.facebook.com/211969075486992/posts/3594220877261778
254646,Ms. Lorraine Gonzales,H,Lorraine Gonzales REACTED or ENGAGE: https://www.facebook.com/6147204570/posts/10158482247634571
255079,Ms. Ashleigh Tucker,H,Ashleigh Tucker reacted: https://www.facebook.com/126515304094581/posts/3435240093222069
255132,Ms. Savanna Leigh Harsh,H,View on Linkedin: https://www.linkedin.com/in/ACwAACWpAFkBexHXlGGMpIqqCcrjZ5QX2gGQyZE/,Savanna Harsh reacted: https://www.facebook.com/6147204570/posts/2967262483531172
255245,Mrs. Rachel L. Woolf,H,View on Linkedin: https://www.linkedin.com/in/rachel-woolf-467263110,View on Twitter: https://twitter.com/racheleahwoolf,Rachel Woolf reacted: https://www.facebook.com/332132743905480/posts/1003860170066064
255660,Miss Chelsea D. Longoria,H,Chelsea Longoria reacted: https://www.facebook.com/211969075486992/posts/3655638377786694
255852,Ms. Jazzmine N Barrera,H,Jazzmine Neree Barrera reacted: https://www.facebook.com/6147204570/posts/10159491907584571
255888,Mr. Jeromy Dean Aldridge,H,Jeromy Dean Aldridge reacted: https://www.facebook.com/6147204570/posts/10159259188449571
256387,Mr. Alvin Martinez,H,Alvin Martinez reacted: https://www.facebook.com/126515304094581/posts/4195428407203230
168586,Mr. Ryan G Bustos,H,Ryan Bustos commented: https://www.facebook.com/211969075486992/posts/3658942210789644
99787,Ms. Jessica H. "Jessica H." Tenorio,H,Jessica Tenorio commented: https://www.facebook.com/86774348679/posts/10158684721553680
259004,Ms. Nancy A. Thornton,H,Nancy Thornton commented: https://www.facebook.com/126515304094581/posts/165629918784542
263888,Ms. Sally Grambusch,H,View on Linkedin: https://www.linkedin.com/in/sally-grambusch-48424012,Sally Grambusch reacted: https://www.facebook.com/169297629793385/posts/3942889779100799
264374,Mrs. Nancy E Harsh,H,Nancy Harsh reacted: https://www.facebook.com/6147204570/posts/2967262483531172
267268,Ms. Roxanne Guerrero,H,View on Twitter: https://twitter.com/KallMeRoxy,Roxanne Guerrero reacted: https://www.facebook.com/86774348679/posts/10159617524678680
267652,Mr. William S Regalis,H,William Regalis reacted: https://www.facebook.com/6147204570/posts/10159688776429571