12783,Mr. Tom G. Roseland,H,Tom Roseland commented: https://www.facebook.com/211969075486992/posts/926533084030584
140283,Mr. Enrique Luis "Henry" Barrera,H,Henry Barrera commented: https://www.facebook.com/6147204570/posts/10158233706794571
164403,Mr. Pablo Hernandez,H,Pablo Hernandez reacted: https://www.facebook.com/211969075486992/posts/3209463429070860
89922,Mrs. Jennifer Louise (Blount) MacKaron,E,View on Facebook: https://www.facebook.com/jmackaron,
106867,Ms. Christina Marie Armendariz,H,Christina Armendariz reacted: https://www.facebook.com/126515304094581/posts/3810305169048891
124943,Ms. Sarai E Reyes,H,Sarai Reyes reacted: https://www.facebook.com/86774348679/posts/10157831684233680
144274,Mrs. Aracely Berenice (Rodriguez) Niewenhuis,H,View on Twitter: https://twitter.com/abrodriguez33,Aracely Niewenhuis reacted: https://www.facebook.com/211969075486992/posts/1559021770781709
145081,Miss Katie Lucinda Marie Varner,H,Katie Varner commented: https://www.facebook.com/211969075486992/posts/2885305834819956
155210,Ms. Dorothy Joyce Yan,H,View on Linkedin: https://www.linkedin.com/in/dorothy-yan-5a122b98,Dorothy Yan reacted: https://www.facebook.com/126515304094581/posts/2888202374592513
158088,Mr. Diego Sanchez Arenas,H,Diego Arenas commented: https://www.facebook.com/6147204570/posts/10154819285274571
168661,Ms. Vanessa Abeyta,H,View on Twitter: https://twitter.com/VeeMarie21,Vanessa Abeyta reacted: https://www.facebook.com/198875430209122/posts/1396668500429803
169467,Ms. Virginia Diane Howard,H,Virginia Howard reacted: https://www.facebook.com/97044772273/posts/10153461731332274
176564,Ms. Azucena Pauletth Vega,H,Azucena Vega commented: https://www.facebook.com/211969075486992/posts/3332224773461391
182723,Ms. Brittany Chamel Crawford,H,View on Linkedin: https://www.linkedin.com/in/brittany-crawford-54440563,View on Twitter: https://twitter.com/IAM_BRIDIDDY,Brittany Crawford reacted: https://www.facebook.com/211969075486992/posts/1957854180898464
215920,Mrs. Kerin Pak Dillon,E,View on Facebook: https://www.facebook.com/kerin.dillon,View on Twitter: https://twitter.com/KerinDillon,
232369,Mrs. Ashley Noyola,H,Ashley M Noyola reacted: https://www.facebook.com/261043174069349/posts/780384592135202
232931,Ms. Regina Lynn Deason,H,Regina Deason reacted: https://www.facebook.com/211969075486992/posts/3408382852512249
232940,Ms. Mariana N. Arredondo,H,Mariana Arredondo reacted: https://www.facebook.com/211969075486992/posts/2198542760162937
235222,Mr. Long Dong Ha,E,View on Facebook: https://www.facebook.com/moo.rawr,View on Twitter: https://twitter.com/Viet_boii,
235740,Ms. Patricia Lobo,E,View on Facebook: https://www.facebook.com/patricia.lobo.18,
235840,Ms. Julia Danielle Gehlhaar,H,View on Twitter: https://twitter.com/JuliaDanielleG,Julia Gehlhaar commented: https://www.facebook.com/211969075486992/posts/1268503379833551
31277,Mrs. Jacqueline N. "Jackie" Reed,H,Jackie Reed commented: https://www.facebook.com/126515304094581/posts/986621908411406
39000,Mrs. Ofelia Maldonado Trevino,E,View on Facebook: https://www.facebook.com/ofelia.trevino.9,
96910,Mr. Konstantinos Spiros "Kos" Kalofonos,E,View on Facebook: https://www.facebook.com/thesenior,View on Linkedin: https://www.linkedin.com/in/konstantinos-kalofonos-0ab60518,View on Twitter: https://twitter.com/thesenior,
10016,Mrs. Carol Rae (Yarbrough) Zucker,H,View on Linkedin: https://www.linkedin.com/in/carol-davis-zucker-5a1b32a,Carol Davis Zucker commented: https://www.facebook.com/211969075486992/posts/1712825115401373
100391,Mr. Samuel Nicholas McKernan,E,View on Facebook: https://www.facebook.com/samuel.mckernan,
100475,Ms. Angela Lavine Graham,H,Angela Graham commented: https://www.facebook.com/6147204570/posts/2303783873099756
101721,Ms. Sarah (Friend) Neutze,H,Sarah Vasquez Friend reacted: https://www.facebook.com/211969075486992/posts/3848151968535333
101223,Ms. Annette Graham,H,View on Twitter: https://twitter.com/ag225,Annette Graham reacted: https://www.facebook.com/86774348679/posts/245571616151470
101292,Mrs. Stephanie M. (McClain) Hall,H,View on Linkedin: https://www.linkedin.com/in/stephanie-hall-947297176,Stephanie Hall reacted: https://www.facebook.com/211969075486992/posts/3114385711911966
101720,Ms. Mary Ann Holland,H,Mary Holland reacted: https://www.facebook.com/6147204570/posts/10156915298614571
101897,Mr. Ricky Joe Ruffin,E,View on Facebook: https://www.facebook.com/ricky.ruffin.1,View on Linkedin: https://www.linkedin.com/in/ricky-ruffin-816aa164,
103030,Mr. Richard J. Silva  Jr.,H,Richard Silva commented: https://www.facebook.com/6147204570/posts/10158683816319571
102782,Mr. Troy Wayne Eckhardt,H,Troy Elliott Eckhardt commented: https://www.facebook.com/211969075486992/posts/3714278605256004
10372,Mrs. Nancy Jane (Luna) Tomlinson,H,Nancy Luna reacted: https://www.facebook.com/126515304094581/posts/2728780620534690
104529,Ms. Frances R. Hodge,H,Frances Hodge reacted: https://www.facebook.com/211969075486992/posts/3771726209511243
104675,Ms. Amanda Yaniz Sierra,E,View on Facebook: https://www.facebook.com/amanda.sierra.71,View on Linkedin: https://www.linkedin.com/in/amanda-sierra-55267713a/,
107023,Mr. Somphone Khantharoth,H,Somphone Khantharoth commented: https://www.facebook.com/6147204570/posts/10156817209714571
106652,Mr. Tomas David "Tom" Gonzalez,H,View on Twitter: https://twitter.com/GonzoTom,Tomas Gonzalez reacted: https://www.facebook.com/97044772273/posts/10157452456897274
106970,Mr. Dennis Michael Gray,H,Dennis Gray commented: https://www.facebook.com/261043174069349/posts/310640819109584
108137,Ms. Sharon Ann Fitzpatrick,E,View on Facebook: https://www.facebook.com/mizsfitz,
108388,Mr. Roy Villarreal,H,Roy Villarreal commented: https://www.facebook.com/6147204570/posts/10154438191629571
108286,Ms. Marlene Bonnie Zardenetta,H,Marlene Zardenetta reacted: https://www.facebook.com/86774348679/posts/10156853186008680
108390,Mrs. Lisa (Kypuros) Morris,H,Lisa Kypuros commented: https://www.facebook.com/86774348679/posts/10158366342933680
108756,Ms. Paulina Hinojosa,H,View on Linkedin: https://www.linkedin.com/in/paulina-vidales-hinojosa-2669129a,View on Twitter: https://twitter.com/PHMaz,Paulina Hinojosa reacted: https://www.facebook.com/211969075486992/posts/1389516177732270
109281,Mrs. Venisa Yvette Saenz,H,Venisa Saenz reacted: https://www.facebook.com/6147204570/posts/10154880118879571
109328,Ms. Annette Solano,H,Annette Solano reacted: https://www.facebook.com/126515304094581/posts/819841285438838
109785,Mrs. Sonia (Grover) Tummala,H,Sonia Tummala reacted: https://www.facebook.com/86774348679/posts/10158665628543680
110088,Mrs. Kara Rachelle Gomez,E,View on Facebook: https://www.facebook.com/karargomez,View on Instagram: https://instagram.com/karagomez,View on Linkedin: https://www.linkedin.com/in/karagomez,View on Twitter: https://twitter.com/OpenBookStudios,
109922,Ms. Olivia Loraine Jewell,H,View on Linkedin: https://www.linkedin.com/in/olivia-jewell-884066127,Olivia Jewell commented: https://www.facebook.com/211969075486992/posts/2443264619024082
110829,Mrs. Janet B. Cruz,H,Janet Cruz reacted: https://www.facebook.com/211969075486992/posts/2598024913548051
110956,Mr. Frank Adam Bazan  Jr.,H,Frank Bazan commented: https://www.facebook.com/6147204570/posts/10155794906004571
110387,Ms. Mary Ann Ybarra,H,Mary Morales Ybarra reacted: https://www.facebook.com/6147204570/posts/10154898120294571
111376,Mrs. Roceli Jane "Jeng" (Arellano) Ramon,H,Roceli Ramon reacted: https://www.facebook.com/86774348679/posts/10158344272778680
111387,Mrs. Jessica Rebekah (Betts) Estrada,H,Jessica Estrada reacted: https://www.facebook.com/211969075486992/posts/1559021770781709
111782,Mrs. LaMecia C. Butler McFarland,H,LaMecia Butler McFarland reacted: https://www.facebook.com/86774348679/posts/10159069658903680
111903,Mr. Richard E. "Ricky" Zipprian  Jr.,H,View on Linkedin: https://www.linkedin.com/in/ricky-zipprian-7265ab93,View on Twitter: https://twitter.com/rickyzi_99, Ricky Zipprian engaged: https://www.facebook.com/6147204570/posts/10158882310109571 
111625,Mr. Gary Donald Fagan,E,View on Facebook: https://www.facebook.com/gary.fagan.77,View on Twitter: https://twitter.com/gary502,
111963,Mr. Tomas Andres Valdez,H,Tomas Valdez reacted: https://www.facebook.com/86774348679/posts/10157688814898680
112520,Ms. Michele Ann Cantu,H,View on Linkedin: https://www.linkedin.com/in/michele-cantu-35a9168,Michele Cantu reacted: https://www.facebook.com/198875430209122/posts/1865042566925725
112474,Mr. Robert Z. Handy,H,Robert Handy REACTED or ENGAGE: https://www.facebook.com/126515304094581/posts/3244264128986334
112979,Ms. Jessica Ann Romero,H,Jessica Anne Romero reacted: https://www.facebook.com/211969075486992/posts/2483913434959200
113102,Mr. Kristopher Michael "Kris" Morales,H,View on Linkedin: https://www.linkedin.com/in/kris-morales-75996630,View on Twitter: https://twitter.com/kmorales6603,Kris Morales commented: https://www.facebook.com/86774348679/posts/10158782538613680
113236,Mr. Kevin Lamar Rhoden,H,Kevin Rhoden commented: https://www.facebook.com/6147204570/posts/329741211093027
113259,Mr. Bryan Carlos Gutierrez,H,View on Linkedin: https://www.linkedin.com/in/bryan-gutierrez-2650095,View on Twitter: https://twitter.com/BRYANGUTIE,Bryan Gutierrez commented: https://www.facebook.com/6147204570/posts/10151155613199571
113726,Mr. Steven Bruce Mays,H,Steven Alexander Mays commented: https://www.facebook.com/198875430209122/posts/1390151747748145
112866,Mr. Vince Jacob Frausto,H,View on Linkedin: https://www.linkedin.com/in/vince-frausto-a929b689,View on Twitter: https://twitter.com/Ann186Val,Vince Frausto commented: https://www.facebook.com/198875430209122/posts/1470997232996929
113996,Ms. Jo Ann Rodriguez,H,Jo Rodriguez reacted: https://www.facebook.com/211969075486992/posts/3594220877261778
114195,Ms. Kristina K. Elizondo,H,Kristina Elizondo reacted: https://www.facebook.com/211969075486992/posts/1508787339138486
115445,Ms. Terri Lynn Davis,H,Terri Davis commented: https://www.facebook.com/211969075486992/posts/1728757470474804
11493,Ms. Susan Darlene (Hines) Kesler,H,Susan Schlorman Kesler reacted: https://www.facebook.com/211969075486992/posts/2598024913548051
115727,Mr. Fidel Alfonso Pena,E,View on Facebook: https://www.facebook.com/fidel.pena.792,
116113,Mr. Michael Zane Cardenas,H,Michael Cardenas commented: https://www.facebook.com/6147204570/posts/10158971770099571
116410,Ms. Nadia Melissa Sanchez,H,View on Linkedin: https://www.linkedin.com/in/nadia-sanchez-328a4699,Nadia Sanchez reacted: https://www.facebook.com/211969075486992/posts/3171774162839787
117107,Mr. Damon Anthony Garcia,H,View on Linkedin: https://www.linkedin.com/in/damongarcia,Damon Garcia reacted: https://www.facebook.com/198875430209122/posts/329086100993254
118153,Mr. David James Faunce,H,David Faunce commented: https://www.facebook.com/6147204570/posts/146673282141878
118487,Ms. Patricia "Michelle" Dart,H,View on Twitter: https://twitter.com/DartDragon,Michelle Olvera Dart reacted: https://www.facebook.com/411603895552292/posts/3983689685010344
120831,Miss Analicia Lenor Jaramillo,H,Analicia Jaramillo reacted: https://www.facebook.com/86774348679/posts/10158199171508680
121483,Mr. Marlon D. Anderson,H,View on Linkedin: https://www.linkedin.com/in/marlon-anderson-689b09b,Marlon Anderson invited: https://www.facebook.com/6147204570/posts/10151074635309571
122164,Mr. Kurtis Lawrence Johnson,H,Kurtis Johnson commented: https://www.facebook.com/211969075486992/posts/1521969331153620
122825,Mr. Viresh Thusu,E,View on Facebook: https://www.facebook.com/viresh.thusu,
124117,Maj. Nicole M Ferguson,H,Nicole Ferguson reacted: https://www.facebook.com/211969075486992/posts/2938614276155778
123899,Ms. Anna E. "Ana" Castro,E,View on Facebook: https://www.facebook.com/aecastro,View on Linkedin: https://www.linkedin.com/in/anna-castro-loan-officer,View on Twitter: https://twitter.com/aecastro07,
12426,Mrs. Linda Massey (Cherry) Denson,E,View on Facebook: https://www.facebook.com/lmdenson,
12471,Mrs. Mary Perales Bustillo,H,Mary Bustillo reacted: https://www.facebook.com/6147204570/posts/10155023783529571
124715,Ms. Sydney Alyssa Monsen,H,Sydney Monsen REACTED or ENGAGE: https://www.facebook.com/411603895552292/posts/3757117557667559
125080,Ms. Zelda Eliza Sendejo,H,Zelda Sendejo commented: https://www.facebook.com/86774348679/posts/10158514453503680
125812,Ms. Peggy Lee Hendrick,H,View on Twitter: https://twitter.com/karilog,Peggy Hendrick commented: https://www.facebook.com/211969075486992/posts/1231616136855609
125925,Mrs. Christina C (Chavez) Perez,H,View on Twitter: https://twitter.com/christinperez09,Christina Rivera Chavez reacted: https://www.facebook.com/211969075486992/posts/3190800934270443
127345,Ms. Jacqueline Smith,H,Jacqueline Smith reacted: https://www.facebook.com/86774348679/posts/10159287020503680
12744,Mrs. Charlene Froboese (Froboese) Smoot,H,View on Linkedin: https://www.linkedin.com/in/charlene-smoot-3195ab1a,Charlene Froboese Smoot commented: https://www.facebook.com/97044772273/posts/10151483244512274
127626,Mr. Majed A Hajj,H,Majed Hajj commented: https://www.facebook.com/105308188973/posts/10154953456433974
127988,Mrs. Monique Antoynette Broadnax,H,Monique Cannon Broadnax going: https://www.facebook.com/261043174069349/posts/688535207986808
128051,Mrs. Julia Anne (Sheppard) Hvass,H,Julia Sheppard Hvass reacted: https://www.facebook.com/6147204570/posts/10159491907584571
128368,CMDR Mike Chapline,H,View on Linkedin: https://www.linkedin.com/in/mike-chapline-92814516,Mike Chapline commented: https://www.facebook.com/261043174069349/posts/310640819109584
128555,Mr. Paul Larkin,H,View on Twitter: https://twitter.com/pgtlpaul,Paul Larkin reacted: https://www.facebook.com/6147204570/posts/283163072365496
129107,Mr. Matthew Brett Swann,E,View on Facebook: https://www.facebook.com/swannmb,
129483,Mrs. Lisa Monique (Martin) Ortega,H,Lisa Ortega reacted: https://www.facebook.com/86774348679/posts/10157710196563680
130005,Ms. Lea Christine Arndt,H,View on Linkedin: https://www.linkedin.com/in/lea-arndt-2b1041123,Lea C. Arndt REACTED or ENGAGE: https://www.facebook.com/86774348679/posts/10158626879308680
133708,Mrs. Janice Anne "Jan" Davis,H,Jan M Davis reacted: https://www.facebook.com/211969075486992/posts/1351525604864661
134859,Mr. Jason Adam Merrell,E,View on Facebook: https://www.facebook.com/jason.a.merrell,View on Linkedin: https://www.linkedin.com/in/jasonmerrell,View on Twitter: https://twitter.com/jasonmerrell,
13524,Mrs. Pauline (Reyes) Sanders,H,Pauline Sanders commented: https://www.facebook.com/97044772273/posts/10153461799972274
137688,Ms. Adrienne Laura Moreno,H,View on Linkedin: https://www.linkedin.com/in/adrienne-moreno-183a8052,View on Twitter: https://twitter.com/AdrienneMoreno1,Adrienne Moreno reacted: https://www.facebook.com/211969075486992/posts/3393143930702808
138842,CAPT Christopher Ryan Boney,H,View on Linkedin: https://www.linkedin.com/in/christopher-boney-1121b875,Christopher Boney reacted: https://www.facebook.com/211969075486992/posts/2545496395467570
138309,Ms. Jennifer Nicole Marshall,H,Jennifer Marshall reacted: https://www.facebook.com/211969075486992/posts/3045763062107565
138786,Ms. Marina Ann Martinez,H,Marina Martinez reacted: https://www.facebook.com/211969075486992/posts/3045763062107565
139658,Ms. Sandra Walker Parks,H,Sandra Parks reacted: https://www.facebook.com/211969075486992/posts/3112000062150531
139730,Ms. Ann B. Pruski,H,Ann Breed Pruski reacted: https://www.facebook.com/211969075486992/posts/3307040569313145
140111,Ms. Denise Ariadna Aguilar,H,Denise Aguilar reacted: https://www.facebook.com/6147204570/posts/10156798301269571
140497,Ms. Jessica Leigh Findell,E,View on Facebook: https://www.facebook.com/jessica.findell,View on Instagram: https://instagram.com/chicsongbird,View on Linkedin: https://www.linkedin.com/in/jessicafindell,View on Twitter: https://twitter.com/chicsongbird,
140564,Mr. Christopher "Chris" Escamilla,H,Christopher Escamilla reacted: https://www.facebook.com/6147204570/posts/10154845505674571
141179,Ms. Melissa Grace Ozuna,H,View on Linkedin: https://www.linkedin.com/in/melissa-ozuna-1b691264,View on Twitter: https://twitter.com/msportsjunkie,Melissa Ozuna reacted: https://www.facebook.com/86774348679/posts/10158134763088680
141484,Dr. Joycelyn Moody,H,View on Linkedin: https://www.linkedin.com/in/joycelyn-moody-8029262b,Joycelyn Moody commented: https://www.facebook.com/126515304094581/posts/195950018665114
141005,Mrs. Robin Lewis Smith,H,Robin Smith commented: https://www.facebook.com/211969075486992/posts/2432532393430638
141428,Mr. Paul David Crouser,H,View on Linkedin: https://www.linkedin.com/in/paul-crouser-997532102,Paul Crouser commented: https://www.facebook.com/211969075486992/posts/1132038640146693
141824,Mrs. Pauline (Grothues) Janert,E,View on Facebook: https://www.facebook.com/pauline.janert,
142046,Mr. Jesse T. Chavez,H,Jesse Chavez reacted: https://www.facebook.com/211969075486992/posts/1712751382075413
14234,Mrs. Sandra R. Liska,H,View on Linkedin: https://www.linkedin.com/in/sandra-liska-a9a43239,Sandra Wolff Liska commented: https://www.facebook.com/6147204570/posts/10155936946824571
142109,Mr. Craig Hughes Evans,H,View on Linkedin: https://www.linkedin.com/in/craig-evans-17b0028,Craig Evans commented: https://www.facebook.com/211969075486992/posts/2532114623472414
142304,Mrs. Kay E Nussbaum,H,Kay Nussbaum commented: https://www.facebook.com/211969075486992/posts/1229053047111918
142933,Ms. Stella Anne Garza,H,Stella Garza reacted: https://www.facebook.com/6147204570/posts/10158971770099571
143479,Mr. Louis Edward Scott  Jr.,H,View on Twitter: https://twitter.com/louisscott8,Louis Scott commented: https://www.facebook.com/211969075486992/posts/1082921275058430
143537,Ms. Sarah L. Bierschwale,H,Sarah Bierschwale reacted: https://www.facebook.com/211969075486992/posts/3594220877261778
144148,Ms. Lucy Guevara,H,Lucy Guevara reacted: https://www.facebook.com/211969075486992/posts/2493604380656772
146335,Ms. Amy Hawkins,H,View on Linkedin: https://www.linkedin.com/in/amy-hawkins-9a812052,View on Twitter: https://twitter.com/amyhawk0321,Amy Waugh Hawkins reacted: https://www.facebook.com/211969075486992/posts/1508787339138486
147151,Mr. Kevin Damian Patoc,E,View on Facebook: https://www.facebook.com/kpatoc,View on Twitter: https://twitter.com/KevinPatoc,
147384,Ms. Valerie Nadine Salinas,H,Valerie Salinas reacted: https://www.facebook.com/211969075486992/posts/1944344965582719
148027,Ms. Erika Romero,H,Erika Romero reacted: https://www.facebook.com/97044772273/posts/10155458039622274
14816,Mr. John H. Krueger  Jr.,H,John Krueger commented: https://www.facebook.com/198875430209122/posts/1263040723792582
148727,Mr. Dana Delao,E,View on Facebook: https://www.facebook.com/dana.delao,
149236,Mrs. Samantha Ann "Sam" Blackburn,H,View on Linkedin: https://www.linkedin.com/in/samanthablackburn,Samantha Blackburn commented: https://www.facebook.com/331823501154/posts/111685032195887
149477,Mrs. Mary Lester Zeigler,H,Mary Lester Zeigler commented: https://www.facebook.com/6147204570/posts/10151151355789571
149948,Mr. Michael J Neu II,H,View on Linkedin: https://www.linkedin.com/in/michael-j-neu-b264a638,Michael J. Neu commented: https://www.facebook.com/86774348679/posts/10157487937888680
15004,Mr. John N. Edmundson,H,John Edmundson commented: https://www.facebook.com/211969075486992/posts/1135141479836409
151164,Ms. Lynda Elaine Sturges,H,View on Linkedin: https://www.linkedin.com/in/lynda-byerly-sturges-10152413,Lynda Byerly Sturges reacted: https://www.facebook.com/211969075486992/posts/2598024913548051
150906,Ms. Ashley Nicole Olivier,H,View on Instagram: https://instagram.com/jolyntexas,View on Twitter: https://twitter.com/ashleynolive,Ashley Olivier reacted: https://www.facebook.com/86774348679/posts/10156515319778680
153147,Mrs. Sylvia A. Smith,H,Sylvia Smith reacted: https://www.facebook.com/86774348679/posts/10157599822743680
153482,Mrs. Lisa T Ward,E,View on Facebook: https://www.facebook.com/lisa.ward.56027,
155591,Ms. Nancy J. Neal,H,View on Twitter: https://twitter.com/texasnonny,Nancy Neal commented: https://www.facebook.com/86774348679/posts/10151294908583680
155843,Mr. Jason Tovey,E,View on Facebook: https://www.facebook.com/jason.p.tovey,
157212,Ms. Dominique De'Bograh Pope,E,View on Facebook: https://www.facebook.com/babyGirlNique,View on Linkedin: https://www.linkedin.com/in/dominique-pope-ctpm-28a49525,View on Twitter: https://twitter.com/ddaniellepope,
155893,Mr. Julian Rivera,H,Julian Rivera commented: https://www.facebook.com/126515304094581/posts/446901210057463
155977,Mr. Ahmed Habib,H,Ahmed Habib commented: https://www.facebook.com/331823501154/posts/10150227864936155
157775,Mr. Brian T. Abshier,H,Brian Abshier commented: https://www.facebook.com/86774348679/posts/10157665042038680
159061,Mrs. Hailey (Hall) Davis,H,Hailey Davis reacted: https://www.facebook.com/86774348679/posts/10157027894298680
159607,Ms. Cynthia Anne "Cindy" Roberts,H,Cindy Roberts reacted: https://www.facebook.com/30277423311/posts/10161355976638312
159888,Mrs. Hattie Ray (Delgado) Schweitzer,H,Hattie Schweitzer commented: https://www.facebook.com/198875430209122/posts/1380474455382541
160314,Mrs. Mary Spradley,H,Mary Spradley commented: https://www.facebook.com/198875430209122/posts/1511547332275252
160339,Ms. Brittany Baston,H,Brittany Baston reacted: https://www.facebook.com/211969075486992/posts/1508787339138486
159571,Mr. Ricky White,H,Ricky White commented: https://www.facebook.com/6147204570/posts/10159259188449571
159809,Ms. Jackie Nance,E,View on Facebook: https://www.facebook.com/jackie.nance.7,View on Linkedin: https://www.linkedin.com/in/jacqueline-nance-b6a0682a,
160266,Mr. Corey "KC" Koellein,H,KC Koellein commented: https://www.facebook.com/211969075486992/posts/3732520016765196
160602,Ms. Minerva Morales,H,Minerva Morales reacted: https://www.facebook.com/211969075486992/posts/1530274066989813
160603,Mr. Andy Nam Mori,E,View on Facebook: https://www.facebook.com/andy.mori.5,View on Linkedin: https://www.linkedin.com/in/ACwAAA5A4o8BP_M0TiOBEZnnz8hbcgzQZf-MZOY/,
160814,Ms. Lisa Davis,H,Lisa Davis reacted: https://www.facebook.com/126515304094581/posts/2739815779431174
160383,Ms. Farrah J. Manthei,H,Farrah Manthei commented: https://www.facebook.com/6147204570/posts/10150115138264571
16085,Mrs. Diann Ashford (Nichols) Grimes,E,View on Facebook: https://www.facebook.com/diann.grimes,View on Linkedin: https://www.linkedin.com/in/diann-grimes-1b9b3415,
161870,Mr. Carlos Gerardo Saenz,E,View on Facebook: https://www.facebook.com/CarlosGerardoSaenz,View on Linkedin: https://www.linkedin.com/in/saenzcarlos,View on Twitter: https://twitter.com/carlossaenzbari,
162092,Ms. Raquel L Escobar,H,Raquel Ramos Escobar reacted: https://www.facebook.com/211969075486992/posts/2185257314824815
161437,Ms. Brady Alexandra Garza,H,View on Linkedin: https://www.linkedin.com/in/brady-garza-44049011a,Brady A. Garza commented: https://www.facebook.com/6147204570/posts/10156798301269571
161867,Ms. Josie Michelle Ruiz,H,Josie Ruiz commented: https://www.facebook.com/97044772273/posts/10155919676752274
162024,Mr. Nirav V Bhakta,E,View on Facebook: https://www.facebook.com/nirav521,View on Linkedin: https://www.linkedin.com/in/nirav-bhakta-60186721,View on Twitter: https://twitter.com/nirav521,
163117,Mrs. Diana (Macias) Macias Ollervidez,H,Diana Macias reacted: https://www.facebook.com/126515304094581/posts/1011882392521322
16330,Mr. Mose Meyer Munro,H,View on Twitter: https://twitter.com/mosemansa,Mose Munro commented: https://www.facebook.com/211969075486992/posts/3408382852512249
163917,Mrs. Irma Leticia (Sanchez) Cevallos,H,Irma Cevallos commented: https://www.facebook.com/6147204570/posts/10155693462974571
164066,Mrs. Laurie A. Hill-Chapman,H,Laurie Hall Hill-Chapman commented: https://www.facebook.com/198875430209122/posts/947637628666228
164438,Ms. Vicki Graham,E,View on Facebook: https://www.facebook.com/vicki.graham.7503,View on Linkedin: https://www.linkedin.com/in/vicki-graham-42089712,
164568,Ms. Nicole Kirsten Chavez,H,Nicole Chavez going: https://www.facebook.com/211969075486992/posts/1930635286953687
164644,Mr. Vince Monzingo,H,Vince Monzingo commented: https://www.facebook.com/86774348679/posts/10155804406143680
164949,Ms. Andrea Nichols,H,Andrea Nichols reacted: https://www.facebook.com/140062069348988/posts/3139590879396077
166692,Mr. Dean Pantzar,H,View on Linkedin: https://www.linkedin.com/in/dean-pantzar-cpa-33285b9,Dean Pantzar commented: https://www.facebook.com/6147204570/posts/10154555603614571
166559,Mrs. Lucy C. (Cavazos) Villegas,H,Lucy Sandoval Villegas reacted: https://www.facebook.com/187658316064/posts/10155410378316065
167876,Ms. Druscilla Asinette Flores,H,Druscilla Flores reacted: https://www.facebook.com/332132743905480/posts/502418603543559
167526,Miss Anna Escobedo,H,Anna Escobedo reacted: https://www.facebook.com/211969075486992/posts/3594220877261778
167536,Ms. Olga Y. Cano,E,View on Facebook: https://www.facebook.com/oycano,View on Twitter: https://twitter.com/texasduque,
168630,Mr. Mario (Sanchez) Trejo,E,View on Facebook: https://www.facebook.com/mario.trejo.9237,
168292,Mr. Sean R. Jackson,H,Sean Jackson commented: https://www.facebook.com/211969075486992/posts/2598024913548051
169733,Mr. Michael Laron McClain,H,Michael McClain commented: https://www.facebook.com/211969075486992/posts/1344503725566849
169735,Mr. Kenneth Robert McCright,H,Kenneth McCright commented: https://www.facebook.com/198875430209122/posts/1495771013852884
170394,Mr. Bernard Wilson,H,Bernard Wilson reacted: https://www.facebook.com/6147204570/posts/10154822413979571
