100760,Mrs. Amy Doyle,H,View on Linkedin: https://www.linkedin.com/in/amy-doyle-3a5496134,Amy Doyle reacted: https://www.facebook.com/211969075486992/posts/3168891259794744
100933,Mrs. Denise Marie (Moeller) Gonzales,H,Denise Moening Gonzales reacted: https://www.facebook.com/211969075486992/posts/3393143930702808
163106,Ms. April Stowers,H,April Stowers liked: https://www.facebook.com/6147204570/posts/10156180267094571
222044,Mrs. Karla M. Phipps,H,Karla Michele Phipps commented: https://www.facebook.com/169297629793385/posts/1732319236824542
109460,Ms. Andraya Michonne Young,H,View on Linkedin: https://www.linkedin.com/in/andraya-young-722352a,Andraya Young liked: https://www.facebook.com/6147204570/posts/10155180372304571
112296,Mrs. Sandra Ann Boone,H,Sandra Boone liked: https://www.facebook.com/6147204570/posts/10155830337939571
135569,Mr. Chris Clements,H,View on Linkedin: https://www.linkedin.com/in/chris-clements-1710921,Chris Clements liked: https://www.facebook.com/97044772273/posts/10156527108227274
168699,Ms. Sheila Patricia Alvarado,E,View on Facebook: https://www.facebook.com/sheila.m.alvarado.3,
173683,Mrs. Rebecca Rivera,H,View on Linkedin: https://www.linkedin.com/in/rebecca-rivera-06671050,Rebecca Guerra- Rivera commented: https://www.facebook.com/6147204570/posts/292487745407721
198248,Ms. Shirley A. Montalvo,H,Shirley Ann Montalvo liked: https://www.facebook.com/140062069348988/posts/4054136344608188
199536,Mr. Azamat I. Kasymov,H,Azamat Kasymov liked: https://www.facebook.com/30277423311/posts/10155520788513312
214021,Ms. Kathleen Blanton,H,Kathleen Bond Blanton liked: https://www.facebook.com/211969075486992/posts/3597061223644410
218782,Ms. Alicia N. Negrete,H,Alicia Negrete liked: https://www.facebook.com/211969075486992/posts/3771726209511243
221344,Mr. Alex Bradley Sundin,H,Alex Sundin liked: https://www.facebook.com/140062069348988/posts/3727452497276576
224910,Ms. Christina M Ogier,H,Christina Ogier reacted: https://www.facebook.com/198875430209122/posts/1816512928445356
226254,Ms. Morgan Spaulding,H,View on Twitter: https://twitter.com/_DrBarbann,Morgan Spaulding liked: https://www.facebook.com/211969075486992/posts/1388537067830181
226886,Ms. Gabrielle Pincomb,H,Gabrielle Pincomb liked: https://www.facebook.com/97044772273/posts/10155799640622274
229029,Mr. Alexis Adrian Guerra,H,Alexis Guerra liked: https://www.facebook.com/6147204570/posts/10156184559884571
100296,Dr. Lilia Estela "Lily" (Martinez) Cyr DDS,H,Lilia Cyr liked: https://www.facebook.com/211969075486992/posts/2023635394320342
100360,Mr. John Michael Hopkins,H,John Michael Hopkins liked: https://www.facebook.com/6147204570/posts/10159688776429571
100091,Mrs. Karin Patricia Nelson,H,View on Linkedin: https://www.linkedin.com/in/karin-nelson-a906bb46,Karin Rudisill Nelson liked: https://www.facebook.com/6147204570/posts/821659775064836
100334,Mr. Orlando Xavier Salinas,H,Orlando Salinas liked: https://www.facebook.com/6147204570/posts/1396671917096128
101441,Mrs. Jennifer L. (DeCock) Echtle,H,Jennifer DeCock Echtle liked: https://www.facebook.com/211969075486992/posts/3587164724634060
101284,Mrs. Michelle Richardson,H,Michelle Richardson reacted: https://www.facebook.com/126515304094581/posts/2791275364482133
102534,Mrs. Crystal (Ward) Darby,E,View on Facebook: https://www.facebook.com/Crystaldarby,View on Linkedin: https://www.linkedin.com/in/crystaldarby,View on Twitter: https://twitter.com/crystaldarby,
102747,Mrs. Sherry Ann (Jarmon) Brown,E,View on Facebook: https://www.facebook.com/sherry.brown.5496,
103214,Mrs. Miriam C. Solis,E,View on Facebook: https://www.facebook.com/miriam.solis.169,
103300,Mr. Richard Bravo,H,Richard Alexander Bravo liked: https://www.facebook.com/211969075486992/posts/3363145337036001
104673,Mr. Charles Martinez,H,Charles Martinez liked: https://www.facebook.com/211969075486992/posts/989098427774049
104893,Mrs. Kathy Scott,H,Kathy Scott liked: https://www.facebook.com/211969075486992/posts/1344503725566849
106683,Mr. Scott A Mann,H,Scott Mann commented: https://www.facebook.com/211969075486992/posts/2454378634579347
106717,Mrs. Yesenia D. (Lamas) Rodriguez,H,Yesenia Rodriguez liked: https://www.facebook.com/211969075486992/posts/1209040532446503
106924,Mr. Philip R Hayden,E,View on Facebook: https://www.facebook.com/philip.l.hayden.5,View on Linkedin: https://www.linkedin.com/in/philiphayden,View on Twitter: https://twitter.com/plh144,
107944,Ms. Ruby Ann Hernandez,H,Ruby Hernandez liked: https://www.facebook.com/211969075486992/posts/2725457474138127
107648,Mrs. Nicole Delacruz (Valadez) Moreno,H,Nicole Valadez liked: https://www.facebook.com/86774348679/posts/10159578603298680
108658,Mr. Randy W. Lim,H,Lim Randy liked: https://www.facebook.com/211969075486992/posts/3185844604766076
108798,Mrs. Yvonne R. Litteral,H,View on Linkedin: https://www.linkedin.com/in/yvonne-litteral-6299629,Yvonne Ramirez Litteral liked: https://www.facebook.com/6147204570/posts/10158956553829571
108602,Ms. Brenda A. Salinas,H,Brenda Salinas reacted: https://www.facebook.com/211969075486992/posts/3474986559185211
108638,Mr. Ernest Fernandez,H,Ernest Fernandez liked: https://www.facebook.com/211969075486992/posts/3185844604766076
109092,Mrs. Delma Denise (Barrera) Olivarez,H,View on Linkedin: https://www.linkedin.com/in/delma-d-olivarez-b22296a7,Delma Olivarez liked: https://www.facebook.com/86774348679/posts/10157246765743680
109866,Ms. Amy Beth Reyna,H,Amy Reyna liked: https://www.facebook.com/211969075486992/posts/1990769970940218
109474,Mrs. Crystal Lynn (Carter) Hildebrand CPA,H,View on Linkedin: https://www.linkedin.com/in/crystal-carter-2b6b796,View on Twitter: https://twitter.com/Carter_Crystal,Crystal Carter Hildebrand liked: https://www.facebook.com/86774348679/posts/10158979720028680
110006,Mrs. Jessica Lorraine (Deal) Tidwell,H,View on Linkedin: https://www.linkedin.com/in/jessica-tidwell-b374a37,Jessica Tidwell liked: https://www.facebook.com/86774348679/posts/323386024880014
110454,Ms. Mary Eileen Delaney,H,View on Twitter: https://twitter.com/mdelaney78,Mary Delaney liked: https://www.facebook.com/6147204570/posts/10155794906004571
110814,Ms. Monica Alonzo,H,Monica Alonzo liked: https://www.facebook.com/211969075486992/posts/3465196393497561
110467,Ms. Annette Lorraine Livas,H,Annette Livas liked: https://www.facebook.com/86774348679/posts/10159531256808680
111413,Mrs. Judi Marie (Gonzalez) Lunstrum,E,View on Facebook: https://www.facebook.com/judi.lunstrum,
111415,Mrs. Flo (Gonzalez) Gonzalez-Flores,H,Flo Gonzalez-Flores commented: https://www.facebook.com/86774348679/posts/10159634988958680
112623,Miss Summer C. McAfee,H,Summer McAfee liked: https://www.facebook.com/211969075486992/posts/2625402630810279
113061,Mr. Mark Anthony Palumbo,H,View on Linkedin: https://www.linkedin.com/in/mark-palumbo-48a46b13,Mark Palumbo liked: https://www.facebook.com/6147204570/posts/10154659109854571
113334,Ms. Kimberly Jean Salinas,H,Kimberly Salinas liked: https://www.facebook.com/86774348679/posts/10154255318358680
113555,Mr. Johnny Lopez,H,View on Linkedin: https://www.linkedin.com/in/john-lopez-81b1a724,View on Twitter: https://twitter.com/HDRIDER1955,Johnny Lopez liked: https://www.facebook.com/6147204570/posts/10158860980054571
112967,Ms. Laura A Rubalcava,E,View on Facebook: https://www.facebook.com/laura.a.rubalcava,View on Linkedin: https://www.linkedin.com/in/laura-rubalcava-psyd-ma-ma-711a8569,View on Twitter: https://twitter.com/LauraRubalcava1,
113609,Mr. Frank Dimas Aguero III,H,Frank Aguero liked: https://www.facebook.com/6147204570/posts/10159689764284571
114207,Ms. Lori Ann Atkinson,H,View on Twitter: https://twitter.com/tweet2celebrate,Lori Atkinson liked: https://www.facebook.com/198875430209122/posts/1396602290436424
114437,Mr. Jason Benavides,E,View on Facebook: https://www.facebook.com/jason.benavides,View on Linkedin: https://www.linkedin.com/in/jason-benavides-7a14b74,View on Twitter: https://twitter.com/OctaneAP,
114076,Ms. Ines Mercedes Rodriguez,H,Ines Rodriguez liked: https://www.facebook.com/211969075486992/posts/3274938972523305
115117,Mr. Thomas Michael Fitzpatrick,H,View on Twitter: https://twitter.com/tommytom007007,Thomas Fitzpatrick liked: https://www.facebook.com/211969075486992/posts/1101712419845982
115400,Ms. Dorothy Jame Keys,E,View on Facebook: https://www.facebook.com/dorothy.keys.79,
115684,Mr. Fabian Lorenzo Sanchez,H,Fabian Sanchez liked: https://www.facebook.com/211969075486992/posts/3594220877261778
115758,Mr. David Eugene Kee,H,David Kee reacted: https://www.facebook.com/97044772273/posts/10156157171212274
116254,Ms. Bernadette Marie "Marie" Herbeck,H,Bernadette Herbeck liked: https://www.facebook.com/6147204570/posts/10158933900824571
116926,Mr. Jerrod Nathan Fendley,H,Jerrod Fendley liked: https://www.facebook.com/6147204570/posts/10154845547434571
117014,Mr. Randy Michael Juelg,H,View on Linkedin: https://www.linkedin.com/in/randy-juelg-mba,Randy Juelg liked: https://www.facebook.com/6147204570/posts/10154822413979571
116732,Mrs. Lovell Marie Gatherer,H,Lovell Ramirez Gatherer liked: https://www.facebook.com/211969075486992/posts/1712825115401373
117089,Mr. Nestor B. Esquivel,H,Nestor Esquivel commented: https://www.facebook.com/211969075486992/posts/1343798058970749
117148,Mr. Mario David Romero,E,View on Facebook: https://www.facebook.com/mario.romero.77,
117840,Mrs. Magdalena Cristal (Mata) Bustillos,H,Magdalena Mata liked: https://www.facebook.com/211969075486992/posts/3897234713627058
117932,Mrs. Lisa Ann (Taylor) Gonzalez,H,Lisa Atkison Taylor liked: https://www.facebook.com/211969075486992/posts/3587164724634060
117900,Mr. Lee Wilson Todesco,H,Lee Todesco liked: https://www.facebook.com/6147204570/posts/10159259188449571
117958,Mr. Felix Mireles Torres,E,View on Facebook: https://www.facebook.com/felix.torres.33886305,
118136,Mrs. Sonya M. Jolivette,H,Sonya Jolivette liked: https://www.facebook.com/211969075486992/posts/3092847857399085
119286,Mr. Larry Darnell Lipsey,H,Larry Lipsey liked: https://www.facebook.com/6147204570/posts/10157105728059571
118485,Ms. Anabel Morales,H,Anabel Ramirez Morales liked: https://www.facebook.com/86774348679/posts/10158514453503680
119058,SSG Melissa Garza Zamora,H,View on Linkedin: https://www.linkedin.com/in/taylor-zamora-73922a100,View on Twitter: https://twitter.com/adventurousteen,Melissa Anne Zamora liked: https://www.facebook.com/211969075486992/posts/3900596899957506
119339,Mr. Enrique S Valdez,H,Enrique S Valdez liked: https://www.facebook.com/211969075486992/posts/3455592744457926
120624,Ms. Erica E. Campos,H,Erica E. Campos liked: https://www.facebook.com/50698324373/posts/10158008188539374
121591,Ms. Deadra Jillian Bandy,E,View on Facebook: https://www.facebook.com/Dea1nOnly,View on Linkedin: https://www.linkedin.com/in/deadra-bandy-72b16936,View on Twitter: https://twitter.com/deajess2,
122485,Ms. Elsa Flores Ortiz,H,View on Linkedin: https://www.linkedin.com/in/elsa-ortiz-61063131,Elsa Flores Ortiz liked: https://www.facebook.com/86774348679/posts/10158531447178680
122319,Mr. Andy Martinez,H,Andy Martinez liked: https://www.facebook.com/211969075486992/posts/1559241294093090
122383,Mr. Marques J. Mitchell,H,Marques Mitchell reacted: https://www.facebook.com/6147204570/posts/10159688776429571
122873,Ms. Chandra Leigh Valdez,E,View on Facebook: https://www.facebook.com/chandra.valdez,View on Twitter: https://twitter.com/chandra915,
122931,Mr. Phillip Cletis Washington  Jr.,H,View on Linkedin: https://www.linkedin.com/in/phillipwashingtonjr,Phillip Washington reacted: https://www.facebook.com/6147204570/posts/10159261821319571
123039,Mr. Jeffrey B. Woodward,H,Jeffrey Woodward liked: https://www.facebook.com/86774348679/posts/10158344272778680
123084,Mr. Jose L. Escobedo,H,Jose Escobedo liked: https://www.facebook.com/198875430209122/posts/1773948582701791
123671,Mr. Miguel Angel Aguilar,E,View on Facebook: https://www.facebook.com/migman71,View on Linkedin: https://www.linkedin.com/in/migmanaguilar,View on Twitter: https://twitter.com/migman71,
123672,Ms. Amada Elizabeth Aguilera,H,Amada Aguilera liked: https://www.facebook.com/97044772273/posts/10157791714917274
124142,Mr. Jonny Flores,H,View on Linkedin: https://www.linkedin.com/in/jonny-flores-05486843,Jonny Flores liked: https://www.facebook.com/86774348679/posts/10157126251468680
124211,Mr. Albert Garza,E,View on Facebook: https://www.facebook.com/albert.garza.jr,View on Twitter: https://twitter.com/ajgar2009,
124697,Ms. Maria Elena Mengrone,H,Maria Mengrone liked: https://www.facebook.com/105308188973/posts/10154538968003974
124731,Mr. Jerry Brian Morales,E,View on Facebook: https://www.facebook.com/jerry.morales.549,View on Twitter: https://twitter.com/aNdFiTcH05,
124952,Ms. Tara Delyce Richardson,E,View on Facebook: https://www.facebook.com/tara.d.richardson.9,
125143,Mr. David Patrick Stonestreet,H,View on Linkedin: https://www.linkedin.com/in/david-stone-9b285788,View on Twitter: https://twitter.com/StonestreetPHYS,David Stonestreet liked: https://www.facebook.com/332132743905480/posts/673298173122267
125232,Mrs. Erlinda Teniente (Teniente) Valderas,H,Erlinda Valderas liked: https://www.facebook.com/211969075486992/posts/3903545922995937
12574,Mrs. Rossana Barrera (Barrera) Hernandez,E,View on Facebook: https://www.facebook.com/rossana.hernandez.581,
125864,Ms. Melissa Yvette Navarro,H,Melissa Navarro liked: https://www.facebook.com/30277423311/posts/10160409310918312
126400,Mr. Agam P Patel,H,View on Linkedin: https://www.linkedin.com/in/agam-patel-ab8a3516,Agam Patel liked: https://www.facebook.com/86774348679/posts/10156002336593680
125833,Mr. Andre P Tijerina,E,View on Facebook: https://www.facebook.com/andre.tijerina.9,
125892,Mr. Johnny James Garcia,H,Johnny Garcia liked: https://www.facebook.com/6147204570/posts/10156794894729571
125933,Mrs. Amy Lynn (Palmer) Griffith,H,Amy Griffith liked: https://www.facebook.com/198875430209122/posts/1791142634315719
126681,Mrs. Karen R. Rayzor,H,View on Linkedin: https://www.linkedin.com/in/karen-rayzor-b489815,View on Twitter: https://twitter.com/KarenRayzor,Karen Rademacher Rayzor reacted: https://www.facebook.com/97044772273/posts/10157045092297274
126875,Mr. Scott Barrett McNea,H,View on Linkedin: https://www.linkedin.com/in/scott-mcnea-a5349b16,Scott Barrett McNea liked: https://www.facebook.com/6147204570/posts/10155790412684571
126928,Mr. Aaron Lee Barasa,E,View on Facebook: https://www.facebook.com/aaron.barasa,
126905,Mrs. Crystal Rae Burklo,H,Crystal Burklo liked: https://www.facebook.com/211969075486992/posts/3576441549039711
126914,Mr. Timothy G. "Tim" Farias,H,View on Linkedin: https://www.linkedin.com/in/timothy-farias-76241211,View on Twitter: https://twitter.com/Tatipradier,Timothy Farias liked: https://www.facebook.com/211969075486992/posts/2598024913548051
127534,Ms. Ana Carolina Naves Crema,H,Ana Carolina Crema liked: https://www.facebook.com/86774348679/posts/10155763530683680
127748,Mrs. Evangelina R. "Vangie" (Ramos) Torres,H,Vangie Torres liked: https://www.facebook.com/332132743905480/posts/1243819812736764
127660,Ms. Denise Rachelle Sandoval,H,Denise Sandoval liked: https://www.facebook.com/97044772273/posts/10154241256577274
128235,Ms. Sylvia C Medina,H,Sylvia Medina liked: https://www.facebook.com/198875430209122/posts/1177395959023726
12837,Ms. Melissa Morris (Morris) Cavanaugh,H,View on Twitter: https://twitter.com/ashutterfullife,Melissa Morris Cavanaugh liked: https://www.facebook.com/86774348679/posts/10158007032058680
128645,Ms. Claudia Abrego,H,Claudia Abrego liked: https://www.facebook.com/86774348679/posts/10156777168358680
129330,Ms. Analysse Rodriguez Escobar,E,View on Facebook: https://www.facebook.com/analysse.escobar,View on Linkedin: https://www.linkedin.com/in/analysse-escobar-0323a651,View on Twitter: https://twitter.com/Analysse,
12967,Mrs. Adelaida Andrea (Atencio) Segura,H,Adelaida A. Segura liked: https://www.facebook.com/211969075486992/posts/2598024913548051
129736,Mr. Carlos Robledo,H,View on Linkedin: https://www.linkedin.com/in/carlos-robledo-82436945,Carlos Robledo liked: https://www.facebook.com/198875430209122/posts/10156184579919571
130234,Ms. Briana Michele Mendez,H,View on Twitter: https://twitter.com/Beezy_Breezy,Briana Mendez liked: https://www.facebook.com/211969075486992/posts/1778589055491645
130443,Mrs. Veronica Guzman Valdovinos,E,View on Facebook: https://www.facebook.com/bonnievaldovinos,: https://twitter.com/bonniegv,
130454,Mr. Nicholas P Ortiz,H,Nicholas Ortiz liked: https://www.facebook.com/211969075486992/posts/1229143553769534
130557,Mr. Jonathan Lac Tran,H,View on Linkedin: https://www.linkedin.com/in/jonathan-tran-b659bb94/,Jonathan Tran liked: https://www.facebook.com/211969075486992/posts/3581510445199488
13405,Mrs. Jeanette M. (Brown) Howe,E,View on Facebook: https://www.facebook.com/jeanette.howe,View on Twitter: https://twitter.com/nettsarie,
138204,Ms. Karri Shannon Meador,H,Karri Jacobs Meador liked: https://www.facebook.com/97044772273/posts/10155384178797274
138489,Mrs. Clacey Michelle (Gabourel) Goodlett,H,View on Instagram: https://instagram.com/claceyg,View on Linkedin: https://www.linkedin.com/in/clacey-goodlett-80203878,View on Twitter: https://twitter.com/claceyg,Clacey Goodlett liked: https://www.facebook.com/86774348679/posts/10159129365988680
138142,Mrs. Isamari G (Guzman) Delgado,H,Isamari Delgado liked: https://www.facebook.com/86774348679/posts/10159191214038680
138305,LTC Jason Lee Grant,H,View on Linkedin: https://www.linkedin.com/in/jason-grant-917b6221,Jason Grant liked: https://www.facebook.com/126515304094581/posts/4051381421607930
138930,Ms. Rosie Ramos,H,Rosie Ramos liked: https://www.facebook.com/6147204570/posts/10158933187329571
139514,Mrs. Blanca Estela Lopez,H,Blanca Martinez Lopez reacted: https://www.facebook.com/211969075486992/posts/3843017022382161
139613,Mr. Mark Travis Ruffin,H,Mark Ruffin liked: https://www.facebook.com/6147204570/posts/10155211760274571
139800,Mr. Eloy LaQue II,H,Eloy LaQue reacted: https://www.facebook.com/6147204570/posts/10159259188449571
139674,Miss Jasmin Marie "Jaz" Vann,H,Jasmin Vann liked: https://www.facebook.com/97044772273/posts/10153073469442274
140102,Ms. Danielle Marie Garcia,H,Danielle Adrianna Garcia liked: https://www.facebook.com/6147204570/posts/10155795030629571
140592,Mrs. Denise (Reyes) Villa,H,Denise Villa liked: https://www.facebook.com/211969075486992/posts/2355231731160705
140114,Mrs. April Castillo (Cruz) McCall,H,April Cruz liked: https://www.facebook.com/86774348679/posts/10158042813913680
140239,Dr. Patricia Trujillo,H,View on Twitter: https://twitter.com/LaMeraCachucha,Patricia Trujillo reacted: https://www.facebook.com/211969075486992/posts/3445379298812604
141897,Mrs. Natalia Z. "Natasha" (Finch) Arguello,H,View on Twitter: https://twitter.com/MashaFabulous,Natalia Arguello liked: https://www.facebook.com/140062069348988/posts/4451888978166254
142005,Ms. Ellen R Bridges,H,Ellen Reinhardt Bridges liked: https://www.facebook.com/211969075486992/posts/2023766500973898
142180,Mr. Bryan E Hilburn,H,Bryan Edward Hilburn reacted: https://www.facebook.com/6147204570/posts/10158882310109571
142015,Ms. Marcela Cabello,H,View on Linkedin: https://www.linkedin.com/in/marcelacabello,View on Twitter: https://twitter.com/chelitamm,Marcela Cabello liked: https://www.facebook.com/86774348679/posts/10159579373198680
142142,Ms. Martha P. Gomez-Gonzalez,H,Martha Gomez-Gonzalez liked: https://www.facebook.com/6147204570/posts/10155755116499571
142419,Ms. Amy M (Strong) Fritz,H,View on Linkedin: https://www.linkedin.com/in/amy-fritz-28971699,View on Twitter: https://twitter.com/amymfritz,Amy Fritz commented: https://www.facebook.com/126515304094581/posts/446901210057463
143819,Mr. David E. Carrillo,H,David Carrillo liked: https://www.facebook.com/97044772273/posts/10153489241157274
143873,Mr. Mycal J Lopez,H,Mycal Lopez liked: https://www.facebook.com/198875430209122/posts/1824844684278847
144184,Mr. Sheldon Ryan Lahti,H,View on Linkedin: https://www.linkedin.com/in/sheldon-lahti-5051331b/,Sheldon Lahti liked: https://www.facebook.com/86774348679/posts/10159353959283680
145199,Mr. Bryan Alfonso Bullon,H,Bryan Bullon liked: https://www.facebook.com/6147204570/posts/10155903999944571
144622,Ms. Kizzie C Davis,H,View on Linkedin: https://www.linkedin.com/in/kizzie-davis-09577798,Kizzie Davis reacted: https://www.facebook.com/211969075486992/posts/1944354295581786
145824,Mr. Jeremy Andrew Shields,E,View on Facebook: https://www.facebook.com/jershields,
146582,Mrs. JoAnn Belinda (Ruiz) Gilbert,H,View on Twitter: https://twitter.com/Katysmom96,JoAnn Ruiz Gilbert reacted: https://www.facebook.com/211969075486992/posts/3393143930702808
146645,Mrs. Natalie Alaniz,H,View on Linkedin: https://www.linkedin.com/in/natalie-alaniz-0a5a2772,View on Twitter: https://twitter.com/chrispowers01,Natalie Alaniz liked: https://www.facebook.com/86774348679/posts/10156667175278680
146649,Ms. Rosy Lizette Falcon,H,View on Linkedin: https://www.linkedin.com/in/rosy-falcon-garza-a99a16a,Rosy Lizette Falcon liked: https://www.facebook.com/86774348679/posts/10157842954233680
147053,Ms. Katie Joy Luna,H,View on Linkedin: https://www.linkedin.com/in/katieluna/,Katie Joy Luna liked: https://www.facebook.com/211969075486992/posts/1351525604864661
147450,Miss Amanda Rae Paredes,E,View on Facebook: https://www.facebook.com/amandaraerae,View on Instagram: https://instagram.com/amandaraerae,View on Linkedin: https://www.linkedin.com/in/amandaparedes4,View on Linkedin: https://www.linkedin.com/in/ACwAAATQA9gBFA5M4zML2c-5Y0YavZex2DphyT4/,View on Twitter: https://twitter.com/amandaraerae,
146698,Mr. Cory Lane Richter,H,Cory Richter commented: https://www.facebook.com/211969075486992/posts/3554004924616707
146813,Mr. John Frank Soto,H,John Soto reacted: https://www.facebook.com/6147204570/posts/10155658181944571
147313,Mrs. Andrea Liza Ruiz,H,Andrea Liza Ruiz liked: https://www.facebook.com/211969075486992/posts/3586185744731958
147517,Mr. Joe G. Mendez,H,View on Linkedin: https://www.linkedin.com/in/joe-mendez-0441b562,View on Twitter: https://twitter.com/dex_jackal,Joe Mendez liked: https://www.facebook.com/6147204570/posts/10155790429214571
147636,Mrs. Gyna Renee (Gonzales) Juarez,E,View on Facebook: https://www.facebook.com/gyna.gonzales,View on Linkedin: https://www.linkedin.com/in/gyna-juarez-727b7629,View on Twitter: https://twitter.com/GynaJSA,
147786,Mr. Samuel Jarrett DeMille "Sam" Legette,E,View on Facebook: https://www.facebook.com/SLegette,
148157,Ms. Andrea Sarai Cabrera,H,Andrea Cabrera liked: https://www.facebook.com/211969075486992/posts/2031998490150699
148221,Mr. Jason Jerome Chavez,H,View on Twitter: https://twitter.com/JChav1016,Jason Chavez reacted: https://www.facebook.com/86774348679/posts/10157710057488680
148937,Mr. James "Jim" Pigg,E,View on Facebook: https://www.facebook.com/james.pigg.77,
149711,Ms. Patricia M Cazares,E,View on Facebook: https://www.facebook.com/patricia.cazares1,View on Instagram: https://instagram.com/pmichellec,View on Twitter: https://twitter.com/pmichellec,
148755,Mr. Sean William Ianno,H,Sean Ianno liked: https://www.facebook.com/86774348679/posts/10159579373198680
148906,Mr. George Palafox,H,View on Linkedin: https://www.linkedin.com/in/george-palafox-ba8a974a,George Palafox liked: https://www.facebook.com/6147204570/posts/10158933900824571
148987,Mr. Charles Schattenberg,E,View on Facebook: https://www.facebook.com/charles.schattenberg,View on Linkedin: https://www.linkedin.com/in/charles-schattenberg-9619291b,
149909,Mr. James Edward Pelech,H,James Pelech liked: https://www.facebook.com/6147204570/posts/10155834239224571
150018,Ms. Mayda J Garza,H,Mayda Garza liked: https://www.facebook.com/211969075486992/posts/1651258194891399
150220,Mr. Cory James Bellamy,E,View on Facebook: https://www.facebook.com/corybellamy,View on Instagram: https://instagram.com/cbellamy,View on Twitter: https://twitter.com/cbellamy,
150271,Mrs. April Denise Brooks,H,April D. Brooks liked: https://www.facebook.com/6147204570/posts/10153261983774571
149770,Mr. James L Dunn II,H,View on Twitter: https://twitter.com/james_dunn,James Dunn liked: https://www.facebook.com/6147204570/posts/10152673678924688
150844,Ms. Angela Rose Molina,H,View on Twitter: https://twitter.com/AngelaMolina56,Angela Erazo Molina liked: https://www.facebook.com/211969075486992/posts/1817653234918560
151104,Maj. Brandon Lewis Seale,H,Brandon Seale liked: https://www.facebook.com/6147204570/posts/10156971754014571
151275,Mr. Warren Scott Wheeler,H,Warren Wheeler liked: https://www.facebook.com/6147204570/posts/10157110653209571
15152,Mr. Anthony Henry Gonzalez,E,View on Facebook: https://www.facebook.com/anthony.gonzalez8,View on Instagram: https://instagram.com/anthonyglez,View on Linkedin: https://www.linkedin.com/in/anthonyglez,View on Twitter: https://twitter.com/AnthonyGlez,
153474,Mrs. Pamela G Buchman,E,View on Facebook: https://www.facebook.com/pamela.g.buchman,View on Linkedin: https://www.linkedin.com/in/pamela-buchman-533a6322,View on Twitter: https://twitter.com/CourtBuch2,
154940,Mr. Johnny A Ferro,H,Johnny Ferro liked: https://www.facebook.com/86774348679/posts/10153868411583680
155119,Mr. Ubaldo Mora,H,Ubaldo Mora commented: https://www.facebook.com/6147204570/posts/10155791863009571
154628,Mr. Chad Fitzgerald Robinson,H,Chad Robinson liked: https://www.facebook.com/6147204570/posts/10151195033359571
154926,Mr. Todd David Sherman,H,View on Twitter: https://twitter.com/thinkorthoughts,Todd Sherman liked: https://www.facebook.com/6147204570/posts/1841352839316460
157376,Mr. Grant Taylor Hartwig,H,Grant Hartwig liked: https://www.facebook.com/211969075486992/posts/1631375366879682
