191376,Mrs. Marie E (Smith) Palos,E,View on Facebook: https://www.facebook.com/marie.palos.7,
191577,Mrs. Monica Helen (Hernandez) Hines,E,View on Facebook: https://www.facebook.com/monica.h.hines,View on Twitter: https://twitter.com/mhharies,
191735,Ms. Elaine Elizabeth Vela,H,Elaine Vela liked: https://www.facebook.com/211969075486992/posts/3218512668165936
191834,Mrs. Meagan (Block) Garcia,H,Meagan G. Garcia reacted: https://www.facebook.com/211969075486992/posts/1616493818367837
191859,Mr. David Wayne Cotham,H,David Cotham liked: https://www.facebook.com/6147204570/posts/10153029262109571
192217,Miss Jessica Hoai Thuong Steinman,H,View on Linkedin: https://www.linkedin.com/in/jessicatsteinman,View on Twitter: https://twitter.com/thejsteinman,Jessica Steinman liked: https://www.facebook.com/211969075486992/posts/1229201383763751
192668,Mr. James Navarro "Jim" Coultress  Jr.,H,James Coultress liked: https://www.facebook.com/86774348679/posts/10154084950008680
192694,Mr. Roger Garza,H,View on Linkedin: https://www.linkedin.com/in/roger-garza-87190a125,Roger Garza reacted: https://www.facebook.com/198875430209122/posts/2262582703963953
191839,Mr. William R Charo III,E,View on Facebook: https://www.facebook.com/william.r.charo,
193028,Ms. Janis M. Rosario,H,View on Linkedin: https://www.linkedin.com/in/janis-rosario-44231085,Janis Rosario liked: https://www.facebook.com/198875430209122/posts/1868284029934912
193277,Ms. Kacey Rachelle Harris,H,View on Twitter: https://twitter.com/Harriskacey,Kacey Harris liked: https://www.facebook.com/211969075486992/posts/3403025323048002
193332,Ms. Corinne Gail Mason,E,View on Facebook: https://www.facebook.com/corinne.g.mason,
193700,Mr. Donald Alan Brown,H,View on Linkedin: https://www.linkedin.com/in/donald-brown-126a3433,Donald Brown liked: https://www.facebook.com/86774348679/posts/10157232840343680
193778,Mr. Theodore Cyril "Theo" Duano,H,View on Linkedin: https://www.linkedin.com/in/theodore-duano-a84101162,Theodore Cyril Duano liked: https://www.facebook.com/6147204570/posts/10152568461074571
194099,Mr. Bryan Alexis Barahona,H,View on Linkedin: https://www.linkedin.com/in/bryan-barahona-a831bb67,View on Twitter: https://twitter.com/b_pair_acahonas,Bryan Barahona liked: https://www.facebook.com/6147204570/posts/10155816330669571
194410,Ms. Carmen Elisia Fitzsimmons,H,View on Twitter: https://twitter.com/cfitzsimmons09,Carmen Fitzsimmons liked: https://www.facebook.com/211969075486992/posts/1388537067830181
194463,Ms. Kayla Lizette Garcia,H,Kayla Garcia reacted: https://www.facebook.com/211969075486992/posts/3445379298812604
193776,Ms. Monica Kristelle Dolph,H,Monica Kristelle Dolph liked: https://www.facebook.com/211969075486992/posts/1558859544131265
193838,Mr. Anthony R. Kobryn,E,View on Facebook: https://www.facebook.com/kobryn6,
193883,Ms. Clarissa Monique Perez,H,Clarissa Perez liked: https://www.facebook.com/211969075486992/posts/1428017430548811
194423,Ms. Jenna C. Forrest,H,View on Linkedin: https://www.linkedin.com/in/steve-forrest-5aa65636,Jenna Forrest liked: https://www.facebook.com/198875430209122/posts/469174129845916
194587,Ms. Angie Hernandez-Torres,H,Angie Hernandez-Torres liked: https://www.facebook.com/50698324373/posts/10159509165769374
194700,Mr. Victor Jose Kuri,H,View on Linkedin: https://www.linkedin.com/in/marissa-kuri-711192104,View on Twitter: https://twitter.com/91Vick2,Victor Kuri liked: https://www.facebook.com/6147204570/posts/10155790429214571
195057,Mr. Nathan Ramos,H,Nathan Ramos liked: https://www.facebook.com/97044772273/posts/10156476801717274
195241,Ms. Rasa Spry,H,Rasa Spry liked: https://www.facebook.com/105308188973/posts/10154476041023974
195711,Ms. Cori Key,H,Cori Key liked: https://www.facebook.com/86774348679/posts/10157804146098680
196147,Ms. Sonia Fragoso,H,View on Twitter: https://twitter.com/soniafragoso,Sonia Fragoso reacted: https://www.facebook.com/211969075486992/posts/3451251678225366
196209,Ms. Amy Ho,E,View on Facebook: https://www.facebook.com/amy.ho.5036,
196214,Mr. Ivan Cuervo,H,View on Twitter: https://twitter.com/IvanCuervo12,Ivan Cuervo liked: https://www.facebook.com/198875430209122/posts/889624211134237
196294,Ms. Blakely Taylor Tuten,H,View on Linkedin: https://www.linkedin.com/in/blakely-tuten-031a1415,View on Twitter: https://twitter.com/BlakelyTuten,Blakely Tuten liked: https://www.facebook.com/86774348679/posts/10159181431923680
196303,Mr. Charles Leonard "Charlie" Ferris,H,View on Twitter: https://twitter.com/CharlieLFerris,Charles Leonard Ferris liked: https://www.facebook.com/86774348679/posts/10156992617333680
196340,Ms. Brittny Danielle Johnson,H,Brittny Johnson liked: https://www.facebook.com/187658316064/posts/10156716484636065
196353,Ms. Madeline Elise Colley,H,Madeline Colley liked: https://www.facebook.com/211969075486992/posts/3679906148693250
196566,Mr. Carlos Acevedo,H,Carlos Acevedo liked: https://www.facebook.com/211969075486992/posts/3033480813335790
196591,Ms. Ivette Rodriguez,H,Ivette Rodriguez liked: https://www.facebook.com/97044772273/posts/10155662452097274
196679,Ms. Katie Sanchez,H,Katie Sanchez reacted: https://www.facebook.com/211969075486992/posts/3594220877261778
196881,Ms. Nancy Kambalia,H,Nancy Kambalia liked: https://www.facebook.com/211969075486992/posts/1765437793473438
197024,Mrs. Gilda Ybarra,H,Gilda Alvarado Ybarra reacted: https://www.facebook.com/211969075486992/posts/2891928310824375
197134,Ms. Regina Tiong,H,Regina Tiong liked: https://www.facebook.com/211969075486992/posts/2725457474138127
197277,Mrs. Brandy Dotson,H,Brandy Denayer Dotson liked: https://www.facebook.com/211969075486992/posts/3381146065235928
196436,Mr. Travis Hockensmith,E,View on Facebook: https://www.facebook.com/travis.hockensmith,
196454,Ms. Karla G Valenzuela,H,Karla Valenzuela liked: https://www.facebook.com/211969075486992/posts/1209663895717500
196489,Ms. Clemencia Veloz,H,Clemencia Veloz liked: https://www.facebook.com/97044772273/posts/10155255092102274
196575,Ms. Rita Thornton,E,View on Facebook: https://www.facebook.com/rcthorn10,View on Twitter: https://twitter.com/RITA_linn,
196925,Ms. Cynthia Ann Geisewite,H,Cynthia Geisewite reacted: https://www.facebook.com/211969075486992/posts/2034440249906523
197085,Ms. Sandra Aguirre,H,Sandra Puente Aguirre liked: https://www.facebook.com/211969075486992/posts/3093390177344853
197247,Mr. JL Castillo,H,JL Castillo liked: https://www.facebook.com/198875430209122/posts/1390151747748145
197259,Ms. Diana Islacue Contreras,H,View on Twitter: https://twitter.com/dianacontrera30,Diana Contreras liked: https://www.facebook.com/198875430209122/posts/1833738113389504
197577,Mr. Virgil Griffin,H,Virgil Griffin liked: https://www.facebook.com/198875430209122/posts/290279298237773
197705,Mr. Christopher Richard Tijerina,H,Christopher Tijerina commented: https://www.facebook.com/126515304094581/posts/3244264128986334
198077,Ms. Ana Laura Arredondo,H,View on Linkedin: https://www.linkedin.com/in/ana-laura-arredondo-1001855b,Ana Laura Arredondo liked: https://www.facebook.com/211969075486992/posts/2493604380656772
198012,Ms. Lorileah N. Perez,H,Lorileah Nicole Perez liked: https://www.facebook.com/211969075486992/posts/1765437793473438
198174,Ms. Lisete Maldonado,H,View on Linkedin: https://www.linkedin.com/in/lisete-maldonado-947696111,View on Twitter: https://twitter.com/nala21star,Lisete Maldonado liked: https://www.facebook.com/211969075486992/posts/1602605119756707
198443,Mr. Pablo Angel Aguilar,E,View on Facebook: https://www.facebook.com/pablo.angel.aguilar,View on Linkedin: https://www.linkedin.com/in/pablo-aguilar-m-m-b0421852,View on Twitter: https://twitter.com/paulEagler,
198526,Mr. Monti Reimus Young,H,Monti Young liked: https://www.facebook.com/86774348679/posts/10159528664858680
198350,Ms. Annabel Tara Kirkpatrick,H,View on Linkedin: https://www.linkedin.com/in/annabel-kirkpatrick-b1837141,Annabel Kirkpatrick liked: https://www.facebook.com/6147204570/posts/10154659362679571
199022,Ms. Rabia J. Ali,H,Rabia Ali liked: https://www.facebook.com/86774348679/posts/10159347685393680
199323,Ms. Yadira Almira Limon,H,View on Linkedin: https://www.linkedin.com/in/yadira-limon-b42b4975,View on Twitter: https://twitter.com/ylimon,Yadira Limon liked: https://www.facebook.com/211969075486992/posts/3614314215252444
199729,Ms. Cynthia Longoria,H,Cynthia Longoria liked: https://www.facebook.com/126515304094581/posts/3394638933948852
199956,Mr. Aaron M. Ramos,H,Aaron Ramos liked: https://www.facebook.com/105308188973/posts/10154743707628974
200161,Ms. Carmella Maximina Rivas,E,View on Facebook: https://www.facebook.com/carmella.rivas.3,
200722,Mr. Austin Naranjo,H,View on Twitter: https://twitter.com/ClubfanMonica,Austin Naranjo reacted: https://www.facebook.com/97044772273/posts/10156157171212274
201256,Mr. Johnny V Sanchez Jr,E,View on Facebook: https://www.facebook.com/johnny.sancheziii,
201263,Mrs. Megan Renee Alvarado,H,Megan Alvarado liked: https://www.facebook.com/211969075486992/posts/3843017022382161
201442,Mrs. Tammy L. Anthony,H,View on Linkedin: https://www.linkedin.com/in/tammy-anthony-14463075,Tammy Owens Anthony reacted: https://www.facebook.com/211969075486992/posts/3829924053691458
202193,Mr. Jyron A Joseph,H,Jyron Joseph commented: https://www.facebook.com/126515304094581/posts/3309298719149541
202674,Mrs. Emily Fontenot,H,View on Twitter: https://twitter.com/EmilyFontenot,Emily Fontenot liked: https://www.facebook.com/86774348679/posts/10158567625468680
203461,Mr. Cody T. Berry,H,View on Twitter: https://twitter.com/CodyBerry_3,Cody Berry liked: https://www.facebook.com/6147204570/posts/10156952667379571
204141,Mr. Jared Paul,H,View on Twitter: https://twitter.com/malletmaster,Jared Paul commented: https://www.facebook.com/126515304094581/posts/446901210057463
204236,Mr. Christopher James Hanley,E,View on Facebook: https://www.facebook.com/christopher.hanley.940,
204476,Mr. Mark Alan,E,View on Facebook: https://www.facebook.com/markalanphotog,View on Linkedin: https://www.linkedin.com/in/mark-alan-8b394254,View on Twitter: https://twitter.com/markalanphotog,
204790,Mrs. Dolores Castor,E,View on Facebook: https://www.facebook.com/dolores.castor.9,View on Linkedin: https://www.linkedin.com/in/dolores-castor-6b0ab934,View on Twitter: https://twitter.com/bslp,
204641,Mr. Josh Lee,H,Lee Josh liked: https://www.facebook.com/6147204570/posts/10154819285274571
204896,Mr. Jack Vann,H,Jack Vann reacted: https://www.facebook.com/97044772273/posts/10154355733622274
204921,Mr. Nick Torres,H,Nick Torres liked: https://www.facebook.com/86774348679/posts/10154797221413680
205741,Ms. Lauren Ashli Singleton,H,Lauren Singleton liked: https://www.facebook.com/86774348679/posts/10157787856913680
205005,Miss Luisa Cruz Garza,H,Luisa Cruz Garza reacted: https://www.facebook.com/261043174069349/posts/964756513698008
205574,Ms. Alyssa Marie Arrellano,H,Alyssa Arrellano liked: https://www.facebook.com/211969075486992/posts/2998199740197231
206137,Ms. Lauren Elizabeth Tinkler,H,View on Linkedin: https://www.linkedin.com/in/lauren-tinkler-43a01a58,Lauren Tinkler liked: https://www.facebook.com/6147204570/posts/10158233706794571
205905,Mr. Stanton Duran Loggins,H,View on Twitter: https://twitter.com/farmer_basketba,Stanton Loggins liked: https://www.facebook.com/6147204570/posts/10159102121689571
206046,Ms. Victoria Alexandra Sulaica,H,View on Twitter: https://twitter.com/VictoriaSulaica,Victoria Sulaica liked: https://www.facebook.com/211969075486992/posts/2542660799084463
207270,Ms. Monica Valdez,H,View on Linkedin: https://www.linkedin.com/in/monica-valdez-01b643101,Monica Valdez liked: https://www.facebook.com/6147204570/posts/10158725236549571
207548,Ms. Karen Soefje,H,View on Linkedin: https://www.linkedin.com/in/karen-soefje-652a245,View on Twitter: https://twitter.com/KarenSoefje,Karen Soefje liked: https://www.facebook.com/6147204570/posts/10155151106309571
207133,Mr. Jacob Gilchrist,E,View on Facebook: https://www.facebook.com/Jacoburz,View on Twitter: https://twitter.com/Jacoburz,
207467,Mr. Trevor Choate,H,Trevor Choate liked: https://www.facebook.com/30277423311/posts/10155995080013312
207541,Ms. Naile Sanders,E,View on Facebook: https://www.facebook.com/naile.sanders,View on Instagram: https://instagram.com/kitty_naile_meow,View on Twitter: https://twitter.com/LovetheMovement,
207730,Mrs. Arielle Charisse (Naquin) Petroff,H,Arielle Petroff liked: https://www.facebook.com/211969075486992/posts/3092847857399085
207747,Miss Hoa Nguyen,H,View on Twitter: https://twitter.com/Dorktastick,Hoa Nguyen reacted: https://www.facebook.com/211969075486992/posts/2853983711285502
208020,Ms. Stephanie Jean Mendiola,H,Stephanie Mendiola liked: https://www.facebook.com/86774348679/posts/10158359378153680
208041,Mr. Mike Carter,H,Mike Carter reacted: https://www.facebook.com/198875430209122/posts/1945754025521245
208177,Mr. Max Renderos,H,Max Renderos liked: https://www.facebook.com/211969075486992/posts/1344503725566849
208324,Ms. Larissa Abrego Hernandez,H,Larissa Hernandez liked: https://www.facebook.com/211969075486992/posts/1378202625530292
207994,Ms. Sarah Rachel Moran,H,Sarah Moran interested: https://www.facebook.com/211969075486992/posts/1229201383763751
208100,Ms. Daphne Shaw,H,View on Linkedin: https://www.linkedin.com/in/daphne-guillen-shaw-ab44636b,Daphne Guillen Shaw liked: https://www.facebook.com/198875430209122/posts/247394585915263
208584,Ms. Melanie Vigil,H,Melanie Vigil liked: https://www.facebook.com/211969075486992/posts/2891928310824375
208756,Mr. Helen Marie Anguiano,H,Helen Anguiano liked: https://www.facebook.com/332132743905480/posts/1196299384155474
209393,Ms. Warda Riaz,H,View on Twitter: https://twitter.com/Reven8eLife,Warda Riaz commented: https://www.facebook.com/211969075486992/posts/1631375366879682
209842,Mr. Stefan Xavier Greenfield-Casas,H,Stefan Greenfield-Casas liked: https://www.facebook.com/126515304094581/posts/4051381421607930
209881,Ms. Kimberley T Dao,H,Kimberley Dao liked: https://www.facebook.com/211969075486992/posts/1979776418706240
210150,Mr. Carlos Mendez,H,View on Linkedin: https://www.linkedin.com/in/ACwAABggmaIBdST1zSER7mF7N1FMsi23EwKPnUU/,View on Twitter: https://twitter.com/CarlosMende4,Carlos Alberto Mendez liked: https://www.facebook.com/6147204570/posts/10156971754014571
210253,Ms. Damariz Indira Cureton,H,Damariz Cureton liked: https://www.facebook.com/6147204570/posts/10155790429214571
210365,Ms. Cristina Popescu,H,View on Linkedin: https://www.linkedin.com/in/toma-popescu-0b02aa31,Cristina Arana Popescu liked: https://www.facebook.com/105308188973/posts/10155356683888974
209645,Mr. Gilberto Enrique Escamilla,H,Gilberto Enrique Escamilla liked: https://www.facebook.com/6147204570/posts/10155699303799571
210051,Mr. Andrew Robertucci,E,View on Facebook: https://www.facebook.com/andrew.robertucci.1,View on Twitter: https://twitter.com/MofnANDREW,
210162,Miss Natalie Marie De La Cruz,H,Natalie De La Cruz liked: https://www.facebook.com/211969075486992/posts/3594220877261778
210568,Mr. Oscar Ferreiro,H,Oscar Alberto Ferreiro liked: https://www.facebook.com/105308188973/posts/10155968812488974
211517,Ms. Kelley McGregor,H,Kelley Lunder McGregor liked: https://www.facebook.com/97044772273/posts/10153510230252274
212106,Mr. Miguel Angel "Mike" De La Rosa  Jr.,H,Miguel De La Rosa liked: https://www.facebook.com/211969075486992/posts/2561576860526190
212601,Mr. William David Gunter,H,View on Twitter: https://twitter.com/Siltocket,William Gunter liked: https://www.facebook.com/211969075486992/posts/1173012166049340
213195,Mrs. Ivan Hurd,H,Ivan Hurd liked: https://www.facebook.com/126515304094581/posts/4051381421607930
212751,Mr. Cristian M. Rivera,H,View on Linkedin: https://www.linkedin.com/in/cristianrivera9/,Cristian Rivera liked: https://www.facebook.com/6147204570/posts/10156902870629571
213022,Mr. Dominic Pedro Silva,H,Dominic Silva liked: https://www.facebook.com/211969075486992/posts/2793450377338836
213239,Mr. Irvin Sandoval,H,View on Linkedin: https://www.linkedin.com/in/sandovalirvin,View on Twitter: https://twitter.com/boek_one,Irvin Sandoval reacted: https://www.facebook.com/211969075486992/posts/2891928310824375
213424,Mr. James LaBelle,H,James LaBelle liked: https://www.facebook.com/86774348679/posts/10159447303893680
213576,Mr. Justin Michael Stout,H,View on Twitter: https://twitter.com/Armyguy79,Justin M Stout interested: https://www.facebook.com/6147204570/posts/10154516479624571
214081,Mrs. Denise Diane (Wathen) Brown,E,View on Facebook: https://www.facebook.com/denise.wathen.9,View on Twitter: https://twitter.com/wathendd,
214183,Ms. Aja Jade Calderon,H,Aja Jade Calderon liked: https://www.facebook.com/30277423311/posts/10159945824128312
213863,Miss Nicole Dianna Karaklis,E,View on Facebook: https://www.facebook.com/nicole.karaklis,: https://twitter.com/allthistimeNK,
213919,Mrs. Mariah Pritchett,H,Mariah Pritchett liked: https://www.facebook.com/86774348679/posts/10158453466868680
214004,Ms. Treasure Nyckale Stephens,H,Treasure Stephens reacted: https://www.facebook.com/86774348679/posts/10159129365988680
214165,Ms. Jaclynn Micaela "Micaela" Brown,H,Jaclynn Michaela Brown liked: https://www.facebook.com/211969075486992/posts/2009926912357857
214271,Miss Megan Jefferies,H,Megan Jefferies liked: https://www.facebook.com/97044772273/posts/10156036238197274
214549,Mr. Kedrick L Cannon,E,View on Facebook: https://www.facebook.com/kedrick.cannon,View on Linkedin: https://www.linkedin.com/in/kenneth-cannon-76163b36,View on Twitter: https://twitter.com/Kedrico,
214733,Mr. Aaron B. Luna,H,Aaron Luna liked: https://www.facebook.com/6147204570/posts/10155828451919571
214832,Mrs. Alexanther Rosales,H,Alexanther Rosales reacted: https://www.facebook.com/211969075486992/posts/2651648161519059
214927,Mr. Andrew Middle Benavides,H,Andrew Benavides liked: https://www.facebook.com/198875430209122/posts/312243399358337
214268,Miss Trisha York,H,Trisha York liked: https://www.facebook.com/211969075486992/posts/2739493006067907
214289,Ms. Ana Maldonado,E,View on Facebook: https://www.facebook.com/AnitaHippo,View on Twitter: https://twitter.com/AnitaLoveHippos,
214575,Mr. Joshua Rogers,H,Joshua Rogers liked: https://www.facebook.com/211969075486992/posts/3016601131690425
214699,Miss Amrita Honap,H,Amrita Honap liked: https://www.facebook.com/211969075486992/posts/2805365172814023
214801,Mr. Alec Matthew Trevino,H,Alec Trevino liked: https://www.facebook.com/211969075486992/posts/1322123101138245
214809,Mrs. Alejandra Nadine Vela,H,Alejandra N Vela liked: https://www.facebook.com/211969075486992/posts/1117189591631598
215161,Mrs. Cecilia J Carvajal,H,Cecilia Carvajal liked: https://www.facebook.com/211969075486992/posts/1612037352146817
215182,Mrs. Christa Erin Kerbow,H,Christa Kerbow liked: https://www.facebook.com/211969075486992/posts/1439141756103045
215297,Mrs. Danielle Sarfati,H,Danielle Sarfati reacted: https://www.facebook.com/211969075486992/posts/2417040634979814
215853,Mr. Julio Rosas,H,Julio Rosas liked: https://www.facebook.com/187658316064/posts/10152901986536065
215242,Ms. Cori R. Pavlofsky,H,Cori Pavlofsky liked: https://www.facebook.com/6147204570/posts/10158233706794571
216067,Mr. Marc Anthony Denney,H,View on Linkedin: https://www.linkedin.com/in/marc-denney-bb525761,View on Twitter: https://twitter.com/MarcDenney,Marc Denney liked: https://www.facebook.com/211969075486992/posts/1979759482041267
216565,Mrs. Shelby Lynn Allen,H,Shelby Allen liked: https://www.facebook.com/211969075486992/posts/2023766500973898
216651,Mrs. Taylor M. Cone,H,Taylor Cone liked: https://www.facebook.com/211969075486992/posts/2036803183003563
216670,Mr. Thomas Paul Chavarria,H,Thomas Chavarria reacted: https://www.facebook.com/211969075486992/posts/3383822188301649
216859,Miss Elizabeth M. Griego,H,Elizabeth Griego liked: https://www.facebook.com/105308188973/posts/10156344761533974
216896,Ms. Lindsey "Lindsay" Muenchow,H,Lindsey Muenchow reacted: https://www.facebook.com/211969075486992/posts/1505269209490299
216246,Mr. Muzammil Hussain,H,View on Twitter: https://twitter.com/mhnadeem,Muzammil Hussain liked: https://www.facebook.com/6147204570/posts/10154523771879571
216936,Miss Gianini M. Castillo,E,View on Facebook: https://www.facebook.com/gianiniprincess,
217288,Miss Crystal "Cryasal" Bellamy,H,Crystal Bellamy liked: https://www.facebook.com/211969075486992/posts/1367045836645971
217704,Mr. Cristian Diaz,H,Cristian Diaz liked: https://www.facebook.com/6147204570/posts/10155791863009571
217796,Ms. Kelsey McGilbert,H,View on Linkedin: https://www.linkedin.com/in/kelsey-mcgilbert-646234a3,Kelsey McGilbert liked: https://www.facebook.com/86774348679/posts/10159578603298680
217811,Mr. Moises Romo,H,Moises Romo liked: https://www.facebook.com/97044772273/posts/10157392015377274
217828,Ms. Vanessa Marie Maynes,H,Vanessa Maynes liked: https://www.facebook.com/6147204570/posts/10155992973349571
217855,Mr. Clay Chandler,H,Clay Chandler liked: https://www.facebook.com/211969075486992/posts/1329375877079634
216959,Ms. Erika Maldonado,H,View on Twitter: https://twitter.com/ErikakikaErika,Erika Maldonado reacted: https://www.facebook.com/211969075486992/posts/3453515531332314
217292,Mrs. Stacey Almond,H,View on Linkedin: https://www.linkedin.com/in/stacey-almond-1a586318,Stacey Bowles Almond liked: https://www.facebook.com/6147204570/posts/10157038241579571
217329,Dr. Kathryn Elizabeth Keeton,H,View on Linkedin: https://www.linkedin.com/in/kathryn-e-keeton-ph-d-8815617,Kathryn Elizabeth Keeton reacted: https://www.facebook.com/211969075486992/posts/3627892403894625
217512,Mr. Daniel Edward Soria,H,View on Twitter: https://twitter.com/desoria59,Daniel Soria liked: https://www.facebook.com/97044772273/posts/10155719910632274
217538,Ms. Jennifer Jaster,H,Jennifer Jaster liked: https://www.facebook.com/211969075486992/posts/2848715735145633
217696,Mr. Taylor Young,H,View on Linkedin: https://www.linkedin.com/in/taylor-young-5948b968,Taylor Young liked: https://www.facebook.com/198875430209122/posts/1082361961860460
218067,Mrs. Maria Dolores (Valenzuela) Roberts,H,Maria Dolores Valenzuela Roberts reacted: https://www.facebook.com/211969075486992/posts/3732520016765196
218325,Ms. Alexandra Noel Aguilar,E,View on Facebook: https://www.facebook.com/alexandra.aguilar.104855,: https://twitter.com/alexaaguilar9,
218718,Ms. Breanna Marie Garcia,H,Breanna Garcia liked: https://www.facebook.com/211969075486992/posts/3451251678225366
218103,Miss Sonam Alissa Bhakta,H,Sonam Alissa Bhakta liked: https://www.facebook.com/211969075486992/posts/1368949709788917
218118,Ms. Angela Evans,H,Angela Chow Evans liked: https://www.facebook.com/211969075486992/posts/3548980715119128
218329,Mrs. Rachel Patricia Dillon,H,Rachel Dillon reacted: https://www.facebook.com/97044772273/posts/10156157171212274
218334,Ms. Ariel Britany Morales,H,View on Twitter: https://twitter.com/hanayuu48,Ariel Morales liked: https://www.facebook.com/332132743905480/posts/1041700156282065
218449,Mr. Roy Mario Fernandez,H,View on Linkedin: https://www.linkedin.com/in/roy-fernandez-a3489a13,View on Twitter: https://twitter.com/roptimusr,Roy Fernandez liked: https://www.facebook.com/211969075486992/posts/1587751201242099
218551,Dr. Paul H. Jordan  Jr.,H,Paul Jordan liked: https://www.facebook.com/6147204570/posts/10154569974394571
218702,Mr. Francisco Gomez-Rivera,H,Francisco Gomez-Rivera liked: https://www.facebook.com/211969075486992/posts/1177302612286962
218756,Mr. Oscar R Thomas Alvarez,H,Oscar Thomas reacted: https://www.facebook.com/6147204570/posts/10159469734104571
219049,Mrs. Judy Browning,H,Judy Browning liked: https://www.facebook.com/30277423311/posts/10161030184108312
219072,Ms. Erika Urias,H,Erika Urias liked: https://www.facebook.com/30277423311/posts/10160409310918312
219084,Mr. Roger Hugo Terrazas,H,View on Twitter: https://twitter.com/DGr8Bambino,Roger Terrazas liked: https://www.facebook.com/30277423311/posts/10157325297908312
218900,Ms. Erica Marie Williams,H,Erica Williams invited: https://www.facebook.com/30277423311/posts/10155563857198312
218932,Mr. Anthony Ramon "Ramon" Lozano,H,Anthony Lozano liked: https://www.facebook.com/30277423311/posts/10158547519018312
219146,Mr. Berat A. Erol,H,View on Linkedin: https://www.linkedin.com/in/berat-alper-erol-9abab41b,Berat Alper Erol liked: https://www.facebook.com/261043174069349/posts/767106210129707
219341,Mrs. Christina Blohm,H,Christina Blohm liked: https://www.facebook.com/211969075486992/posts/1343506812333207
220194,Ms. Imelda Tinajero,H,Imelda Tinajero reacted: https://www.facebook.com/86774348679/posts/10158511341408680
220445,Ms. Daniela Maria Ramirez,H,View on Twitter: https://twitter.com/daniramirez94,Daniela Ramirez liked: https://www.facebook.com/211969075486992/posts/3078854432131761
220641,Mr. Jeremy Anthony Rivera,E,View on Facebook: https://www.facebook.com/jeremy.rivera.7777,View on Instagram: https://instagram.com/jeremyarivera,View on Twitter: https://twitter.com/JeremyARivera,
220352,Mr. Jake D. Martinez,H,View on Twitter: https://twitter.com/RJNMartinez199,Jake Martinez liked: https://www.facebook.com/211969075486992/posts/2545496395467570
220467,Ms. Ashley Nicole Longoria,H,Ashley Longoria reacted: https://www.facebook.com/211969075486992/posts/3244954972188372
220483,Ms. Tatum S. Neely,H,Tatum Neely liked: https://www.facebook.com/6147204570/posts/10155151502334571
220648,Mr. Barrett Connor Brock,H,Barrett Brock liked: https://www.facebook.com/97044772273/posts/10155814669612274
220900,Ms. Erika Nicole Temple,H,Erika Temple liked: https://www.facebook.com/211969075486992/posts/2701440383206503
220978,Ms. Alyssa Mia Gomez,H,Alyssa Gomez liked: https://www.facebook.com/211969075486992/posts/3218512668165936
