155822,Mrs. Tracy Robertson,H,Tracy Robertson reacted: https://www.facebook.com/198875430209122/posts/1449295795167073
155904,Ms. Janae Robinson,H,Janae Robinson liked: https://www.facebook.com/86774348679/posts/10159178013488680
158225,Mr. Michael P Gurka,E,View on Facebook: https://www.facebook.com/michael.gurka.9,
157458,Mr. Matt B "Matthew" Kouns,H,Matt Kouns liked: https://www.facebook.com/198875430209122/posts/1865042566925725
157614,Dr. Aleksandr Vladimir Panchul,H,Aleksandr Panchul liked: https://www.facebook.com/30277423311/posts/10160381457808312
157912,Mrs. Aida Paola Conti,H,View on Linkedin: https://www.linkedin.com/in/aida-paola-conti-8a86a61a,Aida Paola Conti liked: https://www.facebook.com/211969075486992/posts/3673691585981373
159462,Mr. James D. Ramos,H,James Ramos reacted: https://www.facebook.com/198875430209122/posts/1816512928445356
160235,Ms. Yvonne Pena,H,View on Linkedin: https://www.linkedin.com/in/yvonne-pena-78554293,Yvonne Pena liked: https://www.facebook.com/6147204570/posts/10155853474534571
160313,Ms. Toni S. Newman,H,Toni S. Newman liked: https://www.facebook.com/105308188973/posts/10153688248003974
159599,Mr. Roy Bumgarner,E,View on Facebook: https://www.facebook.com/Herasboy,View on Linkedin: https://www.linkedin.com/in/roybumgarner,
160239,Mr. Jesse Davila,H,Jesse Davila commented: https://www.facebook.com/6147204570/posts/10159491907584571
160241,Mr. Chris Soza III,H,Chris Soza liked: https://www.facebook.com/6147204570/posts/10154206321594571
160481,Ms. Brittney Nicole Barham,H,View on Linkedin: https://www.linkedin.com/in/brittney-barham-3b954b44,View on Twitter: https://twitter.com/bnicole0712,Brittney Barham liked: https://www.facebook.com/86774348679/posts/10159067105043680
160576,Mr. Alejandro Lara,H,Alejandro Lara liked: https://www.facebook.com/6147204570/posts/10155988349549571
160702,Ms. Anna Yim,H,Anna Yim commented: https://www.facebook.com/86774348679/posts/10158825954988680
160718,Mr. Romualdo Valdez,E,View on Facebook: https://www.facebook.com/romualdo.valdez,View on Twitter: https://twitter.com/RomuValdez,
160891,Mrs. Michelle Rausch Holcomb,H,Michelle Rausch Holcomb reacted: https://www.facebook.com/6147204570/posts/10159496106444571
161024,Mrs. Tyler Alyse Archer,H,View on Linkedin: https://www.linkedin.com/in/tyleralyse,View on Twitter: https://twitter.com/TylerAlyse,Tyler Alyse Archer liked: https://www.facebook.com/187658316064/posts/10154586166321065
161244,Ms. Christine Raquel Coleman,H,Christine Coleman liked: https://www.facebook.com/86774348679/posts/10159178013488680
160528,Ms. Suheyli Figueroa,H,View on Linkedin: https://www.linkedin.com/in/suheyli-figueroa-07051475,Suheyli Figueroa liked: https://www.facebook.com/86774348679/posts/10158558858353680
161085,Ms. Michele Danette Benavides,H,Michele Benavides liked: https://www.facebook.com/105308188973/posts/10154094976708974
161214,Mr. Zachery Louis Chaney,H,View on Linkedin: https://www.linkedin.com/in/zachery-chaney-01664515,Zachery Chaney liked: https://www.facebook.com/6147204570/posts/10153635996099571
162085,Ms. Cristal Jufith Elias,H,Cristal Elias liked: https://www.facebook.com/211969075486992/posts/1994224113928137
162224,Mr. Hugo Jacob Jimenez,H,Hugo Jacob Jimenez liked: https://www.facebook.com/211969075486992/posts/3045763062107565
162308,Miss Ashley Nicole Martell,H,Ashley Martell liked: https://www.facebook.com/86774348679/posts/10158007032058680
162482,Mr. Angel Monsivais Reyna,H,View on Linkedin: https://www.linkedin.com/pub/angel-reyna/25/1a4/901,View on Twitter: https://twitter.com/griseldasworld,Angel Reyna liked: https://www.facebook.com/6147204570/posts/10159259188449571
162640,Mr. Thomas Thanh Vu,H,Thomas Vu liked: https://www.facebook.com/6147204570/posts/10159651420229571
163079,Ms. Angela Wampler,H,View on Twitter: https://twitter.com/wampcity,Angela Davis Wampler liked: https://www.facebook.com/6147204570/posts/10153304156229571
163179,Mrs. Sharla Robles,E,View on Facebook: https://www.facebook.com/sharla.robles,View on Linkedin: https://www.linkedin.com/in/sharla-robles-96411b175,
163259,Mr. David E Hearin,H,View on Linkedin: https://www.linkedin.com/in/david-hearin-817a5377,View on Twitter: https://twitter.com/tandad,David Hearin liked: https://www.facebook.com/97044772273/posts/10155084053057274
164335,Ms. Martha L. Failing,H,Martha Lobit Failing liked: https://www.facebook.com/6147204570/posts/10154547162129571
164337,Mr. Matt Metzger,H,Matt Metzger commented: https://www.facebook.com/6147204570/posts/10156988623374571
164497,Mr. Rudy Rene Farias,H,Rudy Farias liked: https://www.facebook.com/198875430209122/posts/1101890733240916
165181,Ms. Kelly Toepperwein,E,View on Facebook: https://www.facebook.com/kelly.toepperwein,View on Linkedin: https://www.linkedin.com/in/kelly-toepperwein-929a9551,
165463,Mrs. Lisa Nunez,H,Lisa Zachary Nunez liked: https://www.facebook.com/211969075486992/posts/935513016465924
165699,Ms. Melissa A Carmona,H,View on Linkedin: https://www.linkedin.com/in/melissa-carmona-b0709a8b,Melissa Carmona liked: https://www.facebook.com/6147204570/posts/10157050868024571
165630,Mr. Beaudry S Barnett,H,Beaudry Barnett liked: https://www.facebook.com/211969075486992/posts/2545496395467570
165880,Ms. Rochelle M Gonzalez,E,View on Facebook: https://www.facebook.com/rochellemgonzalez,View on Linkedin: https://www.linkedin.com/in/rochellemgonzalez,View on Twitter: https://twitter.com/ShelleGonzalez,
167103,Mrs. Juanita C Gomez,H,Juanita Gomez liked: https://www.facebook.com/261043174069349/posts/632127580294238
167618,Ms. Kameel Isaac,H,View on Linkedin: https://www.linkedin.com/in/kameel-isaac-68545538,Kameel Isaac liked: https://www.facebook.com/30277423311/posts/10159732541678312
167634,Ms. Leonor Elizabeth Padilla,H,Leonor Padilla reacted: https://www.facebook.com/86774348679/posts/10159210430763680
167797,Mr. Justin Quin,H,Justin Quin liked: https://www.facebook.com/97044772273/posts/10155244380422274
167186,Ms. Kimberly Farias,H,Kimberly Farias liked: https://www.facebook.com/211969075486992/posts/2198542760162937
167422,Mrs. Penny Wuebben,E,View on Facebook: https://www.facebook.com/penny.wuebben,View on Linkedin: https://www.linkedin.com/in/penny-wuebben-4608044b,View on Twitter: https://twitter.com/pwuebben,
167657,Ms. Rachel Corbelli,E,View on Facebook: https://www.facebook.com/rachel.corbelli,View on Linkedin: https://www.linkedin.com/in/russell-corbelli-092195106,View on Twitter: https://twitter.com/Rcorbelli94,
167851,Ms. Nancy Mendez,E,View on Facebook: https://www.facebook.com/nancy.mendez1030,
168123,Ms. Kendall Casas,H,Kendall Casas liked: https://www.facebook.com/261043174069349/posts/1049951851845140
168182,Miss Christina O Adebowale,E,View on Facebook: https://www.facebook.com/christina.adebowale,View on Twitter: https://twitter.com/SoVeryLoud,
168307,Ms. Lyndsey Luther,H,View on Instagram: https://instagram.com/lyndzbenz12,View on Linkedin: https://www.linkedin.com/in/lyndsey-luther-79286542,View on Twitter: https://twitter.com/lyndzbenz12,Lyndsey Danyelle Luther liked: https://www.facebook.com/211969075486992/posts/1263343153682907
168595,Ms. Anett Rodriguez,E,View on Facebook: https://www.facebook.com/anett.rodriguez.7,View on Linkedin: https://www.linkedin.com/in/anett-rodriguez-shrm-cp-59a94915b/,View on Twitter: https://twitter.com/AnettRodriguez,
169147,Miss April Rose Escamilla,H,View on Linkedin: https://www.linkedin.com/in/aprilescamilla,April Rose Escamilla liked: https://www.facebook.com/86774348679/posts/10157167821593680
169340,Mrs. Ashley Marie (Green) Byrnes,H,Ashley Byrnes liked: https://www.facebook.com/211969075486992/posts/3045763062107565
169358,Ms. Michelle Elizabeth Guerrero,H,View on Linkedin: https://www.linkedin.com/in/michelle-guerrero-61104943,View on Linkedin: https://www.linkedin.com/in/michelle-guerrero-61104943/,View on Twitter: https://twitter.com/mi_chelleeee,Michelle N. Guerrero liked: https://www.facebook.com/211969075486992/posts/2598024913548051
169748,Mrs. Melinda R Medina,H,Melinda Medina liked: https://www.facebook.com/86774348679/posts/10155244372183680
169120,Mrs. Samantha C. (Eaton) Crawford,H,Samantha Eaton liked: https://www.facebook.com/30277423311/posts/10160708275868312
169255,Mr. Alan Frederick Garcia,H,Alan Gabriel Garcia liked: https://www.facebook.com/6147204570/posts/10158882310109571
169743,Ms. Valerie Annabell McKinney,H,Valerie McKinney commented: https://www.facebook.com/211969075486992/posts/3436538243030043
17070,Mrs. Mary Ann (May) King,H,Mary Repman liked: https://www.facebook.com/97044772273/posts/10155399438922274
170860,Ms. Bianca Nicole Reuter,H,View on Linkedin: https://www.linkedin.com/in/bianca-reuter-60b8b8a1/,Bianca Reuter commented: https://www.facebook.com/211969075486992/posts/247644349289214
170178,Mr. Delani D Simmons,H,Delani Simmons liked: https://www.facebook.com/6147204570/posts/10155809183119571
170422,Ms. Rebeca Murillo,E,View on Facebook: https://www.facebook.com/rebeca.murillo.54,View on Instagram: https://instagram.com/muribec12,View on Twitter: https://twitter.com/muribec12,
171078,Mr. Kyle Erik Blair,H,Kyle Blair liked: https://www.facebook.com/6147204570/posts/10155790429214571
171137,Ms. Irene Chavez,H,Irene Chavez liked: https://www.facebook.com/97044772273/posts/10156687101642274
171335,Ms. Brenda A Nava,H,Brenda Alexis Nava commented: https://www.facebook.com/86774348679/posts/10154000399938680
171502,Ms. Biljana Jovanova,H,Biljana Jovanova liked: https://www.facebook.com/97044772273/posts/10155331810037274
171523,Ms. Tanita Larese Wiley,H,View on Linkedin: https://www.linkedin.com/in/tanita-wiley-009a1185,Tanita L. Wiley reacted: https://www.facebook.com/86774348679/posts/10159203982073680
171717,Ms. Hannah Roe Beck,E,View on Facebook: https://www.facebook.com/hannahroebeck,View on Instagram: https://instagram.com/hannahroebeck,View on Linkedin: https://www.linkedin.com/in/hannah-beck-30b5559b,View on Twitter: https://twitter.com/hannahroebeck,
171724,Mr. Steven Thomas Partida,H,Steven Partida liked: https://www.facebook.com/126515304094581/posts/3039024619510287
170951,Ms. Nadia Ramon,H,Nadia Ramon liked: https://www.facebook.com/198875430209122/posts/1527855873977731
170959,Miss Emily Humpal,H,Emily Humpal liked: https://www.facebook.com/6147204570/posts/10156845102944571
171009,Ms. Christine Montoya,H,View on Linkedin: https://www.linkedin.com/in/rose-wilson-754192100,View on Twitter: https://twitter.com/christoyals,Christine Montoya liked: https://www.facebook.com/211969075486992/posts/1957857530898129
171120,Ms. Pamela Canales,H,View on Linkedin: https://www.linkedin.com/in/pamela-canales/,Pamela Canales liked: https://www.facebook.com/86774348679/posts/10157754421498680
171877,Ms. Chris Wright,H,Chris Pops Wright liked: https://www.facebook.com/198875430209122/posts/566587210104607
172033,Dr. Kathleen Elizabeth (Fugate) Laborde,H,View on Linkedin: https://www.linkedin.com/in/kathleen-laborde-6633189,Kathleen Fugate Laborde liked: https://www.facebook.com/332132743905480/posts/563046550814097
172478,Ms. Linda Carol Barnes,H,Linda Barnes liked: https://www.facebook.com/6147204570/posts/10154903749969571
172799,Mrs. Linda Day,E,View on Facebook: https://www.facebook.com/linda.day.526,
173129,Mrs. Flor Alicia Hernandez,H,Flor Hernandez commented: https://www.facebook.com/97044772273/posts/10156687101642274
174009,Mrs. Sarah (Sevcik) Webb,H,Sarah Webb liked: https://www.facebook.com/211969075486992/posts/3531558833527983
174023,Dr. Stephanie T. Westney,H,View on Linkedin: https://www.linkedin.com/in/stephanie-westney-54629967,Stephanie Teply Westney liked: https://www.facebook.com/126515304094581/posts/811747412725384
174648,Mr. Zacharia A (Aziz) Grami,E,View on Facebook: https://www.facebook.com/zgrami,View on Instagram: https://instagram.com/zgrami,View on Linkedin: https://www.linkedin.com/in/zgrami,View on Twitter: https://twitter.com/zgrami,
174991,Ms. Amanda J Busselman,H,Amanda Jo Busselman reacted: https://www.facebook.com/86774348679/posts/10158665628543680
175422,Ms. Norma Gomez,H,View on Linkedin: https://www.linkedin.com/in/norma-gomez-e-i-t-46353b46,View on Twitter: https://twitter.com/normagomez76,Norma Gomez reacted: https://www.facebook.com/30277423311/posts/10156970972593312
175464,Mr. Joseph Alexander Granado,E,View on Facebook: https://www.facebook.com/joseph.granado,View on Instagram: https://instagram.com/josephagranado,View on Linkedin: https://www.linkedin.com/in/joseph-a-granado-m-s-08887133,View on Twitter: https://twitter.com/JosephAGranado,
175672,Ms. Helen M King,H,View on Linkedin: https://www.linkedin.com/in/helen-king-mba-1ba5aa37,View on Twitter: https://twitter.com/jewelsbyhelen,Helen King liked: https://www.facebook.com/187658316064/posts/10154862091446065
175927,Ms. Maren E Minchew,H,View on Linkedin: https://www.linkedin.com/in/marenminchew,View on Twitter: https://twitter.com/prmaren,Maren Minchew liked: https://www.facebook.com/211969075486992/posts/3144213155595888
176111,Mrs. Rebekah D Perez,H,View on Linkedin: https://www.linkedin.com/in/rebekah-perez-22a00534,Rebekah Perez liked: https://www.facebook.com/6147204570/posts/10155794906004571
176719,Mr. Chris Gonzales,H,View on Linkedin: https://www.linkedin.com/in/chris-gonzales-160b8112,Chris P. Gonzales liked: https://www.facebook.com/211969075486992/posts/3711752648841933
176728,Mr. Michael Kuehne,H,Michael Kuehne liked: https://www.facebook.com/211969075486992/posts/1926919620658587
177618,Ms. Tyann Hansford,E,View on Facebook: https://www.facebook.com/tyann.hansford,View on Linkedin: https://www.linkedin.com/in/tyann-hansford-83810312,
178024,Mrs. Juanita A Callejas,E,View on Facebook: https://www.facebook.com/juanita.callejas.5,
178331,Mrs. Cheryl Hollenbeck,H,View on Twitter: https://twitter.com/cherylhollen,Cheryl Hollenbeck liked: https://www.facebook.com/211969075486992/posts/2678032832213925
178190,Mrs. Candis Fugitt,E,View on Facebook: https://www.facebook.com/candis.fugitt,View on Linkedin: https://www.linkedin.com/in/candis-r-fugitt-b1655135,View on Twitter: https://twitter.com/matthewadams12,
178458,Mr. Alden E. Lopez,H,Alden Lopez liked: https://www.facebook.com/169297629793385/posts/2202482476474880
178471,Mrs. Pat M Lucas,E,View on Facebook: https://www.facebook.com/pat.lucas.9,
179915,Mrs. Eileen Egan,H,View on Twitter: https://twitter.com/eganm525,Eileen Missy Egan liked: https://www.facebook.com/211969075486992/posts/1162946273722596
179930,Ms. Debra Garza,E,View on Facebook: https://www.facebook.com/debiturtle,
180063,Mr. Ethan Wickman,H,View on Linkedin: https://www.linkedin.com/in/ethan-wickman-66b0a140,Ethan Wickman reacted: https://www.facebook.com/126515304094581/posts/4168340056578732
180086,Ms. Kayla Webel,H,Kayla Webel liked: https://www.facebook.com/198875430209122/posts/1902825736480741
180241,Mr. Darrin K. Wylie,H,View on Linkedin: https://www.linkedin.com/in/darrinwylie,View on Twitter: https://twitter.com/BigDsa,Darrin Wylie going: https://www.facebook.com/6147204570/posts/10155853474534571
180383,Ms. Marisa C. Jobst,E,View on Facebook: https://www.facebook.com/beachbummarisa,View on Twitter: https://twitter.com/marisajobstreet,
180301,Mr. Juan Pablo Alcantar,H,View on Linkedin: https://www.linkedin.com/pub/juan-pablo-alcantar/5a/637/b3a,View on Linkedin: https://www.linkedin.com/in/ACwAAAyNUJ4BSGaqviUNeqhPm7TZa_bmpqmq_Hs/,Juan Pablo Alcantar reacted: https://www.facebook.com/97044772273/posts/10153506189272274
180990,Ms. Erica Gongora,H,View on Linkedin: https://www.linkedin.com/in/erica85,View on Twitter: https://twitter.com/erica_gongora,Erica Gongora liked: https://www.facebook.com/211969075486992/posts/1177999328883957
181332,Ms. Kendra Kay Hickman,H,Kendra Hickman reacted: https://www.facebook.com/86774348679/posts/10159639504403680
181352,Ms. Brandy Elizabeth Johnson,H,View on Twitter: https://twitter.com/brandy879,Brandy Johnson liked: https://www.facebook.com/86774348679/posts/10159561514628680
181496,Mr. Raymond A Rice,H,Raymond A. Rice liked: https://www.facebook.com/97044772273/posts/10154251234062274
181208,Ms. Stacey Cano,H,Stacey Cano liked: https://www.facebook.com/6147204570/posts/10154543348894571
181226,Mr. Ulysses Omar Cisneros,H,Ulysses Cisneros liked: https://www.facebook.com/211969075486992/posts/2192247484125798
181468,Mr. Celso Alexander Perez,H,View on Linkedin: https://www.linkedin.com/in/celso-perez-38303383,Celso Perez liked: https://www.facebook.com/6147204570/posts/10156133699269571
181741,Mr. Marty Saucedo,H,Marty Saucedo liked: https://www.facebook.com/211969075486992/posts/2975923132424892
182076,Ms. Natalie Steiner,E,View on Facebook: https://www.facebook.com/natstein18,View on Twitter: https://twitter.com/natstein18,
182238,Ms. Shundeez Faridifar,H,View on Instagram: https://instagram.com/shundeez21,View on Twitter: https://twitter.com/shundeez21,Shundeez Faridifar liked: https://www.facebook.com/211969075486992/posts/1203841152966441
182395,Mr. Anthony Castro,H,Anthony Castro liked: https://www.facebook.com/198875430209122/posts/1169914573105198
182601,Ms. Luisa M Bran,H,Luisa Bran liked: https://www.facebook.com/211969075486992/posts/1357389367611618
182041,Mr. Mark F Beck,H,View on Instagram: https://instagram.com/kkkkaaaatie,View on Linkedin: https://www.linkedin.com/in/katie-beck-649b7729,View on Twitter: https://twitter.com/kkkkaaaatie,Mark Beck liked: https://www.facebook.com/105308188973/posts/10153823717778974
182394,Miss Danielle Elaine Frerich,H,Danielle Frerich commented: https://www.facebook.com/86774348679/posts/10158348210038680
183582,Mrs. Pricilla Stevens,E,View on Facebook: https://www.facebook.com/pricilla.stevens,View on Linkedin: https://www.linkedin.com/in/pricilla-stevens-0b0619114,View on Twitter: https://twitter.com/ps061204,
183233,Mr. Thomas Medina,E,View on Facebook: https://www.facebook.com/thomas.medina.509,View on Twitter: https://twitter.com/tm210tm,
183435,Mr. Robert Brandon Reynosa,H,Robert Reynosa liked: https://www.facebook.com/211969075486992/posts/1403813302969224
183549,Ms. Maribel Marquez Silvas,H,View on Linkedin: https://www.linkedin.com/in/maribel-silvas-293b9564,View on Twitter: https://twitter.com/10littleone,Maribel Silvas liked: https://www.facebook.com/211969075486992/posts/3474986559185211
184034,SSgt Ryan Gonzales,E,View on Facebook: https://www.facebook.com/ryan.gonzales.545,View on Twitter: https://twitter.com/xryan27x,
184475,Mr. Nicholas Alexander Schneider,H,Nicholas Schneider liked: https://www.facebook.com/86774348679/posts/10157804146098680
184546,Mr. Alex Panek,H,View on Linkedin: https://www.linkedin.com/in/alex-panek-a2372665,View on Twitter: https://twitter.com/PanekAtTheDisco,Alex Panek commented: https://www.facebook.com/86774348679/posts/10157738893558680
184658,Ms. Jocelyn Carnicle,E,View on Facebook: https://www.facebook.com/jocelyn.carnicle,View on Twitter: https://twitter.com/jocelyn_minipig,
184713,Mr. Matthew Gesell,H,Matthew Gesell liked: https://www.facebook.com/6147204570/posts/10152688625239571
183765,Ms. Lauren Taimi-Ann Zinser,H,View on Linkedin: https://www.linkedin.com/in/lauren-zinser-917b8555,Lauren Taimi-Ann Zinser liked: https://www.facebook.com/6147204570/posts/10155809195004571
183856,Mrs. Heather (Menefee) Frazer,H,View on Instagram: https://instagram.com/hmfrazer247,View on Linkedin: https://www.linkedin.com/in/heather-frazer-m-ed-6529ba94,View on Twitter: https://twitter.com/HMFrazer247,Heather Menefee Frazer liked: https://www.facebook.com/332132743905480/posts/539592193159533
184336,Mr. Garrett Matthews White,H,Garrett White liked: https://www.facebook.com/30277423311/posts/10156272627343312
184551,Mrs. Casey Fults,H,Casey Mallett Fults liked: https://www.facebook.com/198875430209122/posts/1390151747748145
184636,Ms. Callie Haley,E,View on Facebook: https://www.facebook.com/callie.haley1,View on Linkedin: https://www.linkedin.com/in/callie-haley-1592a175,View on Linkedin: https://www.linkedin.com/in/callie-haley-a98497b4/,View on Twitter: https://twitter.com/calihaley,
184791,Ms. Celeste Galvan,H,View on Twitter: https://twitter.com/gissellegalvan3,Celeste Galvan liked: https://www.facebook.com/211969075486992/posts/2023766500973898
185335,Ms. Maria H Miranda,H,Maria Miranda liked: https://www.facebook.com/411603895552292/posts/4165133806865930
185448,Ms. Tayana Rodriguez,H,Tayana Rodriguez liked: https://www.facebook.com/211969075486992/posts/1112309032119654
185454,Mr. Anthony De Gennaro,H,Anthony De Gennaro liked: https://www.facebook.com/97044772273/posts/10152625451367274
185500,Mrs. Sofia Carrizales,E,View on Facebook: https://www.facebook.com/sofia.carrizales.18,
185568,Miss Dinha Aracely Callejas,H,Dinha Aracely Callejas liked: https://www.facebook.com/6147204570/posts/467725093722373
185177,Mr. Christopher Lozano,H,Christopher Lozano liked: https://www.facebook.com/187658316064/posts/10155885104016065
185451,Mr. Bradley Swinney,H,Bradley F Swinney liked: https://www.facebook.com/198875430209122/posts/10156184579919571
186443,Ms. Hannah Harris Owens,E,View on Facebook: https://www.facebook.com/howens2,View on Linkedin: https://www.linkedin.com/in/hannahowens13,
186457,Ms. Salena Jenai Ramirez,H,View on Twitter: https://twitter.com/sal705,Salena Ramirez liked: https://www.facebook.com/6147204570/posts/10159259188449571
186726,Mr. Pablo S Duque III,H,Pablo Duque reacted: https://www.facebook.com/6147204570/posts/10158725236549571
186810,Ms. Brittany Larson,H,View on Twitter: https://twitter.com/larson_brittany,Brittany Larson commented: https://www.facebook.com/198875430209122/posts/2262582703963953
186864,Ms. Jennifer Lynn White,H,View on Linkedin: https://www.linkedin.com/in/jennifer-white-7b211b51,View on Twitter: https://twitter.com/jenniferw423,Jennifer White liked: https://www.facebook.com/211969075486992/posts/3633277880022744
186323,Ms. Maritza Cardenas,H,Maritza Cardenas liked: https://www.facebook.com/187658316064/posts/10154742300111065
186384,Ms. Hannah Elyse Heinze,H,Hannah Elyse Heinze reacted: https://www.facebook.com/86774348679/posts/10159587066523680
186711,Ms. Katrina Marie Konetzke,H,Katrina Konetzke liked: https://www.facebook.com/187658316064/posts/10152901986536065
186750,Mr. Welliams Gutierrez,E,View on Facebook: https://www.facebook.com/welliams.gutierrez,
187312,Mr. Paul A. Cuellar,H,Paul Cuellar liked: https://www.facebook.com/86774348679/posts/10158199171508680
187314,Mr. Adam Cantu,H,Adam Cantu liked: https://www.facebook.com/198875430209122/posts/662476357182358
187977,Mr. Derek M Krueger,E,View on Facebook: https://www.facebook.com/derek.krueger.90,
188106,Ms. Raquel Castaneda,H,View on Twitter: https://twitter.com/rrodriguez192,Raquel Rodriguez Castaneda liked: https://www.facebook.com/86774348679/posts/10158523754683680
188475,Mr. Zackery Alan Holloway,H,Zackery Holloway liked: https://www.facebook.com/86774348679/posts/10159528664858680
188635,Mr. Austin Kyle Bingham,H,Austin Bingham liked: https://www.facebook.com/86774348679/posts/10159013714903680
187956,Ms. Lauren Elizabeth Medina,H,Lauren Hallie Medina liked: https://www.facebook.com/211969075486992/posts/2609950999022109
188366,Mr. Shawn Walter Harward,H,View on Twitter: https://twitter.com/wardhare,Shawn Harward reacted: https://www.facebook.com/211969075486992/posts/3647140018636530
188742,Mr. Matthew David Hypke,H,View on Twitter: https://twitter.com/ShannonHypke,Matthew Hypke liked: https://www.facebook.com/211969075486992/posts/2421809277836283
188792,Mr. Tyler Richard Martini,H,Tyler Martini liked: https://www.facebook.com/86774348679/posts/10159144365133680
188961,Mr. Pat D "PD" McIntyre,H,View on Twitter: https://twitter.com/PatMcIn27892974,Pat McIntyre liked: https://www.facebook.com/6147204570/posts/10158233706794571
189661,Ms. Erin Eileen Sanchez,H,View on Twitter: https://twitter.com/rio_rogan,Erin Kellum Sanchez reacted: https://www.facebook.com/86774348679/posts/10158296043028680
190001,Mr. Angel Sandate Hernandez,H,Angel Hernandez liked: https://www.facebook.com/126515304094581/posts/3961664987246241
190456,Ms. Rosalie Nicole Barrera,H,Rosalie Barrera liked: https://www.facebook.com/211969075486992/posts/3085997898084081
190574,Ms. Evelyn Flores,H,Evelyn Flores liked: https://www.facebook.com/6147204570/posts/10158933900824571
190578,Ms. Karina Ivanova Bello,H,Karina Bello liked: https://www.facebook.com/211969075486992/posts/3092847857399085
190304,Mr. Nolan Michael Mainguy,H,View on Linkedin: https://www.linkedin.com/in/nolan-mainguy-8a916a59,View on Twitter: https://twitter.com/NolanMainguy,Nolan Mainguy liked: https://www.facebook.com/6147204570/posts/10154845505674571
190368,Mr. Brennan James Mittal,H,View on Linkedin: https://www.linkedin.com/in/brennan-mittal-b4617a60,Brennan Mittal liked: https://www.facebook.com/97044772273/posts/10155603249782274
190819,Ms. Teresa L. Deis,H,View on Linkedin: https://www.linkedin.com/in/teresa-deis-41a5387,Teresa Lindsay Deis liked: https://www.facebook.com/211969075486992/posts/3576441549039711
191527,Mrs. Rebecca Ann Aleman,H,View on Linkedin: https://www.linkedin.com/in/rebecca-aleman-7923a353,View on Twitter: https://twitter.com/BeccaAleman,Rebecca Aleman reacted: https://www.facebook.com/211969075486992/posts/2493604380656772
191578,Ms. Dora N. Ayala,H,View on Twitter: https://twitter.com/mrsmelayala,Dora Nicole Ayala liked: https://www.facebook.com/411603895552292/posts/3983689685010344
191610,Mrs. Mona Blancas,H,Mona Blancas liked: https://www.facebook.com/86774348679/posts/10159485159978680
191665,Mr. Jonathon Brandon James,H,Jonathon James liked: https://www.facebook.com/211969075486992/posts/1102220736461817
190959,Ms. Veronica V. Benavides,E,View on Facebook: https://www.facebook.com/veronica.benavides.9887,
