170749,Miss Marcela (Rodriguez) Rodriguez Garcia,H,Marcela Rodriguez reacted: https://www.facebook.com/6147204570/posts/10158971770099571
170812,Mrs. Hannah Douglas,H,Hannah Douglas commented: https://www.facebook.com/211969075486992/posts/2021910101159538
171558,Mr. Abel Lopez,H,Abel Lopez commented: https://www.facebook.com/198875430209122/posts/320412202118377
171559,Miss Michelle Nolasco,H,Michelle Nolasco reacted: https://www.facebook.com/211969075486992/posts/1342960662387822
17186,Mr. Steve Meyer,H,Steve Meyer commented: https://www.facebook.com/6147204570/posts/10150622411504571
172136,Mrs. Melanie (Aranda) Tawil,H,View on Linkedin: https://www.linkedin.com/in/melanie-tawil-aba1768,View on Twitter: https://twitter.com/TXmaranda,Melanie Aranda Tawil reacted: https://www.facebook.com/86774348679/posts/10157246765743680
172213,Mr. Hunter Brandon "Brandon" Jones,H,Hunter Jones commented: https://www.facebook.com/211969075486992/posts/1745482692135615
172254,Ms. Rosemary Giamfortone,H,Rosemary Giamfortone commented: https://www.facebook.com/6147204570/posts/10153413161509571
172437,Ms. Vicki Gray,H,View on Twitter: https://twitter.com/vgray1212,Vicki Gray reacted: https://www.facebook.com/86774348679/posts/10156495619593680
171969,Mr. Bruce Eichman,E,View on Facebook: https://www.facebook.com/bruce.eichman,
172468,Mrs. Loretta M "Lori" Thomas,H,View on Twitter: https://twitter.com/LoriTho67454516,Loretta Thomas reacted: https://www.facebook.com/169297629793385/posts/2527939540595837
173170,Mr. Sean Huckleberry,H,View on Linkedin: https://www.linkedin.com/in/sean-huckleberry-a6666380,View on Twitter: https://twitter.com/SeanHuck,Sean Huckleberry commented: https://www.facebook.com/6147204570/posts/10155981110009571
173180,Ms. Laura A Ibarra,H,Laura Castillo Ibarra commented: https://www.facebook.com/6147204570/posts/10155541179789571
173854,Mrs. Patrice Johnelle "Johnelle" Sparks,H,Johnelle Smith Sparks commented: https://www.facebook.com/126515304094581/posts/3287539911325422
174151,Mr. Peter Rubins,H,Peter Rubins commented: https://www.facebook.com/126515304094581/posts/2791275364482133
174422,Ms. Janet Ratcliff,E,View on Facebook: https://www.facebook.com/janet.ratcliff.9,
174757,Ms. Irene Alvarado,H,Irene Alvarado commented: https://www.facebook.com/211969075486992/posts/2734165049934036
173912,Mr. Jonathan Tirado,H,View on Linkedin: https://www.linkedin.com/in/jonathan-tirado-9368b855,Jonathan Tirado reacted: https://www.facebook.com/211969075486992/posts/1367045836645971
174897,Ms. Summer Marcelle Batiste,H,Summer Batiste reacted: https://www.facebook.com/6147204570/posts/2967262483531172
175003,Mrs. Jordan C. (Calhoun) Garcia,H,Jordan Garcia reacted: https://www.facebook.com/6147204570/posts/10158683816319571
175159,Ms. Leigha K Cruz,H,Leigha Cruz reacted: https://www.facebook.com/198875430209122/posts/950654261697898
176583,Mrs. Christa Marie (Villarreal) Barrera,H,View on Linkedin: https://www.linkedin.com/in/christabarrera/,Christa Villarreal reacted: https://www.facebook.com/211969075486992/posts/1913872601963289
177036,Mr. Daniel Nicolas Perales,H,Daniel Perales commented: https://www.facebook.com/6147204570/posts/10154588998244571
178969,Mr. Lewis C. "Chuck" Corbitt,H,View on Linkedin: https://www.linkedin.com/in/chuckcorbitt,View on Twitter: https://twitter.com/chuck_corbitt,Chuck Corbitt commented: https://www.facebook.com/86774348679/posts/10159634988958680
179023,Mr. Aragon L. Scherpereel,E,View on Facebook: https://www.facebook.com/aragon.scherpereel,
179389,Mr. Rynel Castelltort Gervacio,E,View on Facebook: https://www.facebook.com/RynelG,View on Twitter: https://twitter.com/RynelG_,
17870,Mrs. Debbie Grady,H,View on Twitter: https://twitter.com/ECUDr,Debbie Grady commented: https://www.facebook.com/6147204570/posts/10156947655984571
179066,Mr. Kevin Primeaux,E,View on Facebook: https://www.facebook.com/kevin.primeaux,View on Twitter: https://twitter.com/kevinprimeaux,
180129,Mr. Anthony Almendarez,H,Anthony Almendarez commented: https://www.facebook.com/6147204570/posts/558009584667062
181265,Mr. Andrew J Elizalde,H,View on Instagram: https://instagram.com/andytx_,View on Twitter: https://twitter.com/andytx_,Andrew Elizalde commented: https://www.facebook.com/198875430209122/posts/594526433977351
181342,Mr. Duncan Henry Hughes,E,View on Facebook: https://www.facebook.com/duncan.hughes.18,
181542,Ms. Becki Ann Taylor,H,Becki Taylor commented: https://www.facebook.com/105308188973/posts/10151318926338974
182302,Ms. Lizeth Paola Gonzalez,H,Lizeth Gonzalez reacted: https://www.facebook.com/211969075486992/posts/2744641932219681
182456,Mr. Jose Luis La Placa,H,Jose La Placa reacted: https://www.facebook.com/211969075486992/posts/1750454398305111
182488,Mr. Jared Steven Alberto,H,View on Linkedin: https://www.linkedin.com/in/jared-alberto-0126637a/,Jared Alberto invited: https://www.facebook.com/211969075486992/posts/1076047152412509
182583,Ms. Shoshannah Kaye Blackwell,H,Shoshannah Kaye Blackwell commented: https://www.facebook.com/6147204570/posts/10156755403779571
183124,Mr. Austin Edward Lee,H,Austin Lee commented: https://www.facebook.com/97044772273/posts/10155785070497274
182970,Mrs. Tamara Dawn (Hall) Ozuna,H,Tamara Hall reacted: https://www.facebook.com/411603895552292/posts/3051197764926212
182998,Ms. Lucia Elena Hernandez,H,Lucia Hernandez reacted: https://www.facebook.com/211969075486992/posts/3168891259794744
183023,Miss Kara M. Holcomb,H,View on Twitter: https://twitter.com/litheral,Kara Holcomb commented: https://www.facebook.com/331823501154/posts/10150381443911155
184457,Ms. Beatris Martinez,H,Beatris Martinez commented: https://www.facebook.com/211969075486992/posts/3283890791628123
184623,PFC Clint Garrett Seal,E,View on Facebook: https://www.facebook.com/garrett.m.seal,View on Twitter: https://twitter.com/SINcitySEAL,
183838,Ms. Kirstin Boe,H,Kirstin Boe commented: https://www.facebook.com/211969075486992/posts/767983709885523
184784,Ms. Ashley Villarreal,H,Ashley Cortez reacted: https://www.facebook.com/211969075486992/posts/1649374595079759
185253,Mrs. Raquel Janes,H,Raquel Janes reacted: https://www.facebook.com/211969075486992/posts/1530279853655901
186214,Ms. Graciela Luna-Buster,H,Graciela Luna-Buster commented: https://www.facebook.com/6147204570/posts/10157144453549571
186636,Mr. Luis Velazquez,H,View on Linkedin: https://www.linkedin.com/in/luis-velazquez-427b3aa9,Luis Velazquez commented: https://www.facebook.com/211969075486992/posts/1269394299744459
186723,Ms. Chris Rincon,H,Chris Rincon commented: https://www.facebook.com/86774348679/posts/10153868411583680
186567,Mrs. Dana Grubb,E,View on Facebook: https://www.facebook.com/dana.grubb.3,View on Linkedin: https://www.linkedin.com/in/dana-grubb-3a803b86,View on Twitter: https://twitter.com/dagrubb10,
186572,Ms. Tamera D. Rhodes,E,View on Facebook: https://www.facebook.com/tamera.rhodes.5,View on Twitter: https://twitter.com/DanielsElaine,
187107,Ms. Jo Ann "Joann" Jones,H,View on Linkedin: https://www.linkedin.com/in/joann-jones-58422150,Jo Ann Jones reacted: https://www.facebook.com/411603895552292/posts/3069565433089445
187325,Mrs. Janie Campos,H,Janie B. Campos commented: https://www.facebook.com/198875430209122/posts/1495771013852884
187704,Ms. Kristen A George,H,Kristen A George commented: https://www.facebook.com/211969075486992/posts/1508787339138486
187724,Ms. Faith Elizabeth Braverman,E,View on Facebook: https://www.facebook.com/faith.braverman,
188787,Ms. Alyssa Jamie Bunting,H,View on Twitter: https://twitter.com/lyssajamie,Alyssa Bunting reacted: https://www.facebook.com/140062069348988/posts/3935080649847092
188286,Ms. Jessica Aguirre,H,Jessica Aguirre reacted: https://www.facebook.com/211969075486992/posts/2948491775168028
188417,Mr. David William Harnden,H,David Harnden commented: https://www.facebook.com/211969075486992/posts/3676810145669517
189178,Ms. Sandra Isabel Patroni,H,Sandra Patroni reacted: https://www.facebook.com/211969075486992/posts/3168891259794744
190506,Ms. Rachel Louise Kane,E,View on Facebook: https://www.facebook.com/rlkane,View on Linkedin: https://www.linkedin.com/in/rachel-kane-97259882,View on Twitter: https://twitter.com/rachelkane,
190492,Ms. Amanda Kate Gagliano,H,Amanda Gagliano reacted: https://www.facebook.com/211969075486992/posts/1367045836645971
190999,Mr. Bobby R. Sharp,H,Bobby R Sharp commented: https://www.facebook.com/198875430209122/posts/1805141186249197
191462,Mr. Roland Summerville,H,Roland Summerville commented: https://www.facebook.com/86774348679/posts/10159530828048680
191678,Mr. Marco Ochoa,H,Marco Ochoa reacted: https://www.facebook.com/97044772273/posts/10156157171212274
191850,Mrs. Roxanne Lozano,H,View on Linkedin: https://www.linkedin.com/in/roxanne-lozano-32919a15,View on Twitter: https://twitter.com/MsRoxanneLozano,Roxanne Lee Lozano reacted: https://www.facebook.com/211969075486992/posts/3045763062107565
192611,Ms. Edith Ambrester,H,Edith Ambrester commented: https://www.facebook.com/97044772273/posts/10200552804690842
192621,Mrs. Pearl A. Canales,H,Pearl Canales commented: https://www.facebook.com/6147204570/posts/10154894083539571
192652,Mr. Barry Andrews,E,View on Facebook: https://www.facebook.com/barry.andrews.501,View on Twitter: https://twitter.com/andrews_barry,
193734,Ms. Alexis Ayala,E,View on Facebook: https://www.facebook.com/alexis.ayala.58323,View on Twitter: https://twitter.com/Alexis_UTSA,
194325,Ms. Joelle Fox Davis,H,View on Twitter: https://twitter.com/JoelleDavis907,Joelle Fox Davis commented: https://www.facebook.com/97044772273/posts/10152282368902274
19419,Ms. Luann Tomkinson,H,View on Linkedin: https://www.linkedin.com/in/luanntomkinson,View on Twitter: https://twitter.com/lulynn3,Luann Tomkinson reacted: https://www.facebook.com/86774348679/posts/10157613525673680
194337,Ms. Amanda Elize Delgado,H,View on Twitter: https://twitter.com/mandadelgado,Amanda Delgado commented: https://www.facebook.com/211969075486992/posts/3731454213538443
195294,Ms. Johanna Torres,H,Johanna Torres reacted: https://www.facebook.com/211969075486992/posts/1891372827546600
194875,Mr. Jeffrey Adam Morriss,H,Jeffrey Morriss commented: https://www.facebook.com/211969075486992/posts/1204417042908852
195967,Mr. Nicholas "Nick" Strope,H,Nick Strope reacted: https://www.facebook.com/211969075486992/posts/3594220877261778
195983,Mr. John Claus Von Dohlen IV,H,John David Von Dohlen commented: https://www.facebook.com/261043174069349/posts/702495289924133
196229,Ms. Tawny Christina Smith,E,View on Facebook: https://www.facebook.com/tawny.smith.7,
196833,Mrs. Shayna Regalado,H,Shayna Regalado commented: https://www.facebook.com/86774348679/posts/10153723609383680
197083,Ms. Alyssa Jimenez,H,Alyssa Jimenez reacted: https://www.facebook.com/211969075486992/posts/3478384185512115
196869,Ms. Tonja Armstrong,H,Tonja L Armstrong commented: https://www.facebook.com/211969075486992/posts/1010661765617715
197545,Mr. John Heridia,H,John Heridia commented: https://www.facebook.com/6147204570/posts/10155795028379571
197966,Mr. Ryan C. Crenwelge,H,Ryan Crenwelge commented: https://www.facebook.com/6147204570/posts/10155719121924571
197656,Ms. Lucille Hawkins Stocker,H,Lucille Hawkins Stocker commented: https://www.facebook.com/6147204570/posts/10151756577639571
198314,Ms. Jocelyn Hernandez,H,Jocelyn Hernandez reacted: https://www.facebook.com/211969075486992/posts/3614314215252444
199015,Mr. Jordan Paul Aguilera,E,View on Facebook: https://www.facebook.com/jordan.aguilera,View on Twitter: https://twitter.com/J_Aguilera454,
199008,Ms. Laura Louise Wright,H,Laura Wright reacted: https://www.facebook.com/211969075486992/posts/1367045836645971
199104,Mr. Victor Alphonso Lamas,E,View on Facebook: https://www.facebook.com/victor.lamas.5,View on Twitter: https://twitter.com/vlamas62,
199199,Ms. Glynn Margaret Dickens,H,Glynn Dickens commented: https://www.facebook.com/187658316064/posts/10154862091446065
199802,Ms. Elizabeth Ann Santos,E,View on Facebook: https://www.facebook.com/elizabeth.a.santos.98,
199348,Ms. Martha Beatriz Santillan,H,Martha Santillan reacted: https://www.facebook.com/86774348679/posts/10154170146893680
199794,Mr. Ian Jacobson,H,View on Linkedin: https://www.linkedin.com/in/ian-rooster-jacobson-mba-abab9aa,Ian Jacobson commented: https://www.facebook.com/187658316064/posts/10152968672076065
200646,Ms. Irene Mary (Sanchez) Jimenez,E,View on Facebook: https://www.facebook.com/irene.gomezjimenez.9,
200663,Mrs. Carole Walker,E,View on Facebook: https://www.facebook.com/carole.walker2,View on Linkedin: https://www.linkedin.com/in/carolewalker,View on Twitter: https://twitter.com/WalkerWalkerc,
201261,Ms. Stephanie D. Dooley,H,Stephanie Dooley commented: https://www.facebook.com/211969075486992/posts/2442763659074178
201273,Ms. Bianca Ofure Obinyan,H,View on Linkedin: https://www.linkedin.com/in/bianca-obinyan-846232ba,View on Twitter: https://twitter.com/Ayee_ItsBianca,Bianca Obinyan reacted: https://www.facebook.com/86774348679/posts/10159160705213680
201570,Mr. Philip Michael "Phil" Gonzales,H,Phil Gonzales commented: https://www.facebook.com/211969075486992/posts/1728757470474804
202037,Ms. Kai Smith,H,Kai McIntosh Smith reacted: https://www.facebook.com/86774348679/posts/10157715027968680
202685,Mrs. Darla A Forney,E,View on Facebook: https://www.facebook.com/darla.forney,View on Twitter: https://twitter.com/darla_david,
202265,Ms. Victoria Anne "Tori" Snoddy,H,Victoria Snoddy reacted: https://www.facebook.com/97044772273/posts/10156022699302274
203125,Mrs. Belinda (Kypuros) Sensiba,H,Belinda Kypuros reacted: https://www.facebook.com/211969075486992/posts/3033480813335790
204134,Mrs. Patricia "Patty" Fagan-Miller,H,Patty Fagan-Miller reacted: https://www.facebook.com/211969075486992/posts/3693864543964077
204254,Ms. Cynthia Quezada,H,Cynthia Quezada commented: https://www.facebook.com/86774348679/posts/10156580847733680
205504,Ms. Melanie Palitos,H,Melanie Palitos commented: https://www.facebook.com/198875430209122/posts/950654261697898
204888,Dr. Tyra Manning,H,View on Twitter: https://twitter.com/tmgrate,Tyra Manning reacted: https://www.facebook.com/6147204570/posts/10154835936539571
205041,Miss Brooke Hayes,H,View on Twitter: https://twitter.com/brookersofpink,Brooke Hayes reacted: https://www.facebook.com/211969075486992/posts/1367659639917924
205594,Ms. Lauren Renee Abbey,H,Lauren Abbey reacted: https://www.facebook.com/211969075486992/posts/2875652389118634
206169,Ms. Miranda Lamar Hernandez,H,Miranda Hernandez commented: https://www.facebook.com/211969075486992/posts/3549433478407185
205853,Ms. McKayla Ruth McCarty,H,McKayla McCarty reacted: https://www.facebook.com/211969075486992/posts/3221007271249809
206567,Mr. Santos Retta Cortez,H,Santos Cortez reacted: https://www.facebook.com/6147204570/posts/10158850022249571
206848,Miss Raven Douglas,H,View on Twitter: https://twitter.com/raven0593,Raven Douglas reacted: https://www.facebook.com/86774348679/posts/10157516810178680
207038,Mr. Oscar Alberto Cantua,H,Oscar Cantua commented: https://www.facebook.com/211969075486992/posts/1218606418156581
207064,Ms. Jacqulynn Marie Pacini,H,Jacqulynn Pacini reacted: https://www.facebook.com/211969075486992/posts/1734417513242133
207282,Mr. Adolph Mora,E,View on Facebook: https://www.facebook.com/adolph.mora,
207524,Miss Jessica Lee Faulk,H,Jessica Faulk commented: https://www.facebook.com/211969075486992/posts/866029073414319
207755,Ms. Nubia Yazmin "Nuby" Sanchez,H,Nubia Sanchez reacted: https://www.facebook.com/97044772273/posts/10156509669297274
20797,Mr. Eric Edward Crawford,H,Eric Crawford commented: https://www.facebook.com/211969075486992/posts/3720692124614652
208238,Mr. Angel Alexander Chavez,E,View on Facebook: https://www.facebook.com/ANbreeziGEL,View on Instagram: https://instagram.com/boi_kryptik,View on Linkedin: https://www.linkedin.com/in/angel-chavez-61a909b1,View on Twitter: https://twitter.com/Boi_Kryptik,
207713,Ms. Alicia Alvarado,H,Alicia Alvarado reacted: https://www.facebook.com/211969075486992/posts/1390345070982714
208259,Ms. Kristin Law,H,View on Instagram: https://instagram.com/greeneyedlaw,View on Twitter: https://twitter.com/greeneyedlaw,Kristin Law reacted: https://www.facebook.com/211969075486992/posts/1505308002819753
208520,Ms. Jovanna Lizeth Leza,H,Jovanna Leza commented: https://www.facebook.com/6147204570/posts/10154523771879571
208643,Ms. Briana Michele Gomez,H,Briana Gomez reacted: https://www.facebook.com/211969075486992/posts/2566277060056170
209262,Ms. Sabrina Marie Hicks,E,View on Facebook: https://www.facebook.com/Sabrina.M.Hicks,View on Instagram: https://instagram.com/mfsabrinah,View on Twitter: https://twitter.com/mfsabrinah,
209328,Ms. Heather M Kennedy,H,Heather Kennedy reacted: https://www.facebook.com/198875430209122/posts/1826799317416717
209243,Mr. Ferrington Goode Macon,H,Ferrington Macon commented: https://www.facebook.com/6147204570/posts/10154739135039571
209285,Mr. Ryan Michael Ibsen,H,Ryan Ibsen commented: https://www.facebook.com/187658316064/posts/110829802294871
209500,Mr. John M. Paiz,E,View on Facebook: https://www.facebook.com/john.m.paiz,View on Twitter: https://twitter.com/JohnPaiz,
209627,Mr. Elias "Eli" Uriegas,H,View on Linkedin: https://www.linkedin.com/pub/elias-uriegas/98/345/993,View on Twitter: https://twitter.com/_seemethere,Eli Uriegas commented: https://www.facebook.com/126515304094581/posts/446901210057463
209761,Ms. Leah Jolene Muse,H,Leah Muse reacted: https://www.facebook.com/211969075486992/posts/1769382189745665
210348,Ms. Jessica Lugo,H,Jessica Lugo reacted: https://www.facebook.com/86774348679/posts/10158498118603680
210256,Mrs. Lauren Marie (Cesmirosky) Quinn,H,Lauren Quinn reacted: https://www.facebook.com/86774348679/posts/10158848221143680
210588,Dr. Wendell Griffith,E,View on Facebook: https://www.facebook.com/wendellpgriffith,View on Linkedin: https://www.linkedin.com/in/wendell-griffith-57787410,
210745,Ms. Krystal Allison Trlicek,H,Krystal Trlicek commented: https://www.facebook.com/187658316064/posts/10152631839441065
211643,Mr. Jordan Samfield,E,View on Facebook: https://www.facebook.com/jordan.samfield,View on Linkedin: https://www.linkedin.com/in/jordansamfield,View on Twitter: https://twitter.com/SamfieldGroup,
211993,Mrs. Kathryn "Katy" Henderson,H,Katy Henderson reacted: https://www.facebook.com/211969075486992/posts/3655638377786694
211994,Mrs. Annie Penner Herrera,H,Annie Herrera commented: https://www.facebook.com/126515304094581/posts/333314641282456
211663,Ms. Leahann M Rodriguez,H,Leahann Rodriguez reacted: https://www.facebook.com/86774348679/posts/10156725310823680
211788,Mrs. Martha R. Sarrack,H,Martha Farrow Sarrack commented: https://www.facebook.com/169297629793385/posts/919209304802210
213021,Mr. Joe Deray Phearse,H,Joe Phearse invited: https://www.facebook.com/211969075486992/posts/1102746133075944
213171,Mrs. Cerise Edmonds,H,View on Linkedin: https://www.linkedin.com/in/cerise-edmonds-630b9316,View on Twitter: https://twitter.com/oceanus17,Cerise Marie Edmonds reacted: https://www.facebook.com/411603895552292/posts/4080882011957777
212464,Mrs. Gloria A. Herrera,E,View on Facebook: https://www.facebook.com/gloria.alicia.94,
214099,Ms. Dana L Thrush,H,Dana Thrush commented: https://www.facebook.com/6147204570/posts/10153345811659571
214605,Mrs. Dianne (Cortinas) Gonzalez,E,View on Facebook: https://www.facebook.com/dianne.cortinas,
214527,Ms. Jessica (Gutierrez) Pyrek,H,View on Linkedin: https://www.linkedin.com/in/jessica-pyrek-08871412a,Jessica Pyrek reacted: https://www.facebook.com/211969075486992/posts/2891928310824375
215361,Mrs. Ducharme Yasmine Holley,H,Ducharme Holley reacted: https://www.facebook.com/211969075486992/posts/1367045836645971
215524,Mrs. Glenda Marie Trevino,H,Glenda Trevino reacted: https://www.facebook.com/126515304094581/posts/2728780620534690
215609,Mrs. Jacqueline Marie Dominguez,H,Jacqueline Dominguez reacted: https://www.facebook.com/211969075486992/posts/2198542760162937
215823,Mr. Josue Azael Solalinde,H,Josue Solalinde reacted: https://www.facebook.com/126515304094581/posts/300276571726079
216274,Mrs. Nelly D. Franco,E,View on Facebook: https://www.facebook.com/nelly.franco.7,View on Linkedin: https://www.linkedin.com/in/honorio-franco-0722b496,View on Twitter: https://twitter.com/ay_nelly,
216461,Mr. Roland Robert Cruz,E,View on Facebook: https://www.facebook.com/roland.cruz.12,View on Twitter: https://twitter.com/rcruz7249,
216093,Mr. Mario A. Cortez,E,View on Facebook: https://www.facebook.com/kohven,
21610,Dr. Tammy Estelle Webb PhD,H,View on Twitter: https://twitter.com/txdrtammy,Tammy Webb commented: https://www.facebook.com/211969075486992/posts/3393363824014152
216264,Mr. Nathan Edward Crosby,H,Nathan Crosby reacted: https://www.facebook.com/211969075486992/posts/3168891259794744
216361,Mrs. Rachel Christine Pierce,H,Rachel C. Pierce reacted: https://www.facebook.com/6147204570/posts/10155695967934571
217252,Ms. Gloria E. Silva,H,Gloria Silva commented: https://www.facebook.com/86774348679/posts/10154797221413680
217685,Mr. Omar Aguirre,H,Omar Daniel Aguirre commented: https://www.facebook.com/211969075486992/posts/1390345070982714
217697,Mrs. Joni Ferguson (Spaks) Reyna,H,View on Linkedin: https://www.linkedin.com/in/joni-reyna-ms-775b4011,Joni Ferguson Reyna reacted: https://www.facebook.com/211969075486992/posts/2035366349813913
217900,Mrs. Belinda Anna (Valdez) Flores,H,View on Linkedin: https://www.linkedin.com/in/belinda-flores-26357643,View on Twitter: https://twitter.com/BFlores1221,Belinda Valdez reacted: https://www.facebook.com/126515304094581/posts/1381791815516181
217844,Ms. Jessenya Guzman,H,Jessenya Guzman reacted: https://www.facebook.com/86774348679/posts/10157989296518680
218394,Mr. Ray Torres,H,Ray Torres commented: https://www.facebook.com/211969075486992/posts/1508787339138486
218167,Mrs. Kyra Lee (Clark) McCluggage,H,Kyra McCluggage commented: https://www.facebook.com/211969075486992/posts/1172722112745012
218269,Ms. Valerie M Gomez,E,View on Facebook: https://www.facebook.com/valerie.gomez.50552,
218611,Ms. Nicole Yznaga,H,Nicole Yznaga reacted: https://www.facebook.com/411603895552292/posts/3983689685010344
218833,Mrs. Zina Latrisha (Stevens) Wormley,H,View on Linkedin: https://www.linkedin.com/in/zina-wormley-7547949a,Zina Stevens Wormley reacted: https://www.facebook.com/332132743905480/posts/430655060719914
219466,Mr. Jacob Paul Coull,H,View on Twitter: https://twitter.com/coulltwo,Jacob Coull commented: https://www.facebook.com/86774348679/posts/10157203747243680
219732,Mr. Forrest Cooper Gray,H,View on Linkedin: https://www.linkedin.com/in/forrestgray,View on Twitter: https://twitter.com/fastcarsspeed,Forrest Gray commented: https://www.facebook.com/198875430209122/posts/1790468591049790
218920,Ms. Rachel E. Cruz,H,Rachel Marie Cruz reacted: https://www.facebook.com/261043174069349/posts/935089549998038
219363,Mr. Stebin Muringasseril John,H,Stebin John commented: https://www.facebook.com/211969075486992/posts/3393143930702808
219580,Ms. Tiara Chenae Tillman,H,Tiara Tillman reacted: https://www.facebook.com/126515304094581/posts/2845568598855891
21997,Ms. Joann V. Martinez,H,Joann Martinez reacted: https://www.facebook.com/126515304094581/posts/3244264128986334
220402,Ms. Bailie Renee Gardner,H,View on Linkedin: https://www.linkedin.com/in/bailiegardner,View on Twitter: https://twitter.com/bailielove1,Bailie Gardner reacted: https://www.facebook.com/211969075486992/posts/1508787339138486
220259,Ms. Melissa Marie Arredondo,H,View on Twitter: https://twitter.com/melissamariee93,Melissa Marie Arredondo commented: https://www.facebook.com/198875430209122/posts/294509130645751
220270,Ms. Amy Sue Sanchez,H,Amy Sanchez commented: https://www.facebook.com/211969075486992/posts/2343421942341684
220363,Ms. Allison Carolyn Valdivia,H,Allison C Valdivia reacted: https://www.facebook.com/211969075486992/posts/1367045836645971
221300,Ms. Mikayla Peri,H,Mikayla Jade Peri reacted: https://www.facebook.com/86774348679/posts/10156541832793680
221408,Ms. Alexis Pamela Puentes,H,Alexis Pamela Puentes reacted: https://www.facebook.com/211969075486992/posts/3451251678225366
220683,Ms. Alejandra Valdez,E,View on Facebook: https://www.facebook.com/alejandra.valdez.543,
22084,Mrs. Barbara E. (Willis) Thompson,H,Barbara Willis commented: https://www.facebook.com/97044772273/posts/10156277111902274
221112,Ms. Deja C. Jackson,E,View on Facebook: https://www.facebook.com/deja.jackson.5,View on Linkedin: https://www.linkedin.com/in/deja-jackson-00279aa8,
221577,Ms. Gabriela Marie Salas,H,Gabriela N Salas reacted: https://www.facebook.com/211969075486992/posts/1739959496021268
222059,Mrs. Ruth Horace,E,View on Facebook: https://www.facebook.com/ruth.horace,View on Linkedin: https://www.linkedin.com/in/ruth-horace-74033446,View on Twitter: https://twitter.com/successinhand,
222368,Mr. Roger Buentello,E,View on Facebook: https://www.facebook.com/roger.buentello,
222401,Miss Leslie Ann Kortz,H,Leslie Kortz reacted: https://www.facebook.com/211969075486992/posts/2891928310824375
222468,Mr. Devin Andrew Olvera,H,Devin Olvera reacted: https://www.facebook.com/169297629793385/posts/1132426056813866
223104,Ms. Alexandra Fuentes,H,Alexandra Fuentes commented: https://www.facebook.com/211969075486992/posts/1326641270686428
223198,Ms. Stefany Wampler,H,View on Linkedin: https://www.linkedin.com/in/stefany-wampler-18a4471a,Stefany Wampler reacted: https://www.facebook.com/86774348679/posts/10158007032058680
223513,Ms. Haley Elizabeth Schuetzle,H,Haley Schuetzle commented: https://www.facebook.com/211969075486992/posts/1646153628735189
