224881,Ms. Connie Pina,E,View on Facebook: https://www.facebook.com/ConnieFrancisPina,View on Twitter: https://twitter.com/Cpink07,
225157,Ms. Ayla Perez,H,Ayla Perez commented: https://www.facebook.com/6147204570/posts/10158683816319571
225357,Miss Olga M Trujillo,H,Olga Trujillo reacted: https://www.facebook.com/211969075486992/posts/3732520016765196
225244,Mr. Oscar Briones  Jr.,H,Oscar Briones commented: https://www.facebook.com/211969075486992/posts/1344503725566849
225749,Ms. Priscilla Lorraine Velasquez,H,Priscilla Velasquez commented: https://www.facebook.com/6147204570/posts/10154523771879571
226865,Mr. Valentin Tinajero,H,Valentin Tinajero commented: https://www.facebook.com/211969075486992/posts/1508787339138486
226916,Ms. Cynthia Avila,E,View on Facebook: https://www.facebook.com/cynthia.avila.967,View on Instagram: https://instagram.com/cindywindy11,View on Twitter: https://twitter.com/cindywindy11,
226469,Mr. Morgan Christian McAlister,E,View on Facebook: https://www.facebook.com/morgan.mcalister.7,
226562,Ms. Ana Del Toro,H,Ana Julieta Del Toro commented: https://www.facebook.com/211969075486992/posts/1501094573241096
226789,Mr. Justin Dickinson,H,Justin Dickinson commented: https://www.facebook.com/211969075486992/posts/1508787339138486
227336,Mr. Isaac Cantu,H,Isaac Cantu reacted: https://www.facebook.com/211969075486992/posts/1530274066989813
22773,Mr. Paul Edison Hurst  Jr.,H,Paul Hurst commented: https://www.facebook.com/86774348679/posts/10158731519528680
227753,Ms. Gloria A. Gdovin,E,View on Facebook: https://www.facebook.com/gloria.gdovin,View on Twitter: https://twitter.com/gloriagdovin,
227848,Mr. Obed Hernandez,H,Obed Hernandez reacted: https://www.facebook.com/211969075486992/posts/2198542760162937
227783,Mr. Matthew R. Sinclair,H,View on Twitter: https://twitter.com/MattMovieGeek,Matthew Sinclair commented: https://www.facebook.com/211969075486992/posts/1089134584437099
227828,Miss Amara Limon,H,Amara Limon reacted: https://www.facebook.com/97044772273/posts/10156502352017274
227839,Mr. Steven Blakeley,H,Steven Blakeley commented: https://www.facebook.com/211969075486992/posts/2042618379088710
228039,Ms. Rosana Blanco-Cano,H,Rosana Blanco-Cano commented: https://www.facebook.com/411603895552292/posts/3983689685010344
228201,Mr. Erasmo Rascon,H,Erasmo Rascon reacted: https://www.facebook.com/211969075486992/posts/3185844604766076
228432,Miss Daniella D Gonzalez,H,Daniella Gonzalez commented: https://www.facebook.com/6147204570/posts/10155658181944571
228803,Ms. Krystal Noel Solano,E,View on Facebook: https://www.facebook.com/Krysnoel26,
228949,Mr. Nikolas Anthony Goff,H,View on Linkedin: https://www.linkedin.com/in/nikolas-goff/,Nikolas Goff reacted: https://www.facebook.com/6147204570/posts/10155525554334571
229147,Mr. Andrew R. "Drew" Shelnutt,H,View on Linkedin: https://www.linkedin.com/in/andrew-shelnutt-9aa22a18,View on Twitter: https://twitter.com/ashelnut,Drew Shelnutt reacted: https://www.facebook.com/332132743905480/posts/1203267816791964
228472,Ms. Olivia Jewell Miles,H,Olivia Miles reacted: https://www.facebook.com/211969075486992/posts/1390345070982714
228523,Mrs. Lisa C "Churchill" Miele,E,View on Facebook: https://www.facebook.com/lisa.r.miele,
228661,Mr. James D Grizzle,H,View on Linkedin: https://www.linkedin.com/in/informaticaexpertjgrizzle,James Grizzle commented: https://www.facebook.com/6147204570/posts/2967262483531172
229590,Ms. Roberta Bokako,H,Roberta Bokako reacted: https://www.facebook.com/211969075486992/posts/3619661991384333
229785,Mrs. Camera Denise Burrell,H,Camera Burrell reacted: https://www.facebook.com/211969075486992/posts/1720890094594875
229899,Mr. Lukas James Cotugno,E,View on Facebook: https://www.facebook.com/lukas.cotugno,
229937,Mr. Mitchell S Lopez,H,View on Twitter: https://twitter.com/_itsmitch,Mitchell Lopez commented: https://www.facebook.com/211969075486992/posts/1390345070982714
229180,Ms. Sarah Maria Mockler,H,Sarah Mockler commented: https://www.facebook.com/211969075486992/posts/3108998149117389
22967,Mr. Richard A. Chandler,H,Richard Chandler commented: https://www.facebook.com/211969075486992/posts/944178682266024
229861,Miss. Emily Victoria Wenz,H,Emily Wenz reacted: https://www.facebook.com/86774348679/posts/10158007032058680
230709,Mr. William Franklin "Frankie" Trynoski II,H,Frankie Trynoski commented: https://www.facebook.com/97044772273/posts/10157152573897274
230208,Ms. Crystal Raquel Escobar,E,View on Facebook: https://www.facebook.com/crystal.escobar.507,View on Instagram: https://instagram.com/escobarcrys3,View on Twitter: https://twitter.com/escobarcrys3,
230784,Mr. Demetris Guzman,H,Demetris Mitch Guzman commented: https://www.facebook.com/211969075486992/posts/1508787339138486
231163,Miss Katelynn Sue Homb,H,Katelynn Homb reacted: https://www.facebook.com/6147204570/posts/10155382007409571
231180,Ms. Kimberly G Calderon,H,Kimberly Calderon reacted: https://www.facebook.com/211969075486992/posts/1368949709788917
232573,Ms. Suzanne L. Gaw,E,View on Facebook: https://www.facebook.com/suzanne.v.gaw,View on Linkedin: https://www.linkedin.com/in/suzanne-gaw-51138449,
232634,Megan M Pedraza,H,Megan Pedraza commented: https://www.facebook.com/86774348679/posts/10159146020948680
233668,Ms. Alexia Morales,H,View on Twitter: https://twitter.com/alexiamorales75,Alexia Morales reacted: https://www.facebook.com/86774348679/posts/10157738893558680
234157,Mr. Ashaad DeVonte Mabry,H,View on Linkedin: https://www.linkedin.com/in/ashaad-mabry-163615163/,Ashaad Mabry reacted: https://www.facebook.com/86774348679/posts/10157741440488680
235333,Ms. De'Keisha Quinette Johnson,H,De'Keisha Johnson commented: https://www.facebook.com/211969075486992/posts/1740073952676489
235578,Mrs. Alecia M. (Quandt) Delaney,H,Alecia Delaney reacted: https://www.facebook.com/86774348679/posts/10158016289038680
235877,Ms. Katherine Marie "Kathy" Villarreal,H,View on Twitter: https://twitter.com/kat0117,Katherine Villarreal reacted: https://www.facebook.com/211969075486992/posts/1344480232235865
2444,Mr. Jerry Allan Aelvoet,H,View on Linkedin: https://www.linkedin.com/in/jerry-aelvoet-836ab714,Jerry Aelvoet reacted: https://www.facebook.com/6147204570/posts/10154710201204571
24824,Mr. Richard "Rich" Barber,H,Rich Barber commented: https://www.facebook.com/6147204570/posts/2303783873099756
24995,Mr. Paul D. Roberts III,H,View on Linkedin: https://www.linkedin.com/in/paulwroberts,View on Twitter: https://twitter.com/eSSETS,Paul Roberts commented: https://www.facebook.com/211969075486992/posts/2183928094957737
25833,Mrs. Judy Vaughn Rosanno,H,Judy Vaughn Rosanno reacted: https://www.facebook.com/6147204570/posts/10154880118879571
25153,Mrs. Gloria I. (Vasquez) Chapa,E,View on Facebook: https://www.facebook.com/gloria.v.chapa,
26389,Ms. Samantha M. Gallegos,H,View on Twitter: https://twitter.com/saminalice,Samantha Gallegos reacted: https://www.facebook.com/211969075486992/posts/2493604380656772
26960,Mr. Alexander Hurley,H,Alexander Hurley commented: https://www.facebook.com/211969075486992/posts/970350336315525
28847,Ms. Jill Marie Randall,H,View on Linkedin: https://www.linkedin.com/in/jill-randall-a139133b,Jill Randall reacted: https://www.facebook.com/86774348679/posts/10158344272778680
28809,Mrs. Roberta L. Martinez,H,Roberta A Martinez reacted: https://www.facebook.com/86774348679/posts/10158016289038680
29232,Mr. Rod Edward Williams,H,Rod Williams reacted: https://www.facebook.com/97044772273/posts/10155458039622274
29428,Dr. Gary L. Mabry,E,View on Facebook: https://www.facebook.com/glmabry,View on Linkedin: https://www.linkedin.com/in/gary-mabry-80903710,View on Twitter: https://twitter.com/mabrygary1,
29511,Ms. Nicole M. Cleveland,E,View on Facebook: https://www.facebook.com/nicole.cleveland.351,View on Linkedin: https://www.linkedin.com/in/nicole-cleveland-600967131,
29701,Mrs. Jennifer Jo Antuna,H,Jennifer Oosterveen Antuna reacted: https://www.facebook.com/169297629793385/posts/1135804986475973
32174,Mr. Kyle Corie Alexander,H,View on Linkedin: https://www.linkedin.com/in/kyle-alexander-022b0156,View on Twitter: https://twitter.com/chris_a001,Kyle Alexander commented: https://www.facebook.com/211969075486992/posts/1884570168226866
32283,Mrs. Joyce (Pixler) Harris,E,View on Facebook: https://www.facebook.com/joyce.harris.79230,View on Twitter: https://twitter.com/JPixHarris,
32839,Mrs. Sandra Ann "Sandy" (Ruiz) Morales,H,View on Linkedin: https://www.linkedin.com/in/sandy-morales-phr-ma-60801a15,Sandy Gonzales Morales commented: https://www.facebook.com/6147204570/posts/10158968945439571
34120,Ms. Celina Terrones,H,Celina Terrones reacted: https://www.facebook.com/30277423311/posts/10159586995773312
34974,Mr. Marcus C. Springer,H,Marcus Springer commented: https://www.facebook.com/187658316064/posts/10151592538066065
34939,Mrs. Rosa (Mina) Herrera,H,View on Linkedin: https://www.linkedin.com/in/rosaherrera,View on Twitter: https://twitter.com/Herrera3Rosa,Rosa Herrera commented: https://www.facebook.com/187658316064/posts/10152702932226065
34979,Ms. Daveela C. Wilson,H,Daveela Wilson reacted: https://www.facebook.com/211969075486992/posts/2598024913548051
36017,Mr. Calvin Glenn Glover,E,View on Facebook: https://www.facebook.com/calvinglover,View on Linkedin: https://www.linkedin.com/in/calvinglover,View on Twitter: https://twitter.com/HawiianHit,
36083,Mrs. Teresa Isabel (Hinojosa) Ramos,H,Teresa Ramos reacted: https://www.facebook.com/97044772273/posts/10157376119222274
36128,Ms. Pacharee Klaisakul-Giaccardo,H,Pacharee Klaisakul-Giaccardo reacted: https://www.facebook.com/211969075486992/posts/2598024913548051
36285,Ms. Susan Catherine Cooper,H,View on Linkedin: https://www.linkedin.com/in/susanccooper,View on Twitter: https://twitter.com/susanccooper,Susan Michael Cooper reacted: https://www.facebook.com/198875430209122/posts/950654261697898
36960,Mrs. Theresia Herro (Herro) Bogar,E,View on Facebook: https://www.facebook.com/theresia.bogar,View on Linkedin: https://www.linkedin.com/in/theresia-bogar-7507a11,
3824,Dr. Bridget A. Drinka,H,Bridget Drinka reacted: https://www.facebook.com/126515304094581/posts/3656511574428252
39248,Mr. Victor Trevino,E,View on Facebook: https://www.facebook.com/vt2075,View on Linkedin: https://www.linkedin.com/in/victor-trevino-976b7456,View on Twitter: https://twitter.com/vt2075,
39264,Mrs. Graciela Lopez "Grace" (Villanueva) Coultress,H,Grace Coultress reacted: https://www.facebook.com/411603895552292/posts/3757117557667559
39338,Mr. Raul Rolando Armendariz  Jr.,H,Raul Armendariz reacted: https://www.facebook.com/211969075486992/posts/3242155472468322
40209,Ms. Corinne Torralva,H,View on Linkedin: https://www.linkedin.com/in/corinne-torralva-a60a76a5,Corinne Torralva commented: https://www.facebook.com/211969075486992/posts/2734165049934036
40231,Ms. Courtney Michelle (Cecil) Waggoner,H,Courtney Waggoner reacted: https://www.facebook.com/211969075486992/posts/2948491775168028
39604,Ms. Rose Elizabeth "Liz" Balboa,H,Liz Balboa commented: https://www.facebook.com/86774348679/posts/10158449404448680
4019,Mrs. Nancy G. (Glass) West,H,Nancy West REACTED or ENGAGE: https://www.facebook.com/126515304094581/posts/3244264128986334
40769,Mr. Raul Jose Davila,H,Raul Davila commented: https://www.facebook.com/187658316064/posts/10157123952306065
40775,Mrs. Lisa M. (Reyna) Carrion,H,Lisa Reyna reacted: https://www.facebook.com/86774348679/posts/10157639373228680
40339,Ms. Lyssa Gabrielle Garza,H,Lyssa Garza commented: https://www.facebook.com/86774348679/posts/10157203747243680
41017,Mr. Barry Denton,H,View on Linkedin: https://www.linkedin.com/in/linda-caldwell-b178a897,View on Twitter: https://twitter.com/bdenton65,Barry Denton commented: https://www.facebook.com/198875430209122/posts/329086100993254
41147,Mr. Jeffrey Wayne "Jeff" Page,H,Jeff Page commented: https://www.facebook.com/6147204570/posts/10158933900824571
41996,Mrs. Valerie Ann (Bolner) Johnson,H,Valerie Bustamante Johnson reacted: https://www.facebook.com/97044772273/posts/10157764594572274
42182,Mr. Joseph Patrick Mata,H,View on Linkedin: https://www.linkedin.com/in/joseph-mata-93379960,Joseph Mata reacted: https://www.facebook.com/6147204570/posts/10157105728059571
41542,Ms. Kimberly Gail Williams,H,Kimberly Williams commented: https://www.facebook.com/211969075486992/posts/3583082125042320
42642,Mr. Michael Joseph Amador,H,Michael Amador commented: https://www.facebook.com/6147204570/posts/217809308272264
42729,Mr. Ashley H. Taylor,H,Ashley Coston Taylor commented: https://www.facebook.com/187658316064/posts/10156719790261065
43300,Mr. James David Carrillo,H,James Carrillo commented: https://www.facebook.com/211969075486992/posts/2956739797676559
43339,Mrs. Elma C. (Cortez) Gloria,H,View on Twitter: https://twitter.com/elmabonita,Elma Gloria REACTED or ENGAGE: https://www.facebook.com/86774348679/posts/10158519134613680
44130,Mrs. Catherine Denise (Trevino) Wile,H,Catherine Elizabeth Trevino commented: https://www.facebook.com/126515304094581/posts/986621908411406
44172,Ms. Maria Sanchez "Mari" (Sanchez) Bitela,H,View on Twitter: https://twitter.com/CarmenS63448741,Mari Sanchez reacted: https://www.facebook.com/211969075486992/posts/3436538243030043
44345,Ms. Wendy Jordan,H,Wendy Jordan reacted: https://www.facebook.com/211969075486992/posts/3192949527388917
4922,Mr. Richard M. "Dick" Glancey,H,View on Linkedin: https://www.linkedin.com/in/richard-glancey,View on Twitter: https://twitter.com/DickGlancey,Richard Glancey commented: https://www.facebook.com/211969075486992/posts/986618698022022
5249,Mrs. Patti R. Cutler,H,Patti Cutler reacted: https://www.facebook.com/86774348679/posts/10158199171508680
60092,Mr. Matthew David "Matt" Proffitt,H,View on Linkedin: https://www.linkedin.com/in/mattproffitt,View on Linkedin: https://www.linkedin.com/in/mattproffitt/,View on Twitter: https://twitter.com/SARealEstatePro,Matt Proffitt reacted: https://www.facebook.com/6147204570/posts/338785787531570
60048,Mr. Bryan Anthony Baldwin,H,Bryan S Baldwin commented: https://www.facebook.com/211969075486992/posts/2442763659074178
60319,Mr. Timothy Michael Kelly,H,Timothy Craig Karm Kelly commented: https://www.facebook.com/198875430209122/posts/459850784111584
60376,Ms. Tammy T. Fisher,H,Tammy  Fisher reacted: https://www.facebook.com/86774348679/posts/10157574526798680
61194,Mr. Paul William Woeppel,E,View on Facebook: https://www.facebook.com/pwoeppel,
61696,Ms. Amelia Flores,H,Amelia Garcia Flores reacted: https://www.facebook.com/86774348679/posts/10157861374918680
62027,Ms. Anita S. Llanes,H,Anita Llanes commented: https://www.facebook.com/126515304094581/posts/165629918784542
62006,Mrs. Mary McNair,E,View on Facebook: https://www.facebook.com/mary.mcnair.92,View on Linkedin: https://www.linkedin.com/in/mary-mcnair-05591282,
65278,Mrs. Siomara Gallego Palacios,E,View on Facebook: https://www.facebook.com/siomara.palacios.9,
64933,Mrs. Sonia F. Galvan,H,View on Twitter: https://twitter.com/RichardGalvan4,Sonia Garza commented: https://www.facebook.com/211969075486992/posts/1739936592690225
68262,Mr. Eric Lee Meister,H,Eric Meister commented: https://www.facebook.com/6147204570/posts/10154523771879571
68175,Ms. Morgan R. Stagg,E,View on Facebook: https://www.facebook.com/morgan.stagg,View on Linkedin: https://www.linkedin.com/in/morgan-stagg-31987a16,View on Linkedin: https://www.linkedin.com/in/morgan-stagg-31987a16/,
68544,Mrs. Trusha Jayantilal "Tushaben" Patel,H,View on Twitter: https://twitter.com/trushahpatel,Trusha Patel commented: https://www.facebook.com/6147204570/posts/10157033290754571
68593,Mr. David M. Abundis,H,View on Twitter: https://twitter.com/davidabundis,David Abundis commented: https://www.facebook.com/86774348679/posts/10156756346233680
70816,2LT Joaquin Guerrero,E,View on Facebook: https://www.facebook.com/joaquin.guerrero1972,View on Instagram: https://instagram.com/jockguerrero,View on Linkedin: https://www.linkedin.com/in/joaquin-guerrero-75b25213,View on Twitter: https://twitter.com/jockguerrero,
70858,Ms. Monique Marie Hernandez,H,View on Twitter: https://twitter.com/mandm031712,Monique Hernandez commented: https://www.facebook.com/211969075486992/posts/1351525604864661
71105,Ms. Linda Patricia Munoz,H,Linda Resio Munoz reacted: https://www.facebook.com/261043174069349/posts/868229613350699
70424,Mrs. Ashleigh Ann (Aldridge) Gibson,E,View on Facebook: https://www.facebook.com/ashleighaldridge.gibson,
70572,Mr. Victor Adolfo Casillas,H,Victor Casillas commented: https://www.facebook.com/211969075486992/posts/3120237564660114
71800,Mrs. Marivel M. "Mari" Tamez,H,Mari Tamez commented: https://www.facebook.com/332132743905480/posts/1160393291079417
71491,Mrs. Nicole Francene (Young) Carmines,H,View on Linkedin: https://www.linkedin.com/in/nicole-young-48b74410,View on Twitter: https://twitter.com/CarminesNicole,Nicole Carmines reacted: https://www.facebook.com/126515304094581/posts/3244264128986334
73491,Ms. Rebecca Ellen Parker,H,Rebecca Parker reacted: https://www.facebook.com/211969075486992/posts/3708306765853188
72747,Ms. Rosa M. Carrillo,H,Rosa Carrillo reacted: https://www.facebook.com/187658316064/posts/10154203821621065
73270,Ms. Denise Cordero,H,Denise Cordero reacted: https://www.facebook.com/86774348679/posts/10159476372178680
73289,Ms. Liza Ann Delgado,H,Liza Grace Delgado reacted: https://www.facebook.com/211969075486992/posts/3478384185512115
73598,Mrs. Charisma Maricel (Condello) Villarreal,H,View on Linkedin: https://www.linkedin.com/in/charisma-villarreal-23862231,Charisma C. Villarreal reacted: https://www.facebook.com/211969075486992/posts/1649148185102400
74134,Ms. Sara Christina Gonzales,H,View on Linkedin: https://www.linkedin.com/in/susie-gonzales-5a579a14b,Sara Gonzales reacted: https://www.facebook.com/211969075486992/posts/3820071994676664
75812,Mrs. Jeannette Kelley,H,Jeannette Gregg Kelley reacted: https://www.facebook.com/169297629793385/posts/2019319771457819
76110,Mr. John N. Neely,H,View on Twitter: https://twitter.com/jneely12,John W. Neely commented: https://www.facebook.com/30277423311/posts/10154637430023312
78509,Ms. Pamela Dolores Culbertson,E,View on Facebook: https://www.facebook.com/pamela.culbertson.18,View on Linkedin: https://www.linkedin.com/in/dona-minor-a3b29913,
79137,Ms. Sandra Joe Joyce,H,Sandra Valero Joyce commented: https://www.facebook.com/6147204570/posts/10154880118879571
79811,Mrs. Leslie N. (Garcia) Martin,E,View on Facebook: https://www.facebook.com/leslie.g.martin.18,
80122,Mrs. Kristi Kay (Renfrow) Schonefeld,H,View on Linkedin: https://www.linkedin.com/in/kristi-schonefeld-766babab,Kristi Schonefeld reacted: https://www.facebook.com/86774348679/posts/10159345035463680
80186,Ms. Esperanza F. Lopez,H,Esperanza Lopez reacted: https://www.facebook.com/97044772273/posts/10156965696582274
80688,Mrs. Karen Marie (Fisher) Moritz,H,Karen Fisher Moritz commented: https://www.facebook.com/86774348679/posts/10158684721553680
8347,Mrs. Cynthia Marie (Miller) Graham,H,Cynthia Graham commented: https://www.facebook.com/126515304094581/posts/300276571726079
8208,Mrs. Elda Rebecca (Garcia) Pinsonneault,E,View on Facebook: https://www.facebook.com/erpinsonneault,
85216,Ms. Angela O. Pichardo,H,Angela Ortiz Pichardo reacted: https://www.facebook.com/86774348679/posts/10158344272778680
86127,Ms. Carmen Vasquez,H,Carmen Vasquez commented: https://www.facebook.com/126515304094581/posts/755448648443397
86239,Dr. Michael Uriel "Mike" Villarreal,H,View on Linkedin: https://www.linkedin.com/in/michaelvillarreal,View on Twitter: https://twitter.com/siliconvilly,Mike Villarreal invited: https://www.facebook.com/211969075486992/posts/1048167701867121
87201,Mr. Aaron C. Hufty,E,View on Facebook: https://www.facebook.com/aaron.hufty,View on Instagram: https://instagram.com/chapelsingers,View on Linkedin: https://www.linkedin.com/in/aaron-hufty-18b84335,View on Twitter: https://twitter.com/ChapelSingers,
87088,Mrs. Patricia Ann "Pat" (Ramirez) Marcus,H,View on Twitter: https://twitter.com/PatriciaMarcus,Pat Ramirez commented: https://www.facebook.com/126515304094581/posts/477877636890212
88113,Ms. Lanell M "Lanelle" (Romo) Garcia,H,Lanell Romo Garcia commented: https://www.facebook.com/198875430209122/posts/329086100993254
88132,Mr. Alan S. "Al" Clark,H,Alan Clark Jr. commented: https://www.facebook.com/211969075486992/posts/1344503725566849
87825,Mrs. Vanessa Montalvo (Johnson) Diaz,H,Vanessa Diaz commented: https://www.facebook.com/6147204570/posts/10156857019174571
87838,Ms. Jennifer Rea (Langston) Brackett,H,View on Twitter: https://twitter.com/jbnb1818,Jennifer Brackett reacted: https://www.facebook.com/86774348679/posts/10157723518723680
88469,Mr. Sean Matthew Moore McDonald,H,View on Linkedin: https://www.linkedin.com/in/sean-mcdonald-57480813,Sean McDonald commented: https://www.facebook.com/6147204570/posts/10156963794684571
89498,Mr. Alejandro Medina  Jr.,H,Alejandro Medina reacted: https://www.facebook.com/126515304094581/posts/3523961581016586
9117,The Honorable Sarah E. (Rose) Garrahan,H,Sarah Rose commented: https://www.facebook.com/126515304094581/posts/778592066349523
90667,Mr. Scott W. Taylor,H,Scott W Taylor reacted: https://www.facebook.com/211969075486992/posts/2808107815873092
92011,Mrs. Angela Michelle "Angie" (Burns) Johnson,H,Angie Garcia Johnson reacted: https://www.facebook.com/6147204570/posts/10159391366199571
9136,Ms. Janet Adine Keeling,E,View on Facebook: https://www.facebook.com/janet.a.keeling,
91734,Mrs. Andra N. (Lecce) Schreiner,E,View on Facebook: https://www.facebook.com/andraschreiner,View on Linkedin: https://www.linkedin.com/in/andraschreiner,View on Twitter: https://twitter.com/andraschreiner,
92521,Ms. Daniele G. Gonzales,H,Daniele Gonzales commented: https://www.facebook.com/97044772273/posts/10156323559292274
92382,Mr. Rodolfo "Rudy" Cantu  Jr.,H,View on Twitter: https://twitter.com/rudy302_rudy,Rodolfo Cantu commented: https://www.facebook.com/30277423311/posts/10151891562403312
9336,Mr. Ezequiel Perez "Zeke" Ramirez,H,Ezequiel Ramirez commented: https://www.facebook.com/211969075486992/posts/3393143930702808
93228,Mrs. Daniela S. (Terrazas) Sanchez,H,Daniela Sanchez reacted: https://www.facebook.com/211969075486992/posts/1739959496021268
94090,Mrs. Nancy Tate,H,Nancy B. Tate commented: https://www.facebook.com/6147204570/posts/2525971661035184
95473,Mr. Michael Burgess,E,View on Facebook: https://www.facebook.com/burgess.michaelp,View on Linkedin: https://www.linkedin.com/in/dr-michael-burgess-59916b2a,
95941,Mrs. Laura Michelle (Johnson) Redfield,H,Laura Redfield commented: https://www.facebook.com/6147204570/posts/10155753488449571
95177,Ms. Laura Juarez,H,Laura Juarez reacted: https://www.facebook.com/211969075486992/posts/1344503725566849
96270,Ms. Karen Lynnette Bippert,H,View on Linkedin: https://www.linkedin.com/in/karenbippert,View on Twitter: https://twitter.com/BuckhornMuseum,Karen Bippert reacted: https://www.facebook.com/86774348679/posts/10157759043113680
96268,Ms. Tonya Marie Carpenter,H,View on Linkedin: https://www.linkedin.com/in/tonya-carpenter-1460634,View on Twitter: https://twitter.com/TonyaProgress,Tonya Carpenter commented: https://www.facebook.com/211969075486992/posts/2598024913548051
97074,Ms. Deborah Ann (Longoria) Benavides,H,View on Twitter: https://twitter.com/Ravenfiance,Deborah Benavides reacted: https://www.facebook.com/198875430209122/posts/1773948582701791
97728,Mrs. Molly Jane (Groesbeck) Solis,H,Molly Groesbeck Solis reacted: https://www.facebook.com/6147204570/posts/10155790429214571
97354,Mrs. Marybeth S.F. Tomka,H,Marybeth Tomka reacted: https://www.facebook.com/50698324373/posts/10158344954904374
9982,Ms. Donna Sue Cameron,H,View on Twitter: https://twitter.com/dcameron61,Donna Sue Cameron reacted: https://www.facebook.com/211969075486992/posts/1905054146178468
99841,Mrs. Peggy H. (Hernandez) Inglis,H,Peggy Garcia Hernandez reacted: https://www.facebook.com/86774348679/posts/10157949262503680
98282,Dr. David R. Pillow,H,View on Linkedin: https://www.linkedin.com/in/david-pillow-136499188,David Pillow reacted: https://www.facebook.com/261043174069349/posts/945056022334724
236244,Mr. Quintin E. Cain,H,Quintin Cain commented: https://www.facebook.com/211969075486992/posts/1587624291254790
236425,Ms. Carolina Monee Ramirez,H,Carolina Ramirez reacted: https://www.facebook.com/86774348679/posts/10157702302528680
236732,Ms. Sarah Elizabeth Kelton,H,Sarah Kelton commented: https://www.facebook.com/30277423311/posts/10152530939043312
237075,Ms. Courtney Grace Cadran,H,Courtney Cadran reacted: https://www.facebook.com/30277423311/posts/10157101798978312
237119,Ms. Tatiana Sergeevna Rodriguez,H,Tatiana Rodriguez reacted: https://www.facebook.com/211969075486992/posts/2639684399382102
237223,Mrs. Veronica Michelle DeHoyos,H,Veronica DeHoyos interested: https://www.facebook.com/105308188973/posts/10155438846388974
237418,Mr. Christopher W. Osborn,H,Christopher Osborn commented: https://www.facebook.com/211969075486992/posts/1745482692135615
238076,Ms. Rocio Alvarado,H,Rocio Alvarado reacted: https://www.facebook.com/126515304094581/posts/811747412725384
238315,Ms. Kayla M. Carlton,H,Kayla Carlton reacted: https://www.facebook.com/211969075486992/posts/2198542760162937
238597,Mr. Ennis Brandon Sterling,H,Ennis Sterling commented: https://www.facebook.com/211969075486992/posts/1649374595079759
239439,Mr. Craig Anthony Krapcha,H,Craig Krapcha commented: https://www.facebook.com/198875430209122/posts/329086100993254
240046,Ms. Camille Audriana Richards,H,Camille Richards reacted: https://www.facebook.com/97044772273/posts/10155799640622274
