220985,Mr. Antonio Ulises Delatorre,E,View on Facebook: https://www.facebook.com/antonio.delatorre.31542,View on Linkedin: https://www.linkedin.com/in/antonio-de-la-torre-89a25318,View on Twitter: https://twitter.com/fromdatower,
221044,Mr. Rushikesh Pradeep Jagdale,H,Rushikesh Jagdale liked: https://www.facebook.com/211969075486992/posts/3383822188301649
221307,Ms. Mia Simone Torres,H,Mia Simone Torres liked: https://www.facebook.com/6147204570/posts/10154721988174571
221150,Ms. Gretchen Evelyn Herrera,H,Gretchen Herrera liked: https://www.facebook.com/211969075486992/posts/1712978928719325
221200,Mr. Varun Venkata Naga Kavalipurapu,H,Varun Kavalipurapu liked: https://www.facebook.com/211969075486992/posts/1739296352754249
221566,Mr. Matthew Olivares,H,Matthew Olivares liked: https://www.facebook.com/211969075486992/posts/3171774162839787
221873,Mrs. Bernadette Pruyn,H,Bernadette Pruyn liked: https://www.facebook.com/211969075486992/posts/3244489478901588
222070,Mrs. Cheryl Reinke,H,Cheryl Reinke liked: https://www.facebook.com/211969075486992/posts/2398284090188802
222405,Ms. Stephanie Gutierrez,H,Stephanie Gutierrez liked: https://www.facebook.com/211969075486992/posts/3897234713627058
222465,Ms. Emily Beth Gamez,H,View on Linkedin: https://www.linkedin.com/in/emily-gamez-596a46140/,Emily Gamez liked: https://www.facebook.com/6147204570/posts/10158882310109571
222690,Ms. Delia Tobias,E,View on Facebook: https://www.facebook.com/dvtobia14,
222764,Ms. Sandra Gaitan,H,View on Linkedin: https://www.linkedin.com/in/sandra-gaitan-9aabb638,Sandra Gaitan liked: https://www.facebook.com/86774348679/posts/10156501931573680
222807,Ms. Melissa Mitchell,E,View on Facebook: https://www.facebook.com/melissa.h.mitchell.7,View on Linkedin: https://www.linkedin.com/in/melissa-mitchell-3704147,
223047,Mrs. Belinda Villalpando,E,View on Facebook: https://www.facebook.com/belinda.p.villalpando,View on Linkedin: https://www.linkedin.com/in/belinda-villalpando-41795277,
223312,Ms. Franzcesca Ann Guidry-Jackson,E,View on Facebook: https://www.facebook.com/franzcesca.guidryjackson,
223347,Mr. Jason Danny Granados,H,Jason Granados liked: https://www.facebook.com/211969075486992/posts/2940690322614840
222916,Mrs. Leah McNamara,E,View on Facebook: https://www.facebook.com/leah.mcnamara,: https://twitter.com/Leahzacmac,
223083,Miss Alicia Angelica-Rochelle Veliz,H,Alicia Veliz liked: https://www.facebook.com/97044772273/posts/10157457739047274
223420,Mr. Caleb Daniel Hopkins,E,View on Facebook: https://www.facebook.com/caleb.hopkins.372,View on Linkedin: https://www.linkedin.com/in/hopkinscaleb,View on Linkedin: https://www.linkedin.com/in/ACwAAA8ZphYBPtL6MrtIHTRxMpZmSbbYLCrIDoo/,View on Twitter: https://twitter.com/Caleb_Hopkins,
223452,Ms. Lauren Aliese (Martinez) Moody,H,Lauren Moody commented: https://www.facebook.com/86774348679/posts/10158427413003680
223992,Mr. Steven A Colodny,H,View on Instagram: https://instagram.com/stevencolodny,View on Twitter: https://twitter.com/stevencolodny,Steven Colodny liked: https://www.facebook.com/211969075486992/posts/3451251678225366
223764,Mr. Ryan Patrick Stephenson,H,Ryan Stephenson liked: https://www.facebook.com/6147204570/posts/10152278637369571
224373,Ms. Sara E. Ritchie,E,View on Facebook: https://www.facebook.com/sari.ritchie,View on Instagram: https://instagram.com/saraelisaa__,View on Linkedin: https://www.linkedin.com/in/sara-ritchie-5432b071,View on Twitter: https://twitter.com/saRaLeeNess,
225005,Ms. Rebecca Samantha Conejo,H,View on Linkedin: https://www.linkedin.com/in/rebeccaconejo,Rebecca Conejo liked: https://www.facebook.com/86774348679/posts/10159165573508680
225014,Ms. Mercedes Danielle Dawes,H,Mercedes Dawes liked: https://www.facebook.com/211969075486992/posts/1403629629654258
225256,Mr. Damien D. Guerrero,H,Damien Guerrero liked: https://www.facebook.com/30277423311/posts/10160517229973312
225447,Miss Tosha Lynn Mathieu,H,Tosha Lynn Mathieu reacted: https://www.facebook.com/211969075486992/posts/1734417513242133
224535,Mrs. Tahirah S. Anderson,E,View on Facebook: https://www.facebook.com/tahirah.anderson,
225003,Mr. Adrian D. Pulido,H,View on Linkedin: https://www.linkedin.com/in/adrianpulido,View on Twitter: https://twitter.com/Adrian_DeMarco,Adrian DeMarco Pulido liked: https://www.facebook.com/97044772273/posts/10156023058817274
225321,Mr. Rae Saldana,H,View on Linkedin: https://www.linkedin.com/in/rae-saldana-34996721,View on Twitter: https://twitter.com/c_saldana21,Rae Cervantes Saldana liked: https://www.facebook.com/97044772273/posts/10155919513452274
225841,Ms. Veronica Maldonado,H,Veronica Maldonado reacted: https://www.facebook.com/211969075486992/posts/1722449257772292
226260,Mr. Kristopher Gaines,E,View on Facebook: https://www.facebook.com/kristopher.gaines,View on Instagram: https://instagram.com/kris_gaines,View on Twitter: https://twitter.com/Kris_Gaines,
225636,Mrs. Brittany Filo,H,Brittany Filo reacted: https://www.facebook.com/6147204570/posts/340582737023433
226306,Ms. Cheyenne Cooper,H,Cheyenne Cooper liked: https://www.facebook.com/211969075486992/posts/1584727298211156
226370,Mr. Ricardo Abugarade,H,Ricardo Abugarade liked: https://www.facebook.com/6147204570/posts/10158968945439571
226594,Ms. Veronica Bardales,H,Veronica Bardales liked: https://www.facebook.com/6147204570/posts/10155724670059571
226633,Ms. Vanessa Zermeno,E,View on Facebook: https://www.facebook.com/vanessa.zermeno,View on Instagram: https://instagram.com/nesslyzee4,View on Twitter: https://twitter.com/nesslyzee4,
227157,Ms. Jenny Obregon,H,Jenny Obregon reacted: https://www.facebook.com/86774348679/posts/10159210430763680
226397,Ms. Layla Lustri,H,Layla Lustri interested: https://www.facebook.com/97044772273/posts/10153891853272274
226634,Ms. Kendra Rodriguez,H,View on Twitter: https://twitter.com/KendraKM12,Kendra Rodriguez liked: https://www.facebook.com/211969075486992/posts/1508787339138486
226850,Mr. Saulo Arredondo,H,View on Twitter: https://twitter.com/SauloArredondo,Saulo E. Arredondo reacted: https://www.facebook.com/30277423311/posts/10160409310918312
226996,Ms. Priscilla Rivera,H,View on Instagram: https://instagram.com/_prissrivera,View on Twitter: https://twitter.com/_prissrivera,Priscilla Rivera liked: https://www.facebook.com/211969075486992/posts/3192590954091441
227647,Ms. Vanessa Lee Ozuna,H,Vanessa Ozuna liked: https://www.facebook.com/211969075486992/posts/1880360185314531
227805,Mr. Ethan Alder,H,Ethan Alder liked: https://www.facebook.com/198875430209122/posts/1541461189283866
227891,Mr. Orlando Lopez,H,Orlando Lopez liked: https://www.facebook.com/97044772273/posts/10154641353072274
227713,Ms. Andrea Maldonado,H,Andrea Maldonado liked: https://www.facebook.com/187658316064/posts/10155359345216065
228487,Ms. Marina Giselle Garza,H,View on Twitter: https://twitter.com/mari_shiznitz,Marina Garza liked: https://www.facebook.com/211969075486992/posts/1391056530911568
228542,Mrs. Alina (Lozano) Mallen,H,View on Twitter: https://twitter.com/AlinaL37,Alina Lozano liked: https://www.facebook.com/211969075486992/posts/2564640786886464
228910,Mr. Brent Fountain,H,View on Linkedin: https://www.linkedin.com/in/brent-fountain-b775b224,View on Twitter: https://twitter.com/brentfountain,Brent Fountain liked: https://www.facebook.com/198875430209122/posts/1495771013852884
228809,Mr. Craig Anthony Lambaria,H,View on Linkedin: https://www.linkedin.com/in/craig-lambaria-b94bb544,View on Twitter: https://twitter.com/cnj210,Craig Corky Lambaria liked: https://www.facebook.com/86774348679/posts/10159035061043680
229221,Mrs. Judy Walters,H,Judy Walters liked: https://www.facebook.com/6147204570/posts/10158933187329571
229158,Ms. Jamie Lee,H,Jamie Lee liked: https://www.facebook.com/211969075486992/posts/3451251678225366
22942,Mr. Jaime Chapa,H,Jaime Chapa liked: https://www.facebook.com/6147204570/posts/10159222269609571
229849,Ms. Chelsea Lynn Ayala,H,View on Twitter: https://twitter.com/ChillChelss,Chelsea Ayala liked: https://www.facebook.com/86774348679/posts/10157432248918680
230514,Mr. Jesse James Silva,H,Jesse Silva liked: https://www.facebook.com/198875430209122/posts/1773948582701791
230609,Ms. Kimberlyne Sanchez-Martinez,H,Kimberlyne Sanchez-Martinez liked: https://www.facebook.com/211969075486992/posts/3045763062107565
230289,Ms. Emily Chi Tran,H,Emily Tran reacted: https://www.facebook.com/211969075486992/posts/3591365957547270
230672,Ms. Jessica Michelle Lee,H,Jessica Lee liked: https://www.facebook.com/211969075486992/posts/3027140600636478
231392,Ms. Allison Marie Brewton,H,Allison Brewton reacted: https://www.facebook.com/86774348679/posts/10158771305658680
231190,Mr. Evan Matthew Veregge,H,Evan Veregge liked: https://www.facebook.com/211969075486992/posts/1439875426029678
231677,Mr. Paul Nam Phong Nguyen,H,Paul Phong Nguyen liked: https://www.facebook.com/86774348679/posts/10157738893558680
232615,Ms. Marla D Gutierrez,H,Marla Delissa Gutierrez reacted: https://www.facebook.com/126515304094581/posts/4051381421607930
232118,Ms. Briana N. Ramos,H,Briana Ramos reacted: https://www.facebook.com/126515304094581/posts/3154874701258611
232199,Mr. Mike Elizondo,H,View on Linkedin: https://www.linkedin.com/in/mike-elizondo-57380b68,Mike Elizondo liked: https://www.facebook.com/6147204570/posts/10159188234764571
232385,Mr. Patrick Paul Araiza,H,Patrick Araiza liked: https://www.facebook.com/211969075486992/posts/1979776418706240
233121,Ms. Nicole Aguilar,H,Nicole Aguilar liked: https://www.facebook.com/30277423311/posts/10155832593303312
23491,Mrs. Lisette Arnette Murray,H,View on Linkedin: https://www.linkedin.com/in/lisette-murray-6a6422105,Lisette Murray liked: https://www.facebook.com/86774348679/posts/10153053185413680
235409,Ms. Alejandra Segura,H,Alejandra Segura liked: https://www.facebook.com/211969075486992/posts/1214593591891197
23487,Mrs. Kimberly Ann (Fryar) Piechowiak,H,View on Twitter: https://twitter.com/kjp71956,Kimberly Fryar Piechowiak reacted: https://www.facebook.com/6147204570/posts/10155988349549571
234995,Ms. Kirby Nichole Hansen,H,View on Twitter: https://twitter.com/The_Kirbster_,Kirby Hansen liked: https://www.facebook.com/211969075486992/posts/3655638377786694
235005,Mrs. Gabrielle Angelique Delgado,H,View on Linkedin: https://www.linkedin.com/in/gabrielle-delgado-mba-437717142,View on Linkedin: https://www.linkedin.com/in/gabrielle-delgado-mba-437717142/,View on Twitter: https://twitter.com/GabbyDelGhetto,Gabrielle Angelique Delgado liked: https://www.facebook.com/211969075486992/posts/3218512668165936
235092,Ms. Ashley M. Castro,H,View on Instagram: https://instagram.com/ovoashleemariee,: https://twitter.com/AshleyCashtro,Ashley Castro liked: https://www.facebook.com/6147204570/posts/10157038241579571
235314,Ms. Genesis Monik Garcia,H,Genesis Monik Garcia commented: https://www.facebook.com/211969075486992/posts/1769382189745665
235362,Mr. Noe Santiago Ruiz-Fernandez,H,Noe S. Ruiz commented: https://www.facebook.com/126515304094581/posts/2708494275896658
235378,Mr. Christian Montana Perez,H,Christian Montana Perez commented: https://www.facebook.com/6147204570/posts/10158683816319571
235854,Ms. Diana Maria Mathew,H,Diana Mathew liked: https://www.facebook.com/86774348679/posts/10157848079723680
235857,Ms. Kaitlin RoseMarie McNeill,H,Kaitlin McNeill liked: https://www.facebook.com/198875430209122/posts/1863368577093124
235869,Ms. Anna Maresa Leon,H,Leon Anna liked: https://www.facebook.com/211969075486992/posts/1855231774494039
24079,Mr. Terry R. Harrelson,H,Terry Harrelson liked: https://www.facebook.com/6147204570/posts/10158887576189571
24833,Ms. Linda S. (Stellman) Monson,H,Linda Stellmar Monson liked: https://www.facebook.com/211969075486992/posts/2598024913548051
25211,Ms. Patricia Ann Zambrano,E,View on Facebook: https://www.facebook.com/patricia.zambrano.58,
26870,Mrs. Nelda C. (Carter) Meixner,H,Nelda Carter Meixner liked: https://www.facebook.com/86774348679/posts/10157494273598680
26115,Mrs. Belinda Kay Whitworth,H,Belinda Whitworth liked: https://www.facebook.com/86774348679/posts/10158344272778680
28780,Mrs. Andrea R. Isley,H,View on Twitter: https://twitter.com/BlueWaterFront,Andrea Isley liked: https://www.facebook.com/211969075486992/posts/2189798461037367
28817,Dr. Michelle Lee Evans,H,View on Linkedin: https://www.linkedin.com/in/michelle-evans-b0922999,Michelle Evans liked: https://www.facebook.com/6147204570/posts/10152676238779688
28982,Mr. Russell Ward Ivy,E,View on Facebook: https://www.facebook.com/russell.ivy.98,
2996,Mr. Douglas Rollins "Doug" Johnson,H,View on Twitter: https://twitter.com/djlawcpa,Douglas L Johnson liked: https://www.facebook.com/198875430209122/posts/840184029411589
30738,Mr. Alan Wyatt Eisenhour,H,Alan Eisenhour liked: https://www.facebook.com/211969075486992/posts/1939431742740708
30888,Mr. James C. Morrison,H,James Morrison commented: https://www.facebook.com/6147204570/posts/10155822939574571
32570,Mr. Guillermo Arnulfo Villarreal,H,Guillermo Villarreal liked: https://www.facebook.com/6147204570/posts/10154595073374571
32821,Mr. Michael Owen Lovell,H,Michael Lovell liked: https://www.facebook.com/6147204570/posts/10157052243224571
33718,Ms. Sarah A. Unland,E,View on Facebook: https://www.facebook.com/sarah.unland.31,
34395,Ms. Jerlyn Marie Lantz,H,View on Twitter: https://twitter.com/JerlynLantz,Jerlyn Lantz liked: https://www.facebook.com/261043174069349/posts/919524928221167
34466,Mrs. Donna Eileen (Legandre) Legendre-Hofmann,H,Donna Legendre-Hofmann liked: https://www.facebook.com/86774348679/posts/10158081216873680
34657,Mrs. Theresa Lynn Heineman,H,View on Linkedin: https://www.linkedin.com/in/theresa-heineman-19752a23,View on Twitter: https://twitter.com/heinemanT,Theresa Heineman liked: https://www.facebook.com/6147204570/posts/10156143887674571
35335,Mr. Robert Louis Vega,H,Robert Vega liked: https://www.facebook.com/198875430209122/posts/1798219326941383
36162,Mrs. Nancy Isabel (Tuttle) Meza,E,View on Facebook: https://www.facebook.com/nancy.t.meza,View on Linkedin: https://www.linkedin.com/in/nancy-meza-16baa313,View on Twitter: https://twitter.com/newfencedotcom,
37137,Ms. Cynthia S. Vasquez,E,View on Facebook: https://www.facebook.com/cynthia.vasquez.58173,: https://twitter.com/cinvasquez49,
38773,Mr. Carl Ray Groff,H,Carl Groff liked: https://www.facebook.com/198875430209122/posts/1865042566925725
38688,Mr. Jae Sun Chin,H,Jae Chin liked: https://www.facebook.com/211969075486992/posts/1208904622460094
39810,Mr. Jesse Ayala,H,Jesse Ayala liked: https://www.facebook.com/6147204570/posts/10156730677619571
40138,Mr. Bryan E. Patterson,H,Bryan Patterson liked: https://www.facebook.com/211969075486992/posts/3270276976322838
40214,Mr. Brian Thomas Troesch,H,View on Linkedin: https://www.linkedin.com/in/briantroesch,Brian Thomas Troesch liked: https://www.facebook.com/6147204570/posts/10156087753619571
40561,Mr. Rafael Vidaurri III,H,Rafael Vidaurri III liked: https://www.facebook.com/86774348679/posts/10158693418548680
41088,Mrs. Karen Sue (Graf) Chambers,E,View on Facebook: https://www.facebook.com/karensuewitty,
41198,Ms. Holly Deanne Shull,H,View on Linkedin: https://www.linkedin.com/in/holly-shull-41471b99,Holly Shull liked: https://www.facebook.com/211969075486992/posts/3107797479237456
40564,Mrs. Becky Marie Walker,E,View on Facebook: https://www.facebook.com/becky.walker.1466,
41579,Ms. Connie Chia,E,View on Facebook: https://www.facebook.com/connie.chia1,View on Linkedin: https://www.linkedin.com/in/connie-chia-4b1bb23,View on Twitter: https://twitter.com/co_nnie1,
41476,Mrs. Karen L. (Allbright) Stevens,E,View on Facebook: https://www.facebook.com/karen.stevens.52643821,View on Linkedin: https://www.linkedin.com/in/karen-stevens-118673a9,
41548,Mr. Tarek Aref Zebian,H,View on Linkedin: https://www.linkedin.com/in/tarek-zebian-78853a1a,Tarek Zebian liked: https://www.facebook.com/211969075486992/posts/3554004924616707
41828,Mrs. Suzanne M. Miller,H,Suzanne Miller liked: https://www.facebook.com/211969075486992/posts/1653525711331314
42240,Mr. Joseph Arguello,H,Joseph Arguello liked: https://www.facebook.com/6147204570/posts/10158903625714571
42707,Mrs. Sandra Gayle (Jiral) Burg,E,View on Facebook: https://www.facebook.com/sandra.j.burg,
43150,Ms. Elia Villazana,H,Elia Villazana reacted: https://www.facebook.com/86774348679/posts/10154561792563680
42946,Ms. Kathy Davis,H,View on Linkedin: https://www.linkedin.com/in/kathleen-davis-5055ab47,View on Twitter: https://twitter.com/Kathyd1313,Kathy Davis liked: https://www.facebook.com/211969075486992/posts/1508787339138486
43254,Mr. Andrew Ramirez Borrego,H,View on Linkedin: https://www.linkedin.com/in/andrewborrego,View on Twitter: https://twitter.com/AndrewBorrego,Andrew Borrego liked: https://www.facebook.com/211969075486992/posts/3393143930702808
43496,Ms. Mary A. Haranda,H,Mary Haranda liked: https://www.facebook.com/211969075486992/posts/2678032832213925
43919,Mr. Fernando C. Rodriguez  Jr.,H,View on Twitter: https://twitter.com/spur21212,Fernando Rodriguez liked: https://www.facebook.com/6147204570/posts/10159022645599571
559,Mrs. Janice K. Kramer,H,Janice Keller Kramer liked: https://www.facebook.com/86774348679/posts/10159476372178680
60945,Mr. Armando M Vega,H,Armando Vega liked: https://www.facebook.com/211969075486992/posts/1734417513242133
61110,Ms. Elena Romero Garcia,H,Elena Garcia liked: https://www.facebook.com/6147204570/posts/10156915342239571
61210,Ms. Rodney Roussett,H,Rodney Roussett liked: https://www.facebook.com/211969075486992/posts/3474986559185211
61040,Dr. George Anthony Valdez,H,View on Twitter: https://twitter.com/HK_Phooey_Bot,George Valdez liked: https://www.facebook.com/6147204570/posts/10159259188449571
61319,Mr. Mark E. Mulroy,E,View on Facebook: https://www.facebook.com/mark.mulroy.7,
61364,Mrs. Laura Ester (Cardenas) Schwarz,H,Laura Crdenas Schwarz liked: https://www.facebook.com/211969075486992/posts/3627892403894625
61421,Mr. Daniel Juarez,H,Daniel Juarez liked: https://www.facebook.com/198875430209122/posts/1495771013852884
64848,Mrs. Natalie A. Powell,H,View on Linkedin: https://www.linkedin.com/in/natalie-powell-phr-63142822,View on Twitter: https://twitter.com/Call_Me_Nat,Natalie Powell liked: https://www.facebook.com/211969075486992/posts/1342963095720912
64877,Mrs. Donna M. Jackson-Elstak,H,Donna Jackson-Elstak reacted: https://www.facebook.com/211969075486992/posts/2704772119539996
65317,Mr. Bryan Lee Wylie,H,Bryan Wylie liked: https://www.facebook.com/86774348679/posts/10159081580778680
65631,Mr. Hernan Alejandro Jaramillo P.E.,H,Hernan Alejandro Jaramillo liked: https://www.facebook.com/30277423311/posts/10160409310918312
70544,Mrs. Carrie R. Caldwell,H,Carrie Caldwell liked: https://www.facebook.com/198875430209122/posts/1112037342226255
70609,Mrs. Ann (Compton) Bazany,H,Ann Compton Bazany liked: https://www.facebook.com/211969075486992/posts/1559241294093090
70781,Mr. Moses R. Gomez,H,Moses Gomez liked: https://www.facebook.com/6147204570/posts/10156828564429571
72319,Mrs. Shirley H. Rodriguez,H,View on Linkedin: https://www.linkedin.com/in/shirley-rodriguez-ab06a924,Shirley Rodriguez liked: https://www.facebook.com/169297629793385/posts/2437525566303902
74123,Mr. John William Gilchrist,H,John Gilchrist liked: https://www.facebook.com/211969075486992/posts/1559021770781709
73834,Mr. Joe Benavidez,H,View on Linkedin: https://www.linkedin.com/in/joe-benavidez-834b02,Joe Benavidez liked: https://www.facebook.com/6147204570/posts/10156087753619571
74809,Mr. Anthony E. "Tony" Tellez,H,Anthony Tellez liked: https://www.facebook.com/211969075486992/posts/3667635229920342
75363,Ms. Louisa Alaniz,E,View on Facebook: https://www.facebook.com/louisa.alaniz.5,View on Twitter: https://twitter.com/LouAla1,
75555,Mrs. Elena Mercado,H,View on Linkedin: https://www.linkedin.com/in/elena-mercado-48a45933,Elena Silva Mercado liked: https://www.facebook.com/6147204570/posts/10158968945439571
74898,Mr. Gary Aeron Wilton,E,View on Facebook: https://www.facebook.com/gary.wilton.14,View on Twitter: https://twitter.com/GWiltonZ,
78648,Capt. Tony Carroll Williams,H,View on Linkedin: https://www.linkedin.com/in/tonycarrollwilliams,View on Twitter: https://twitter.com/wizdaddy,Tony Williams liked: https://www.facebook.com/6147204570/posts/10155790429214571
78822,Mr. Marc Anthony Mendoza,H,View on Twitter: https://twitter.com/dozarocks,Marc Anthony Mendoza liked: https://www.facebook.com/211969075486992/posts/3152257848124752
78843,Ms. Jennifer Marie Valentin,H,View on Twitter: https://twitter.com/Jennife97962056,Jennifer Valentin liked: https://www.facebook.com/6147204570/posts/10156057255734571
85063,Ms. Lisa Marie Moreno,H,Lisa Moreno liked: https://www.facebook.com/97044772273/posts/10154833642657274
8464,Mrs. Brenda P. Pachecano,H,Brenda Pachecano liked: https://www.facebook.com/97044772273/posts/10156731599747274
86737,Mr. Roberto "Robert" Nuno,H,View on Twitter: https://twitter.com/elnuno1976,Robert Nuno liked: https://www.facebook.com/86774348679/posts/10158675867638680
86678,Ms. Amanda A. Howard,H,Amanda Howard liked: https://www.facebook.com/97044772273/posts/10156040661232274
8750,Mr. Gene Rodriguez  Jr.,H,Eugene Rodriguez liked: https://www.facebook.com/6147204570/posts/10153648577749571
87857,Ms. Stephanie Renee Schoenborn,H,View on Linkedin: https://www.linkedin.com/in/stephanie-schoenborn-a321689,Stephanie Schoenborn liked: https://www.facebook.com/6147204570/posts/10159261821319571
87644,Mrs. Patricia Ann Garza-Gamez,E,View on Facebook: https://www.facebook.com/patricia.garzagamez,
88471,Mrs. Ryan Whitney (McKee) Kirch,H,View on Twitter: https://twitter.com/rwksigma,Ryan McKee Kirch commented: https://www.facebook.com/86774348679/posts/10158445701348680
88538,Mr. Lasiter Skidmore,H,View on Linkedin: https://www.linkedin.com/in/lasiters,Lasiter Skidmore commented: https://www.facebook.com/211969075486992/posts/3554004924616707
89564,Mr. Arturo "Art" Almeida,E,View on Facebook: https://www.facebook.com/arturo.i.almeida,View on Linkedin: https://www.linkedin.com/in/arturo-almeida-4772897,
90022,Mrs. Melody Ann (Evins) Wendel,H,Melody Ann Wendel liked: https://www.facebook.com/86774348679/posts/10156742646608680
90041,Mr. Shannon D. "Shan" Story,H,Shan Story liked: https://www.facebook.com/198875430209122/posts/840184029411589
90378,Mr. Ryan D. Henninger,E,View on Facebook: https://www.facebook.com/ryan.henninger.7,View on Twitter: https://twitter.com/Henningitis,
9196,Mrs. Sue Krayer,H,Sue Churchill Krayer reacted: https://www.facebook.com/86774348679/posts/10159069658903680
91866,Mr. Jim Sullivan,E,View on Facebook: https://www.facebook.com/jim.sullivan.9022,View on Linkedin: https://www.linkedin.com/in/jim-sullivan-84b57a2a,
91970,Mrs. Veronica Reyes,E,View on Facebook: https://www.facebook.com/veronica.reyes.581730,View on Linkedin: https://www.linkedin.com/in/vreyes1,View on Twitter: https://twitter.com/vr_sa,
92238,Mr. Alejandro "Alex" Cruz  Jr.,H,Alejandro Cruz liked: https://www.facebook.com/6147204570/posts/10158683816319571
92511,Mrs. April Elizabeth Slater,E,View on Facebook: https://www.facebook.com/april.slater.5,
92262,Mrs. Rose Mary (Rodriguez) Castro,H,View on Twitter: https://twitter.com/roastro7,Rose Mary Castro liked: https://www.facebook.com/187658316064/posts/10155744103371065
92469,Mrs. Thelma (Cavazos) Cavazos-Tribble,H,View on Linkedin: https://www.linkedin.com/in/thelma-cavazos-tribble-4584854a,View on Twitter: https://twitter.com/thelmab60,Thelma Cavazos-Tribble liked: https://www.facebook.com/86774348679/posts/10153077264798680
93685,Ms. Sulema C. Caballero,E,View on Facebook: https://www.facebook.com/sulema.caballero.71,View on Linkedin: https://www.linkedin.com/in/emma-sais-2752337a,View on Twitter: https://twitter.com/TECA1303,
94859,Mrs. Donna Marie (Adcock) Gonzalez,H,Donna Gonzalez liked: https://www.facebook.com/211969075486992/posts/3823217837695413
96247,Mrs. Vicki (Lindsey) Weber,H,View on Linkedin: https://www.linkedin.com/in/vicki-weber-bbb15565,Vicki Weber reacted: https://www.facebook.com/86774348679/posts/10159446897853680
96559,Ms. Julie Loftice Schwab,H,View on Linkedin: https://www.linkedin.com/in/julie-loftice-69a7ab28,Julie Loftice Schwab liked: https://www.facebook.com/6147204570/posts/10153656553084571
96661,Ms. Marie Therese Guajardo,E,View on Facebook: https://www.facebook.com/marie.guajardo.90,
97271,Mrs. Quinn Barraza,H,Quinn Barraza liked: https://www.facebook.com/331823501154/posts/387312661342968
97313,Mrs. Anita M. Brown,H,Anita Brown liked: https://www.facebook.com/211969075486992/posts/1010617078955517
97503,Mr. Sean Patrick Buck,H,View on Linkedin: https://www.linkedin.com/in/sean-buck-5528263,View on Twitter: https://twitter.com/buck_sean,Sean Buck reacted: https://www.facebook.com/211969075486992/posts/3383822188301649
97089,Mr. Rolando Campos  Jr.,H,View on Linkedin: https://www.linkedin.com/in/rolando-campos-b250652a,View on Twitter: https://twitter.com/RolandRole1978,Rolando Campos liked: https://www.facebook.com/211969075486992/posts/2598024913548051
97745,Mrs. Veronica M. De La Torre,H,Veronica De La Torre liked: https://www.facebook.com/211969075486992/posts/3747703838580147
97879,Mrs. Mary Helen Gentry,H,View on Linkedin: https://www.linkedin.com/in/darrel-gentry-33984256,View on Twitter: https://twitter.com/dtgentry3,Gary Gentry liked: https://www.facebook.com/6147204570/posts/10158791517919571
98279,Dr. Anne Hardgrove,E,View on Facebook: https://www.facebook.com/annehardgrove,View on Linkedin: https://www.linkedin.com/in/anne-hardgrove-02460714,
9933,Mr. Barry Alton Cravatt,H,View on Twitter: https://twitter.com/BarryCravatt,Barry Cravatt liked: https://www.facebook.com/211969075486992/posts/1850571834960033
